Mastodon,  Emperor of Sand, metal_737.jpeg,  https://i.scdn.co/image/3bf3bd6a4617dfeb8f5c4f16cd6c74ceeaba5d52, 174, 109, 76, #ae6d4c 
Mastodon,  Remission (Reissue), metal_738.jpeg,  https://i.scdn.co/image/6acf334651c71f5c5c1c20560efc2bc5625e4b6e, 36, 37, 44, #24252c 
Mastodon,  Once More 'Round The Sun, metal_739.jpeg,  https://i.scdn.co/image/fe29323c0ed0ce98a7f943ee4b7439379c450848, 120, 96, 63, #78603f 
Mastodon,  Once More 'Round The Sun, metal_740.jpeg,  https://i.scdn.co/image/a538f3e764f2d8ca1840d6f884c94e2e395a35f6, 121, 95, 62, #795f3e 
Mastodon,  Live at Brixton, metal_741.jpeg,  https://i.scdn.co/image/dcc6324a3f785d6d1ca46a3947bc16081df9ebb4, 47, 35, 34, #2f2322 
Mastodon,  The Hunter, metal_742.jpeg,  https://i.scdn.co/image/f6ca0918965edc19303b92e67610551bfe539c23, 165, 55, 34, #a53722 
Mastodon,  The Hunter, metal_743.jpeg,  https://i.scdn.co/image/f21fa9334017873e1c14cb35f4e2541b83e7f567, 164, 57, 36, #a43924 
Mastodon,  The Hunter, metal_744.jpeg,  https://i.scdn.co/image/bc137d9ad12168d0bed13fec3f49e9c2b2df7b83, 165, 55, 34, #a53722 
Mastodon,  Live At The Aragon, metal_745.jpeg,  https://i.scdn.co/image/37544468d6e3bd66ba561b50e2eb7d2fe0cf8d65, 34, 31, 27, #221f1b 
Mastodon,  Crack The Skye, metal_746.jpeg,  https://i.scdn.co/image/594d6659827b7dd605046f5ca38670335062a349, 90, 77, 69, #5a4d45 
Mastodon,  Crack The Skye (Deluxe Version), metal_747.jpeg,  https://i.scdn.co/image/594d6659827b7dd605046f5ca38670335062a349, 90, 77, 69, #5a4d45 
Mastodon,  Blood Mountain, metal_748.jpeg,  https://i.scdn.co/image/171539591cad63ffb1e4217e5320e5c6dc34710a, 107, 63, 42, #6b3f2a 
Mastodon,  Call of the Mastodon, metal_749.jpeg,  https://i.scdn.co/image/e8494bcc5cd5f29bc888adb1496bd42f223a5497, 85, 83, 79, #55534f 
Mastodon,  Leviathan, metal_750.jpeg,  https://i.scdn.co/image/e32ea4ea8249fe64799d0843230d4e0ed4b2faec, 116, 109, 110, #746d6e 
Mastodon,  Remission, metal_751.jpeg,  https://i.scdn.co/image/9774dc5898b7e88d0c9cc54d58a16705bdf1bb14, 52, 46, 49, #342e31 
Cradle Of Filth,  Cryptoriana - The Seductiveness Of Decay, metal_752.jpeg,  https://i.scdn.co/image/9446a25ae3778c61e1a439c0fc7927ae19875bb0, 58, 59, 61, #3a3b3d 
Sepultura,  Chaos A.D. (Expanded Edition), metal_753.jpeg,  https://i.scdn.co/image/894fa434d96df25a76e0b79a893596a88bb0dddf, 82, 84, 78, #52544e 
Sepultura,  Machine Messiah, metal_754.jpeg,  https://i.scdn.co/image/48c672d0bd165b56470bd26bccb6704ee142a07e, 108, 110, 103, #6c6e67 
Sepultura,  Machine Messiah, metal_755.jpeg,  https://i.scdn.co/image/61b5695873b8d7236e93cc11bc9f138b60ea9d6e, 108, 110, 103, #6c6e67 
Sepultura,  Machine Messiah, metal_756.jpeg,  https://i.scdn.co/image/4d18203aa1133c4c9f264212779237c7b75982bb, 104, 108, 99, #686c63 
Sepultura,  Machine Messiah, metal_757.jpeg,  https://i.scdn.co/image/0da48a0bada73d56fee42304c5bfbd5f6195c59f, 108, 110, 103, #6c6e67 
Sepultura,  Machine Messiah, metal_758.jpeg,  https://i.scdn.co/image/b34454d667ebfc1516dad3fc9a5c6ba97d1fca39, 108, 110, 103, #6c6e67 
Sepultura,  Machine Messiah, metal_759.jpeg,  https://i.scdn.co/image/e5e6ef6d74e05ff0b5fce201bba609e1ee0e9f31, 107, 109, 102, #6b6d66 
Sepultura,  Exodus & Sepultura: Elder Gods, metal_760.jpeg,  https://i.scdn.co/image/f5377ebb3673fc1bad789ac38308de81b7899b0f, 23, 47, 12, #172f0c 
Sepultura,  Minisserie Dupla Identidade, metal_761.jpeg,  https://i.scdn.co/image/0f060958c05403bd1a9473febf14cfdb9a44bb21, 56, 56, 56, #383838 
Sepultura,  Metal Veins - Alive At Rock In Rio (Live), metal_762.jpeg,  https://i.scdn.co/image/f31b6bf6a4deb69cff12d717cf65a77b3c814088, 105, 88, 88, #695858 
Sepultura,  Metal Veins - Alive at Rock in Rio, metal_763.jpeg,  https://i.scdn.co/image/6a73bbdb681db76945355c809b8dc580c3309d09, 103, 89, 89, #675959 
Sepultura,  The Mediator Between Head and Hands Must be the Heart, metal_764.jpeg,  https://i.scdn.co/image/a6936d453319f5f644ff56f805fa2cf38f653d8f, 59, 58, 51, #3b3a33 
Sepultura,  Kairos, metal_765.jpeg,  https://i.scdn.co/image/d2c2a22b2c8514be153646aaaeaf1f83eb460b7a, 98, 98, 98, #626262 
Sepultura,  Kairos, metal_766.jpeg,  https://i.scdn.co/image/65e64d0b465053bb0ea91dca9b51548d75eef93b, 98, 98, 98, #626262 
Sepultura,  A-lex, metal_767.jpeg,  https://i.scdn.co/image/d237d0b61d629150f88cd1048130bd5f9f41a83a, 21, 13, 8, #150d08 
Sepultura,  A-Lex, metal_768.jpeg,  https://i.scdn.co/image/9671de76272a1b90d6841633c2e9ebaa01eab7b5, 26, 14, 8, #1a0e08 
Sepultura,  A-Lex, metal_769.jpeg,  https://i.scdn.co/image/a369a72cddf56c408d2073ab64189c541a918e6c, 39, 35, 34, #272322 
Sepultura,  Dante XXI, metal_770.jpeg,  https://i.scdn.co/image/908cb6d62f210ff272d92c2225d95485ac055e4f, 140, 94, 76, #8c5e4c 
Sepultura,  Roorback, metal_771.jpeg,  https://i.scdn.co/image/30da0b1067ed102b09d88c306302b7a3b6a9ddc1, 159, 156, 163, #9f9ca3 
Sepultura,  Under A Pale Grey Sky, metal_772.jpeg,  https://i.scdn.co/image/5e2f2f72e198c5e4b4cb56e970525c2a645c8b72, 156, 29, 32, #9c1d20 
Sepultura,  Nation, metal_773.jpeg,  https://i.scdn.co/image/0270122fa92fa7f3e89721008babc37c32654453, 148, 92, 39, #945c27 
Sepultura,  Against, metal_774.jpeg,  https://i.scdn.co/image/57d121643ce63571e389da5a35f40f57f64684d0, 151, 116, 68, #977444 
Sepultura,  Against, metal_775.jpeg,  https://i.scdn.co/image/787b842df4cf1f1b1c6f61080a63e31c9c66df91, 150, 100, 58, #96643a 
Sepultura,  Blood-Rooted, metal_776.jpeg,  https://i.scdn.co/image/93627269a1806c5f9f0bc0c46d04622d83c7a800, 124, 30, 25, #7c1e19 
Sepultura,  Blood-Rooted, metal_777.jpeg,  https://i.scdn.co/image/4d2be645285ecdb6309720c6c9ae255931220eaa, 148, 41, 34, #942922 
Sepultura,  Roots, metal_778.jpeg,  https://i.scdn.co/image/83eb8318e1434ef2e39b4599fdd195b8303198f0, 108, 58, 45, #6c3a2d 
Sepultura,  Roots (Explicit Version), metal_779.jpeg,  https://i.scdn.co/image/9830f4b3f32fee8b00cf3b459490cdb798b8890e, 109, 57, 45, #6d392d 
Sepultura,  Chaos A.D. (Explicit Version / US Version), metal_780.jpeg,  https://i.scdn.co/image/44e7ec62dac6df7087587782c044cb0eb671558c, 32, 30, 32, #201e20 
Sepultura,  Chaos A.D. (Reissue), metal_781.jpeg,  https://i.scdn.co/image/023b595b9db0184401bbeaa3e414f129cf971cf2, 64, 71, 72, #404748 
Sepultura,  Arise [Explicit Version (Reissue)], metal_782.jpeg,  https://i.scdn.co/image/190e79866128671a95af600f29dac52b36bc3487, 160, 114, 89, #a07259 
Sepultura,  Arise (Reissue), metal_783.jpeg,  https://i.scdn.co/image/4ef318c202ddae3bf8500e6d99c76ec3e4590aee, 150, 108, 86, #966c56 
Sepultura,  Beneath The Remains (Reissue), metal_784.jpeg,  https://i.scdn.co/image/24ba490f0cd64ba1aa7cd5571de6b583a2c27caf, 27, 8, 6, #1b0806 
Sepultura,  Beneath The Remains (Reissue), metal_785.jpeg,  https://i.scdn.co/image/2f08ec97478f7f4f4b5ba6efea77847e39885403, 50, 31, 26, #321f1a 
Sepultura,  Schizophrenia, metal_786.jpeg,  https://i.scdn.co/image/9b55431cf6d6f2f5a5c69a4bd1efcc18060500d9, 53, 74, 101, #354a65 
Sepultura,  Schizophrenia (Reissue), metal_787.jpeg,  https://i.scdn.co/image/cfbeabeba6e3282e111a7dd09d304767a09b5fe7, 84, 73, 91, #54495b 
Sepultura,  Schizophrenia (Reissue), metal_788.jpeg,  https://i.scdn.co/image/58267cae0f71201abd50c5b1f2c6b73c07ce1cd4, 92, 83, 110, #5c536e 
Sepultura,  Morbid Visions / Bestial Devastation (Reissue), metal_789.jpeg,  https://i.scdn.co/image/de1f2eb9140001c164fdf43958c237cc02bf6dd9, 183, 115, 86, #b77356 
Sepultura,  Morbid Visions/Bestial Devastation (Reissue), metal_790.jpeg,  https://i.scdn.co/image/6eeea9d8a231602a5e1a8a5ad9b92fefe5eab3e0, 123, 79, 59, #7b4f3b 
Sepultura,  Morbid Visions _ Bestial Devastation, metal_791.jpeg,  https://i.scdn.co/image/def31513155423ac2fdd2a1d8b865c33e610e55a, 128, 61, 50, #803d32 
Blind Guardian,  Live Beyond the Spheres, metal_792.jpeg,  https://i.scdn.co/image/8198e1874eae77e75f82e2152396581daa23cdfa, 71, 67, 59, #47433b 
Blind Guardian,  Live Beyond the Spheres, metal_793.jpeg,  https://i.scdn.co/image/7165b5205f9adf85c4803b91d78f699c4eef5de3, 71, 67, 60, #47433c 
Blind Guardian,  Live Beyond the Spheres, metal_794.jpeg,  https://i.scdn.co/image/75fb5c78fac40c6db94dc2319adfce563ae31f63, 71, 67, 60, #47433c 
Blind Guardian,  Live Beyond the Spheres, metal_795.jpeg,  https://i.scdn.co/image/269c7e97767e5636db9542a5aada4f4f6638172c, 71, 67, 60, #47433c 
Blind Guardian,  Live Beyond The Spheres, metal_796.jpeg,  https://i.scdn.co/image/0dec98b02e767225f871eff93c6aba4f92073ab0, 71, 67, 60, #47433c 
Blind Guardian,  Beyond The Red Mirror, metal_797.jpeg,  https://i.scdn.co/image/3cfe0243b75ec4ec493b23bcbdf1394732763eb2, 54, 67, 70, #364346 
Blind Guardian,  Beyond the Red Mirror, metal_798.jpeg,  https://i.scdn.co/image/9ecbb751c88122fdc4bbd49ae339b6cb69dfeb14, 54, 67, 70, #364346 
Blind Guardian,  At the Edge of Time, metal_799.jpeg,  https://i.scdn.co/image/7590e56f9942c94807456344b4e124701c86ff1f, 65, 67, 61, #41433d 
Blind Guardian,  At The Edge Of Time (Deluxe Version), metal_800.jpeg,  https://i.scdn.co/image/70b7b75ba5c50214841662ad5bce72f9916d40d8, 61, 64, 58, #3d403a 
Blind Guardian,  At The Edge Of Time (deluxe bonus version), metal_801.jpeg,  https://i.scdn.co/image/c426b1de255b098a7af6313396181fe475b9902d, 62, 64, 58, #3e403a 
Blind Guardian,  At The Edge Of Time (Deluxe Bonus Version), metal_802.jpeg,  https://i.scdn.co/image/f305ef78dba5df66fb47744b2ace5091363a3ae8, 61, 63, 58, #3d3f3a 
Blind Guardian,  At The Edge Of Time (deluxe version), metal_803.jpeg,  https://i.scdn.co/image/c426b1de255b098a7af6313396181fe475b9902d, 62, 64, 58, #3e403a 
Blind Guardian,  At The Edge Of Time, metal_804.jpeg,  https://i.scdn.co/image/c426b1de255b098a7af6313396181fe475b9902d, 62, 64, 58, #3e403a 
Blind Guardian,  A Twist in the Myth, metal_805.jpeg,  https://i.scdn.co/image/c3d5b64e99a1e497c97b59be4e55c8e1c4921db8, 77, 64, 46, #4d402e 
Blind Guardian,  Tokyo Tales (Remastered 2007) [Live], metal_806.jpeg,  https://i.scdn.co/image/c881b2105ee26e824797ee2c2eedb04ba26c532e, 67, 47, 42, #432f2a 
Blind Guardian,  Somewhere Far Beyond (Remastered 2007), metal_807.jpeg,  https://i.scdn.co/image/67e4c68dfd9749435fdc563fa268b3cf0a00eabc, 74, 69, 73, #4a4549 
Blind Guardian,  Somewhere Far Beyond (Remastered 2007), metal_808.jpeg,  https://i.scdn.co/image/d9a145d3d06de9f785d275c1977eead787d486fc, 74, 69, 73, #4a4549 
Blind Guardian,  Somewhere Far Beyond (Remastered 2007), metal_809.jpeg,  https://i.scdn.co/image/87646bbabf3a38e55e6f10791479b8970d066423, 74, 69, 73, #4a4549 
Blind Guardian,  Somewhere Far Beyond (Remastered 2007), metal_810.jpeg,  https://i.scdn.co/image/3a0b4c6952c3452ca292933e68ec65aeed870db2, 74, 69, 73, #4a4549 
Blind Guardian,  Somewhere Far Beyond (remastered (2007)), metal_811.jpeg,  https://i.scdn.co/image/93291a4c26b66f955022030ec339c48ff4a5e733, 74, 69, 73, #4a4549 
Blind Guardian,  Tales from the Twilight World (Remastered 2007), metal_812.jpeg,  https://i.scdn.co/image/a8d806e9217fcf8e160541f81ed6b676f8ffe8d9, 73, 49, 36, #493124 
Blind Guardian,  Tales from the Twilight World (Remastered 2007), metal_813.jpeg,  https://i.scdn.co/image/f1591dbba33283719923bed780933edb2121c3cb, 73, 49, 36, #493124 
Blind Guardian,  Tales from the Twilight World (Remastered 2007), metal_814.jpeg,  https://i.scdn.co/image/d8b0eba92cad0617f2e7a50aab164093ce93f9aa, 73, 49, 36, #493124 
Blind Guardian,  Tales from the Twilight World (Remastered 2007), metal_815.jpeg,  https://i.scdn.co/image/6e4549f06b8929961501db30c6cac355e699d90f, 73, 49, 36, #493124 
Blind Guardian,  Tales From The Twilight World (Remastered (2007)), metal_816.jpeg,  https://i.scdn.co/image/2e0a4f53234979dd2bd9326d743bb2cc23a9a97a, 73, 49, 36, #493124 
Blind Guardian,  Follow the Blind (Remastered 2017), metal_817.jpeg,  https://i.scdn.co/image/d2bf9b3a0473ee3aa9845ba77aa7532cb5daa9d3, 76, 68, 63, #4c443f 
Blind Guardian,  Follow The Blind (remastered (2017)), metal_818.jpeg,  https://i.scdn.co/image/41ab50dafdf88bd670fa5d3c79f4c549dc14f3c6, 76, 68, 63, #4c443f 
Blind Guardian,  Battalions of Fear (Remastered 2017), metal_819.jpeg,  https://i.scdn.co/image/6e81096c40c18c2451d4ca86dea03c7c4ff4c727, 118, 95, 86, #765f56 
Blind Guardian,  Battalions Of Fear (remastered (2017)), metal_820.jpeg,  https://i.scdn.co/image/ea117ca464367777b076496e9f5c4e7fc0e9c6ba, 118, 95, 86, #765f56 
Trivium,  The Sin And The Sentence, metal_821.jpeg,  https://i.scdn.co/image/516269fd7db084ee49d0073dcec3f61341dd2c77, 54, 22, 23, #361617 
Trivium,  Ember To Inferno: Ab Initio, metal_822.jpeg,  https://i.scdn.co/image/f395e96083951fc54bd1525d1273280024fcff5a, 245, 244, 244, #f5f4f4 
Trivium,  Ember To Inferno: Ab Initio (Deluxe), metal_823.jpeg,  https://i.scdn.co/image/1ce7d9d20a7019d96088990c27909b6fdb3fcae8, 245, 244, 244, #f5f4f4 
Trivium,  Ember to Inferno: Ab Initio, metal_824.jpeg,  https://i.scdn.co/image/183fce6ea52b29bce6d6fff561107b61dc279fc1, 245, 244, 244, #f5f4f4 
Trivium,  Silence In The Snow (Special Edition), metal_825.jpeg,  https://i.scdn.co/image/ced2c500f9f7dfd3e638630ccd6d9526bda110d8, 223, 223, 223, #dfdfdf 
Trivium,  Silence In The Snow, metal_826.jpeg,  https://i.scdn.co/image/ced2c500f9f7dfd3e638630ccd6d9526bda110d8, 223, 223, 223, #dfdfdf 
Trivium,  Vengeance Falls, metal_827.jpeg,  https://i.scdn.co/image/b31d119e206a836d086f53aca304f78836fedd5b, 67, 81, 94, #43515e 
Trivium,  Vengeance Falls (Special Edition), metal_828.jpeg,  https://i.scdn.co/image/b31d119e206a836d086f53aca304f78836fedd5b, 67, 81, 94, #43515e 
Trivium,  In Waves, metal_829.jpeg,  https://i.scdn.co/image/5194f3860bd53aa613edcfc5ef09a995b599f049, 73, 73, 73, #494949 
Trivium,  In Waves (Special Edition), metal_830.jpeg,  https://i.scdn.co/image/5194f3860bd53aa613edcfc5ef09a995b599f049, 73, 73, 73, #494949 
Trivium,  Shogun, metal_831.jpeg,  https://i.scdn.co/image/1abee4e4a6eef76a93681bcceed91fc068a2680b, 80, 55, 54, #503736 
Trivium,  Shogun (Special Edition), metal_832.jpeg,  https://i.scdn.co/image/28c3df58917e50206db08ae954b19a75cd0370fe, 40, 36, 35, #282423 
Trivium,  Ascendancy (Special Edition Bonus Tracks), metal_833.jpeg,  https://i.scdn.co/image/dd2d7721cca224488729acc184573c0e517b3cdb, 58, 35, 20, #3a2314 
Trivium,  The Crusade, metal_834.jpeg,  https://i.scdn.co/image/df5f9fc16cab58853b6a451e5f1aa10380933113, 82, 70, 64, #524640 
Trivium,  The Crusade [Special Edition], metal_835.jpeg,  https://i.scdn.co/image/07d5d7068f08e9f1dba4333d4cd5a429f143ae8d, 81, 68, 62, #51443e 
Trivium,  Ascendancy (Commentary Version), metal_836.jpeg,  https://i.scdn.co/image/f234984b85de6ad7d8d1a767a28974e9ae1e0bd6, 62, 49, 32, #3e3120 
Trivium,  Ascendancy, metal_837.jpeg,  https://i.scdn.co/image/6cdec0398c604cf3ad695b15dab21d44dec6d8f6, 61, 49, 32, #3d3120 
Trivium,  Ascendancy [Special Edition], metal_838.jpeg,  https://i.scdn.co/image/c204fa7e55c62b6d7ef2d7a7858e2ac24c255021, 61, 46, 31, #3d2e1f 
Trivium,  Ember to Inferno, metal_839.jpeg,  https://i.scdn.co/image/510b6519f4c747ccde3d46136badc657706d9754, 105, 67, 40, #694328 
Trivium,  Ember To Inferno, metal_840.jpeg,  https://i.scdn.co/image/17216d5fa52c5d0611c0a3725c6d9cd45916d85c, 105, 67, 40, #694328 
Architects,  All Our Gods Have Abandoned Us, metal_841.jpeg,  https://i.scdn.co/image/826776fb6172afe7654e499a5c0fb085e6898625, 191, 191, 190, #bfbfbe 
Architects,  All Our Gods Have Abandoned Us, metal_842.jpeg,  https://i.scdn.co/image/06fcb2ae4920f7046b7a7b15a970a29e65bd2a90, 192, 192, 192, #c0c0c0 
Architects,  All Our Gods Have Abandoned Us, metal_843.jpeg,  https://i.scdn.co/image/06fcb2ae4920f7046b7a7b15a970a29e65bd2a90, 192, 192, 192, #c0c0c0 
Architects,  Lost Forever // Lost Together (Deluxe Edition), metal_844.jpeg,  https://i.scdn.co/image/759728e1f5489fb66124ec638ace577d4984dc0b, 22, 26, 26, #161a1a 
Architects,  Lost Forever / Lost Together, metal_845.jpeg,  https://i.scdn.co/image/99e108dc0f089f721909808d81ed71ebef2c49bc, 41, 41, 41, #292929 
Architects,  Lost Forever // Lost Together, metal_846.jpeg,  https://i.scdn.co/image/4921760a5d8af24828ec2aca385ef17014604eb6, 41, 41, 41, #292929 
Architects,  Lost Forever // Lost Together, metal_847.jpeg,  https://i.scdn.co/image/ec267a23c4f9d765aec7d7a2cb3af9affe543c7d, 41, 41, 41, #292929 
Architects,  Daybreaker (Deluxe Edition), metal_848.jpeg,  https://i.scdn.co/image/c9d6afca4c6c5ad453cdbee69fd3deebc6e06b08, 158, 179, 179, #9eb3b3 
Architects,  Daybreaker, metal_849.jpeg,  https://i.scdn.co/image/86195da05ad89ac288c7292502c27b3d8f27d066, 189, 190, 170, #bdbeaa 
Architects,  The Here and Now, metal_850.jpeg,  https://i.scdn.co/image/1f364c3f13cc657e4a569be4d06a583aca3114db, 128, 130, 118, #808276 
Architects,  The Here And Now, metal_851.jpeg,  https://i.scdn.co/image/781afee06c209bd60246bae92040b5c6c98d0c85, 127, 129, 118, #7f8176 
Architects,  Hollow Crown, metal_852.jpeg,  https://i.scdn.co/image/8e3c16f1ac59e4ebadbcbcbeb394e40da606c418, 43, 40, 34, #2b2822 
Architects,  Hollow Crown, metal_853.jpeg,  https://i.scdn.co/image/85a4fc98492a57a7d48729f9d82578f841a00b10, 40, 37, 31, #28251f 
Architects,  Ruin, metal_854.jpeg,  https://i.scdn.co/image/eaf38a9ec0e76618d7344eb94195192e4134d4d2, 78, 72, 59, #4e483b 
Architects,  Ruin, metal_855.jpeg,  https://i.scdn.co/image/8a21e292cfbc63ce8f823836fea5c7df4cc41736, 77, 72, 59, #4d483b 
Architects,  Nightmares, metal_856.jpeg,  https://i.scdn.co/image/364d314769c11ab056024e12fd2e25090e9b0061, 114, 98, 80, #726250 
Architects,  Nightmares, metal_857.jpeg,  https://i.scdn.co/image/06e34f541a490406a1d1f06f300dee0bde342f85, 109, 86, 68, #6d5644 
Bullet For My Valentine,  Venom, metal_858.jpeg,  https://i.scdn.co/image/8a0967118b2ef33ff3eeb129ddda4e768a64273d, 39, 39, 39, #272727 
Bullet For My Valentine,  Venom (Deluxe Edition), metal_859.jpeg,  https://i.scdn.co/image/61958d4d47ac50450d4849439febe564ce77e9dc, 49, 46, 42, #312e2a 
Bullet For My Valentine,  Temper Temper, metal_860.jpeg,  https://i.scdn.co/image/af0f542a6c354d33317a7e83344b0ac510d63e6d, 156, 143, 137, #9c8f89 
Bullet For My Valentine,  Temper Temper (Track By Track Commentary), metal_861.jpeg,  https://i.scdn.co/image/09021a7a1fd7317883d4bbe9216b5fc9eb54fc4e, 156, 143, 137, #9c8f89 
Bullet For My Valentine,  Fever (Tour Edition), metal_862.jpeg,  https://i.scdn.co/image/c63c567186b96dc92fd38bf2f6593100bc7fa55f, 83, 91, 88, #535b58 
Bullet For My Valentine,  Fever, metal_863.jpeg,  https://i.scdn.co/image/14953ba000b7b1c5fdffaf0a194179d8bede8a64, 83, 91, 88, #535b58 
Bullet For My Valentine,  Fever, metal_864.jpeg,  https://i.scdn.co/image/bbde489d04e70aaae63b6f3ff1d06668b3e19870, 76, 81, 80, #4c5150 
Bullet For My Valentine,  Fever, metal_865.jpeg,  https://i.scdn.co/image/413f648539a5d179decc5cd6a5d80c33bbedc812, 72, 89, 83, #485953 
Bullet For My Valentine,  Scream Aim Fire Deluxe Edition, metal_866.jpeg,  https://i.scdn.co/image/e471d1ad455b785a5bb089f77b5a9fe4e6749aac, 58, 54, 58, #3a363a 
Bullet For My Valentine,  Scream Aim Fire Deluxe Edition, metal_867.jpeg,  https://i.scdn.co/image/dd86b5fdf8357c9c87af65d56fa29336b9ed3743, 65, 53, 53, #413535 
Bullet For My Valentine,  The Poison (Deluxe Version), metal_868.jpeg,  https://i.scdn.co/image/7c6208595c51ea89f9322af9cbaefd0cb0dd89e3, 18, 40, 31, #12281f 
Bullet For My Valentine,  The Poison, metal_869.jpeg,  https://i.scdn.co/image/159d82a897744928f13be491d442169e1c524d67, 45, 21, 25, #2d1519 
Bullet For My Valentine,  The Poison, metal_870.jpeg,  https://i.scdn.co/image/159d82a897744928f13be491d442169e1c524d67, 45, 21, 25, #2d1519 
Bullet For My Valentine,  The Poison, metal_871.jpeg,  https://i.scdn.co/image/6e926bd15ed6dc199f2963238898e5335ecaf3e8, 42, 19, 23, #2a1317 
Bullet For My Valentine,  The Poison, metal_872.jpeg,  https://i.scdn.co/image/9b77150c9146b4cc97176c73cd9915b86023084c, 45, 21, 25, #2d1519 
Bullet For My Valentine,  The Poison, metal_873.jpeg,  https://i.scdn.co/image/9edae1a421ce20130a0c2293e5e97b239405a068, 42, 19, 23, #2a1317 
Alter Bridge,  Live At The O2 Arena, metal_874.jpeg,  https://i.scdn.co/image/746c03dd230ca4e3efe86cf4901c6bee9a8f4003, 136, 40, 36, #882824 
Alter Bridge,  Live At The O2 Arena, metal_875.jpeg,  https://i.scdn.co/image/bbec05e17e88dc36462fb7ee33ec61ebe6bda483, 132, 40, 39, #842827 
Alter Bridge,  Live at the O2 Arena, metal_876.jpeg,  https://i.scdn.co/image/c53075c3351671e600161948e5f03414e1bb29cb, 132, 40, 38, #842826 
Alter Bridge,  Live at the O2 Arena, metal_877.jpeg,  https://i.scdn.co/image/9cb95e9f91dfd43aeb926c1c7195062eb673a797, 136, 39, 36, #882724 
Alter Bridge,  Live at the O2 Arena + Rarities, metal_878.jpeg,  https://i.scdn.co/image/780c02d7aaa585424554c22839ec7b5067705d53, 136, 39, 36, #882724 
Alter Bridge,  The Last Hero, metal_879.jpeg,  https://i.scdn.co/image/867f9597cd55130a155f0fdd8ee7986497c11576, 128, 94, 80, #805e50 
Alter Bridge,  The Last Hero, metal_880.jpeg,  https://i.scdn.co/image/498afa6edce2e8f989b411c5c38faa3db9c5183d, 133, 98, 81, #856251 
Alter Bridge,  The Last Hero, metal_881.jpeg,  https://i.scdn.co/image/364d91bfb7953349705fc2eefaf33240b8c06d6c, 128, 94, 80, #805e50 
Alter Bridge,  The Last Hero, metal_882.jpeg,  https://i.scdn.co/image/6cb7fc0524fc2c9207e1b99616064b5cbc604fe8, 128, 94, 80, #805e50 
Alter Bridge,  Fortress, metal_883.jpeg,  https://i.scdn.co/image/638afca723c5a4b390ec5a5cf29b6dbf4113a5e1, 115, 96, 82, #736052 
Alter Bridge,  Fortress, metal_884.jpeg,  https://i.scdn.co/image/9de55390b59115e214b6c884e6fb062eccaf8fb6, 119, 99, 85, #776355 
Alter Bridge,  Live at Wembley-European Tour 2011 (Audio Version), metal_885.jpeg,  https://i.scdn.co/image/ee1a9a4a8e4f3865b4cb161d71d4bf29e00ae0d0, 135, 85, 41, #875529 
Alter Bridge,  AB III, metal_886.jpeg,  https://i.scdn.co/image/a79abb6cba4617ca0f68c53b7f9ef23b8f621bd7, 59, 59, 56, #3b3b38 
Alter Bridge,  AB III, metal_887.jpeg,  https://i.scdn.co/image/6b27f84af3bd762fa1500b6b376ce61b4618831e, 66, 65, 60, #42413c 
Alter Bridge,  AB III (Special Edition), metal_888.jpeg,  https://i.scdn.co/image/eb394aff0047ba02c2834aed42034749aa26e027, 106, 100, 88, #6a6458 
Alter Bridge,  Live From Amsterdam, metal_889.jpeg,  https://i.scdn.co/image/00db330a658654e13c104995788a09dd29d7308d, 213, 170, 66, #d5aa42 
Alter Bridge,  Live from Amsterdam 2008, metal_890.jpeg,  https://i.scdn.co/image/a4d59e61940126a030cefa8740abd6dfb371aee8, 196, 134, 62, #c4863e 
Alter Bridge,  Blackbird, metal_891.jpeg,  https://i.scdn.co/image/17db897450e1de7dfbb35277c0479047494e44db, 106, 111, 115, #6a6f73 
Alter Bridge,  Blackbird (UK-OZ-NZ Version), metal_892.jpeg,  https://i.scdn.co/image/971ddda7f849357e94434665b63019540a2dd9a9, 107, 112, 116, #6b7074 
Alter Bridge,  Blackbird, metal_893.jpeg,  https://i.scdn.co/image/a9195ab0c91cd537a86f2c42dab873845dfb7380, 112, 117, 119, #707577 
Alter Bridge,  Blackbird, metal_894.jpeg,  https://i.scdn.co/image/0d7e1d7b5e1cc70c6cd234add6f586f70bbc3d03, 111, 113, 116, #6f7174 
Alter Bridge,  One Day Remains, metal_895.jpeg,  https://i.scdn.co/image/961e6c60161580f1a9f865f3ff571d2bda2bb711, 98, 96, 71, #626047 
Alter Bridge,  One Day Remains, metal_896.jpeg,  https://i.scdn.co/image/13b9b4d70d113a85dd2e60d7812e7d7ec3b2558c, 97, 96, 71, #616047 
Arch Enemy,  Will To Power, metal_897.jpeg,  https://i.scdn.co/image/f2ea949ac100e05855e0142f64dba43ee82b7faa, 52, 32, 25, #342019 
Arch Enemy,  As The Stages Burn! (Live at Wacken 2016), metal_898.jpeg,  https://i.scdn.co/image/9b518c8c7181eeaf353204ec5359c453ec1753eb, 96, 62, 40, #603e28 
Arch Enemy,  Black Earth (Reissue), metal_899.jpeg,  https://i.scdn.co/image/7ddfd57b907d2ad5c5393e4b2add9d597f3e6a5c, 78, 75, 63, #4e4b3f 
Arch Enemy,  War Eternal, metal_900.jpeg,  https://i.scdn.co/image/7ccc8b66f70ed291ed62a04808848d639d8b10ea, 79, 73, 69, #4f4945 
Arch Enemy,  Khaos Legions, metal_901.jpeg,  https://i.scdn.co/image/51582e35832e110eb7689d6099bd551339be7d26, 63, 31, 23, #3f1f17 
Arch Enemy,  Manifesto of Arch Enemy, metal_902.jpeg,  https://i.scdn.co/image/90957ad471c4b9972a134a24bccd0ce4e60292d3, 126, 117, 107, #7e756b 
Arch Enemy,  The Root of All Evil, metal_903.jpeg,  https://i.scdn.co/image/e13d5e8abbccf7aa019cf7b290b8729af8c9f2f7, 99, 65, 57, #634139 
Arch Enemy,  Tyrants of the Rising Sun - Live in Japan, metal_904.jpeg,  https://i.scdn.co/image/f1ed79be9573ca2a4c76774d2cbac60167bd9256, 89, 75, 70, #594b46 
Arch Enemy,  Rise of the Tyrant, metal_905.jpeg,  https://i.scdn.co/image/f218e1d858f69044eab9f9b25d513cbfbbaa1810, 57, 44, 44, #392c2c 
Arch Enemy,  Doomsday Machine, metal_906.jpeg,  https://i.scdn.co/image/a9da34e96ef91c9614341bc1fec5424ab6b57ab8, 53, 51, 46, #35332e 
Arch Enemy,  Dead Eyes See No Future - EP, metal_907.jpeg,  https://i.scdn.co/image/5c323444a13f78ec0e1315b28398c48c5a7b3418, 46, 47, 31, #2e2f1f 
Arch Enemy,  Anthems of Rebellion, metal_908.jpeg,  https://i.scdn.co/image/0bca00632f837ee66fac9d99f1a442f5a227648f, 92, 97, 72, #5c6148 
Arch Enemy,  Wages of Sin, metal_909.jpeg,  https://i.scdn.co/image/0d90c091fc432f305ceed3bcce3bdc865f1756cb, 108, 48, 34, #6c3022 
Arch Enemy,  Burning Bridges (Reissue), metal_910.jpeg,  https://i.scdn.co/image/a751384a2e4bfd80e6c8644ae15c5cea561aea28, 189, 135, 62, #bd873e 
Arch Enemy,  Stigmata (Reissue), metal_911.jpeg,  https://i.scdn.co/image/079d67b5870072ff4aa35547e49f7d636f66f6af, 177, 178, 180, #b1b2b4 
Arch Enemy,  Black Earth, metal_912.jpeg,  https://i.scdn.co/image/a101df323505fe3ce37d1d6a9187a2b5e1747d50, 85, 80, 67, #555043 
Arch Enemy,  Black Earth, metal_913.jpeg,  https://i.scdn.co/image/9860b97e4dee4859bfd922d95c118e9a062c7df9, 76, 71, 68, #4c4744 
Machine Head,  Bloodstone & Diamonds, metal_914.jpeg,  https://i.scdn.co/image/f8b2a62d6e73279d598c32cae728eae45dea611c, 55, 49, 41, #373129 
Machine Head,  Bloodstone & Diamonds, metal_915.jpeg,  https://i.scdn.co/image/ac6f4d46ad043417233de6984dc1be31609f37ff, 56, 50, 41, #383229 
Machine Head,  Machine F**king Head Live (Special Edition), metal_916.jpeg,  https://i.scdn.co/image/4a3cec0aa806669e7dbc93b17a71abef3b655f67, 99, 63, 45, #633f2d 
Machine Head,  Machine F**king Head Live, metal_917.jpeg,  https://i.scdn.co/image/4a3cec0aa806669e7dbc93b17a71abef3b655f67, 99, 63, 45, #633f2d 
