Machine Head,  Unto The Locust, metal_918.jpeg,  https://i.scdn.co/image/f7f8adf9320a6685bd84e325ce97446e2d5f0882, 51, 52, 35, #333423 
Machine Head,  Unto The Locust (Special Edition), metal_919.jpeg,  https://i.scdn.co/image/f7f8adf9320a6685bd84e325ce97446e2d5f0882, 51, 52, 35, #333423 
Machine Head,  The Blackening, metal_920.jpeg,  https://i.scdn.co/image/bdfc109964355834078a0609e956ac0bf29f4705, 80, 80, 77, #50504d 
Machine Head,  The Blackening, metal_921.jpeg,  https://i.scdn.co/image/603d8caf6396b2da0a326bfc518dd6135fe34839, 49, 49, 49, #313131 
Machine Head,  Through The Ashes Of Empires, metal_922.jpeg,  https://i.scdn.co/image/13307d9b0bfaab31d8d2d24a016563b738960456, 132, 149, 153, #849599 
Machine Head,  Hellalive, metal_923.jpeg,  https://i.scdn.co/image/8f5ffd4efe3188f6e6053459d94f69abc02c231c, 67, 70, 39, #434627 
Machine Head,  Hellalive (Explicit), metal_924.jpeg,  https://i.scdn.co/image/a794792251c074f61b5083366181b450306de02b, 68, 70, 42, #44462a 
Machine Head,  Supercharger, metal_925.jpeg,  https://i.scdn.co/image/75fac38828a2d1a1d15f7eaabb02356623af485b, 135, 133, 108, #87856c 
Machine Head,  The Burning Red, metal_926.jpeg,  https://i.scdn.co/image/7fed8590c566ea9c48752dbfc37277be3ee70c95, 113, 16, 26, #71101a 
Machine Head,  The Burning Red (Explicit Version), metal_927.jpeg,  https://i.scdn.co/image/54d09d371db64f161d66263faecde68afc6f8272, 71, 19, 16, #471310 
Machine Head,  The More Things Change..., metal_928.jpeg,  https://i.scdn.co/image/35058f4e4fed9dd907ca1432785f82c8900957bf, 108, 87, 76, #6c574c 
Machine Head,  The More Things Change... (Explicit Version), metal_929.jpeg,  https://i.scdn.co/image/065bd110b817e364b45fdd356d05d78572b3b775, 101, 79, 70, #654f46 
Machine Head,  Burn My Eyes, metal_930.jpeg,  https://i.scdn.co/image/5d67b9d76cc42338b62dc7edb52894cc081d755b, 136, 85, 60, #88553c 
Machine Head,  Burn My Eyes (Explicit Version), metal_931.jpeg,  https://i.scdn.co/image/85a6e30c9b2ba8fc597142bfd985227935a29e60, 130, 71, 57, #824739 
Pantera,  The Great Southern Trendkill (20th Anniversary Edition), metal_932.jpeg,  https://i.scdn.co/image/88eef6b8126f2454f3762a3b9148dfb592eb6065, 117, 60, 40, #753c28 
Pantera,  Far Beyond Bootleg - Live From Donington '94, metal_933.jpeg,  https://i.scdn.co/image/99f8bb01cfec0308ea207d72d41c2d2b79f8235c, 72, 56, 50, #483832 
Pantera,  Far Beyond Driven (20th Anniversary Edition Deluxe), metal_934.jpeg,  https://i.scdn.co/image/3331f2d81d21facbeefe3d7d31e315e5c308b151, 47, 92, 108, #2f5c6c 
Pantera,  Cowboys From Hell (Deluxe), metal_935.jpeg,  https://i.scdn.co/image/c8d0f7f814b466459611ee6011635224f5b9c2e3, 136, 122, 100, #887a64 
Pantera,  Reinventing The Steel, metal_936.jpeg,  https://i.scdn.co/image/014cb4c5dd1910804b02a3fa4f161323b4a29711, 146, 108, 46, #926c2e 
Pantera,  Official Live: 101 Proof, metal_937.jpeg,  https://i.scdn.co/image/f75472b5099ba84ba68f0b2175923b53af24b30c, 46, 33, 24, #2e2118 
Pantera,  The Great Southern Trendkill, metal_938.jpeg,  https://i.scdn.co/image/fe0ff8d57c505a60bab604603bfb97290dcc4ef2, 137, 51, 17, #893311 
Pantera,  Far Beyond Driven, metal_939.jpeg,  https://i.scdn.co/image/038df23f44769b8d1695021b69d45e323b12e8e9, 40, 69, 91, #28455b 
Pantera,  Vulgar Display Of Power (US Release), metal_940.jpeg,  https://i.scdn.co/image/b84bd3d73fd768a7918d2caf7055806907a193b2, 82, 66, 64, #524240 
Pantera,  Cowboys From Hell, metal_941.jpeg,  https://i.scdn.co/image/260ec57a8ffade8261cf5b57123990626395c64f, 101, 79, 70, #654f46 
Apocalyptica,  Apocalyptica Plays Metallica By Four Cellos, metal_942.jpeg,  https://i.scdn.co/image/538ed989b9b6aeea1c4a69959ea9280a1e15d295, 187, 186, 182, #bbbab6 
Apocalyptica,  Plays Metallica by Four Cellos, metal_943.jpeg,  https://i.scdn.co/image/a31cd2f93b6fb17cd2a94576961e5169be926435, 183, 191, 183, #b7bfb7 
Killswitch Engage,  Incarnate, metal_944.jpeg,  https://i.scdn.co/image/e10db295c1aafb8a1c9a71bc44bf4e7b2f6b5a9a, 105, 91, 81, #695b51 
Killswitch Engage,  Disarm The Descent, metal_945.jpeg,  https://i.scdn.co/image/76feca6cfc42421132f72ec7d132f5ccfaefe07a, 134, 98, 70, #866246 
Killswitch Engage,  Disarm The Descent (Special Edition), metal_946.jpeg,  https://i.scdn.co/image/a4040e3a0be7893d9d98eb3c1e43b34d816b719f, 153, 138, 118, #998a76 
Killswitch Engage,  Killswitch Engage, metal_947.jpeg,  https://i.scdn.co/image/6911bbcae5521dd93d691994ab2585bddd06b6eb, 102, 88, 85, #665855 
Killswitch Engage,  Killswitch Engage [Special Edition], metal_948.jpeg,  https://i.scdn.co/image/daea9677851b770a6297677cc685d6012debff8b, 85, 75, 32, #554b20 
Killswitch Engage,  Killswitch Engage [Special Edition] [iTunes] (Worldwide Excl. US & Canada), metal_949.jpeg,  https://i.scdn.co/image/daea9677851b770a6297677cc685d6012debff8b, 85, 75, 32, #554b20 
Killswitch Engage,  As Daylight Dies, metal_950.jpeg,  https://i.scdn.co/image/d9a0f5bc80c13b3873a51906fc1ec9dbc557a315, 98, 102, 90, #62665a 
Killswitch Engage,  As Daylight Dies (Special Edition), metal_951.jpeg,  https://i.scdn.co/image/b7ee10741497fe45932e7a6f12600b3beb564364, 55, 48, 43, #37302b 
Killswitch Engage,  The End Of Heartache [Special Edition], metal_952.jpeg,  https://i.scdn.co/image/9d9e041f2cd75f1fdd46f4654acc3e46cbcbc829, 85, 68, 68, #554444 
Killswitch Engage,  The End Of Heartache, metal_953.jpeg,  https://i.scdn.co/image/c88adf61f3af023002ee1b8e163bc9a7860ff658, 84, 68, 67, #544443 
Killswitch Engage,  Alive Or Just Breathing, metal_954.jpeg,  https://i.scdn.co/image/18b6beb94d584949c111020865efa7d5a3d5d70d, 144, 110, 92, #906e5c 
Killswitch Engage,  Alive or Just Breathing, metal_955.jpeg,  https://i.scdn.co/image/909aacf92d22a2cf53b2c9d3a5e303e25ddd6684, 155, 126, 101, #9b7e65 
Killswitch Engage,  Alive or Just Breathing [Topshelf Edition], metal_956.jpeg,  https://i.scdn.co/image/fc694dc22c0df62fe6ad5fe510d4f7cfcd018b6d, 132, 110, 94, #846e5e 
Killswitch Engage,  Killswitch Engage, metal_957.jpeg,  https://i.scdn.co/image/87c2eb046c10e706e0f20d84f9f75327c7ec277b, 130, 161, 165, #82a1a5 
Disturbed,  Disturbed - Live at Red Rocks, metal_958.jpeg,  https://i.scdn.co/image/0ff2c929bf00790f714b55768f569fc80ee12699, 53, 34, 24, #352218 
Disturbed,  Disturbed - Live at Red Rocks, metal_959.jpeg,  https://i.scdn.co/image/61504c755574e88bcfed14051f35f78f1d81daad, 52, 33, 23, #342117 
Disturbed,  Immortalized, metal_960.jpeg,  https://i.scdn.co/image/0f0e46bdf41faaf955dc5d4dcc60177414a0704d, 96, 83, 75, #60534b 
Disturbed,  Immortalized, metal_961.jpeg,  https://i.scdn.co/image/7367a2a5e647f4f081717995f55395a389ef6dd7, 96, 82, 74, #60524a 
Disturbed,  Immortalized (Deluxe Version), metal_962.jpeg,  https://i.scdn.co/image/0f0e46bdf41faaf955dc5d4dcc60177414a0704d, 96, 83, 75, #60534b 
Disturbed,  The Lost Children, metal_963.jpeg,  https://i.scdn.co/image/ce55d4bf3a20c7716852d7e00236045aa6d08085, 65, 61, 68, #413d44 
Disturbed,  The Lost Children, metal_964.jpeg,  https://i.scdn.co/image/bfdd0bef7236ccaf03dc2f72902d21679afd2ede, 64, 60, 66, #403c42 
Disturbed,  Asylum, metal_965.jpeg,  https://i.scdn.co/image/14697511fc87c06e730e2ab3c3496619215420d0, 70, 57, 51, #463933 
Disturbed,  Asylum, metal_966.jpeg,  https://i.scdn.co/image/14697511fc87c06e730e2ab3c3496619215420d0, 70, 57, 51, #463933 
Disturbed,  Asylum (Deluxe), metal_967.jpeg,  https://i.scdn.co/image/68ade2f07821ee362786d16a3a9d70ce84c8f984, 72, 59, 52, #483b34 
Disturbed,  The Sickness 10th Anniversary Edition, metal_968.jpeg,  https://i.scdn.co/image/684896f889df80e20be26cf31832312cd3b9e08b, 73, 89, 89, #495959 
Disturbed,  Indestructible, metal_969.jpeg,  https://i.scdn.co/image/459b5e2caef1bbc87c472d6d549be6e295e02138, 90, 62, 37, #5a3e25 
Disturbed,  Indestructible, metal_970.jpeg,  https://i.scdn.co/image/459b5e2caef1bbc87c472d6d549be6e295e02138, 90, 62, 37, #5a3e25 
Disturbed,  Indestructible (Japanese Version), metal_971.jpeg,  https://i.scdn.co/image/a1f13067ff9b1a65623e734ecf53890d48fb835f, 90, 62, 37, #5a3e25 
Disturbed,  Ten Thousand Fists (Standard Edition), metal_972.jpeg,  https://i.scdn.co/image/e56552bbe33617bf4e68034f1e582d901c46e3a4, 113, 102, 96, #716660 
Disturbed,  Music As A Weapon II, metal_973.jpeg,  https://i.scdn.co/image/604b7b6bf8b7e6df821a57957f37993aea60845b, 79, 58, 50, #4f3a32 
Disturbed,  Believe (PA Version), metal_974.jpeg,  https://i.scdn.co/image/0b42ddc829650a2f2ca2b0b7926a800532a60831, 113, 60, 59, #713c3b 
Disturbed,  Believe (Amended Version), metal_975.jpeg,  https://i.scdn.co/image/c3d2c5a2b1bbea614be044b415c6d55c0662fc88, 113, 60, 59, #713c3b 
Disturbed,  The Sickness, metal_976.jpeg,  https://i.scdn.co/image/2f7cfa7d9f694b64c0cd3718bee5f1aab7354d3e, 117, 131, 121, #758379 
Disturbed,  The Sickness, metal_977.jpeg,  https://i.scdn.co/image/b60005e47782f04c622b8c1971467da7a947ca24, 132, 130, 112, #848270 
Hatebreed,  The Concrete Confessional, metal_978.jpeg,  https://i.scdn.co/image/84784901a3d3da6bdbbe1bae62743d8fabd08cd3, 47, 38, 39, #2f2627 
Hatebreed,  The Concrete Confessional, metal_979.jpeg,  https://i.scdn.co/image/9e116b8bba465a56b0968df3ad78f07c09566e84, 47, 38, 39, #2f2627 
Hatebreed,  The Concrete Confessional, metal_980.jpeg,  https://i.scdn.co/image/4a7b64df5b6e6165e48c8b22c199d56fa0e3ceca, 47, 38, 39, #2f2627 
Hatebreed,  The Divinity Of Purpose, metal_981.jpeg,  https://i.scdn.co/image/0e43356739b0fb96fab94c0f7f0ee6a2aa675442, 79, 57, 49, #4f3931 
Hatebreed,  The Rise Of Brutality, metal_982.jpeg,  https://i.scdn.co/image/5bc8ba26cdeb9c29738ba28c186a9564e6719398, 67, 67, 65, #434341 
Hatebreed,  The Rise of Brutality, metal_983.jpeg,  https://i.scdn.co/image/00307eaa66ae9ec49c0bc44c85aad70b7acadc0f, 66, 64, 59, #42403b 
Hatebreed,  The Rise of Brutality, metal_984.jpeg,  https://i.scdn.co/image/ae9ff02cd70428311d288d1c5bd7058fa65b3428, 65, 66, 63, #41423f 
Hatebreed,  Perseverance (Explicit Version), metal_985.jpeg,  https://i.scdn.co/image/77c1cd5c960cf407ab40f40db297b945d5575010, 89, 64, 42, #59402a 
Hatebreed,  Perseverance, metal_986.jpeg,  https://i.scdn.co/image/70ca455d80f68d87e4737ebd90324990b1a03a35, 88, 63, 41, #583f29 
Hatebreed,  Perseverance, metal_987.jpeg,  https://i.scdn.co/image/537e5518248e766452381a3b88db9d76556fecf5, 87, 62, 40, #573e28 
Hatebreed,  Perseverance (UK edition with 1 bonus track), metal_988.jpeg,  https://i.scdn.co/image/f3b8e490247bee6a688ea2f1aba9519a52704881, 117, 96, 75, #75604b 
Hatebreed,  Satisfaction Is the Death of Desire, metal_989.jpeg,  https://i.scdn.co/image/fbf74351b3fc1c2707189bdd5612c79c764e5c79, 150, 144, 162, #9690a2 
Hatebreed,  Under The Knife, metal_990.jpeg,  https://i.scdn.co/image/403e79ff011882b38954e1e5ec26a1923ec1a0a6, 150, 121, 99, #967963 
Hatebreed,  Under The Knife, metal_991.jpeg,  https://i.scdn.co/image/be8f2915bd79044f52613168e1610ce3197818ab, 117, 89, 71, #755947 
Shadows Fall,  Fire From The Sky, metal_992.jpeg,  https://i.scdn.co/image/b4442bd1521f3823c8f422a76703569963f9aaeb, 83, 67, 38, #534326 
Shadows Fall,  Fire From The Sky, metal_993.jpeg,  https://i.scdn.co/image/077ff9073798e2391ee0786d2fe26ab53f971beb, 83, 67, 38, #534326 
Shadows Fall,  Fire From The Sky, metal_994.jpeg,  https://i.scdn.co/image/324d986f0eff5909c73959138349e508382f95a2, 83, 67, 38, #534326 
Shadows Fall,  Madness In Manila: Shadows Fall Live In The Philippines 2009, metal_995.jpeg,  https://i.scdn.co/image/5584f91b66844eec4ed43fa604eeaa7bbaf0a263, 206, 138, 68, #ce8a44 
Shadows Fall,  Retribution, metal_996.jpeg,  https://i.scdn.co/image/0da0ff3a99fab42a9d7a152f55944df3f2c4ffc7, 56, 52, 35, #383423 
Shadows Fall,  Seeking the Way: The Greatest Hits, metal_997.jpeg,  https://i.scdn.co/image/631957e9e8758065a65089893d8d922d4183117a, 112, 104, 97, #706861 
Shadows Fall,  Threads Of Life, metal_998.jpeg,  https://i.scdn.co/image/986693976741bb6801e98d47ae3bfe07d8105d4f, 92, 98, 76, #5c624c 
Shadows Fall,  Fallout From the War, metal_999.jpeg,  https://i.scdn.co/image/fdc8d35c8b2acf87d73233ad18c57dbd11b978b1, 105, 88, 82, #695852 
Shadows Fall,  The War Within, metal_1000.jpeg,  https://i.scdn.co/image/69b1d71c90b603c884ae11b664f42cb46901250f, 99, 98, 99, #636263 
Shadows Fall,  Fear Will Drag You Down, metal_1001.jpeg,  https://i.scdn.co/image/e558fabd31e40a10b63dbc2eb440f3ce59e2567c, 72, 63, 52, #483f34 
Shadows Fall,  The Art Of Balance, metal_1002.jpeg,  https://i.scdn.co/image/6e27a215c8e6119097c98ba9ee35d8ecb0b17fac, 153, 145, 102, #999166 
Shadows Fall,  Of One Blood, metal_1003.jpeg,  https://i.scdn.co/image/3fadc655cf0e563e386286073b3f77c24d18e239, 42, 38, 27, #2a261b 
Shadows Fall,  Somber Eyes To The Sky, metal_1004.jpeg,  https://i.scdn.co/image/7efe5277d312e8c012086147bd806ff1e8036ae4, 100, 89, 69, #645945 
Avenged Sevenfold,  The Stage, metal_1005.jpeg,  https://i.scdn.co/image/8dceefcedf45356c85c0008782c8eb267038ee57, 50, 41, 59, #32293b 
Avenged Sevenfold,  The Stage, metal_1006.jpeg,  https://i.scdn.co/image/8dceefcedf45356c85c0008782c8eb267038ee57, 50, 41, 59, #32293b 
Avenged Sevenfold,  The Stage, metal_1007.jpeg,  https://i.scdn.co/image/1a75f74055fae07978896055c3a723f0ec0861a6, 204, 212, 194, #ccd4c2 
Avenged Sevenfold,  The Stage, metal_1008.jpeg,  https://i.scdn.co/image/baf7c59888ce36c73bd3347cc9eabcc3684ac605, 204, 212, 194, #ccd4c2 
Avenged Sevenfold,  Hail To The King: Deathbat (Original Video Game Soundtrack), metal_1009.jpeg,  https://i.scdn.co/image/640cac1e257805787f2ef279783784c86ce359ce, 36, 48, 67, #243043 
Avenged Sevenfold,  Waking The Fallen: Resurrected, metal_1010.jpeg,  https://i.scdn.co/image/eb9fe262a05ea3db106a1e430b756a5624ca8a9c, 109, 109, 109, #6d6d6d 
Avenged Sevenfold,  Hail to the King, metal_1011.jpeg,  https://i.scdn.co/image/d6fef16190f1516d0efe91c0d1bc6f28d8aa8865, 35, 35, 35, #232323 
Avenged Sevenfold,  Nightmare, metal_1012.jpeg,  https://i.scdn.co/image/22da875c060f901998e1f3518ab8fc08d814f926, 50, 67, 84, #324354 
Avenged Sevenfold,  Nightmare, metal_1013.jpeg,  https://i.scdn.co/image/5c40ab586f1a40092a20704195aaca9f990449a2, 50, 66, 83, #324253 
Avenged Sevenfold,  Avenged Sevenfold (Explicit Version), metal_1014.jpeg,  https://i.scdn.co/image/fc545ee7c8ae2baca43fb592078910fe0ca66e07, 236, 236, 236, #ececec 
Avenged Sevenfold,  Avenged Sevenfold, metal_1015.jpeg,  https://i.scdn.co/image/5ec10c00acd62ca49c65929d9188ed8ce6bbe7d3, 244, 244, 244, #f4f4f4 
Avenged Sevenfold,  City Of Evil (PA Version), metal_1016.jpeg,  https://i.scdn.co/image/88e04419e6cad4f11d2d25c08d9c5d1e87aa1371, 83, 64, 51, #534033 
Avenged Sevenfold,  City Of Evil (Non-PA Version), metal_1017.jpeg,  https://i.scdn.co/image/a36e2063659983384a65c0e7c642dce13232322b, 79, 60, 50, #4f3c32 
Avenged Sevenfold,  Waking The Fallen, metal_1018.jpeg,  https://i.scdn.co/image/edc7c9767d5db5d27a638d68ace6b4db8b616e0e, 21, 21, 21, #151515 
Avenged Sevenfold,  Sounding The Seventh Trumpet, metal_1019.jpeg,  https://i.scdn.co/image/324df75e87a75f4188ea6f907de9774c4962cede, 95, 79, 107, #5f4f6b 
Deftones,  Gore, metal_1020.jpeg,  https://i.scdn.co/image/badcad8d7a9f219115a0e97efb53a3fb1eadc178, 149, 130, 149, #958295 
Deftones,  Koi No Yokan, metal_1021.jpeg,  https://i.scdn.co/image/e565b912d1ef677110bd289bff82cd428577db13, 32, 19, 11, #20130b 
Deftones,  Koi No Yokan, metal_1022.jpeg,  https://i.scdn.co/image/1627852c32ca8f8f3247a94c5520d818eb711352, 31, 18, 9, #1f1209 
Deftones,  Covers, metal_1023.jpeg,  https://i.scdn.co/image/964d363046a148561bfe66c447ea74f43ed5bfc1, 130, 128, 127, #82807f 
Deftones,  Diamond Eyes, metal_1024.jpeg,  https://i.scdn.co/image/7dcf3a4f39b5c4084dcff2d0194d011bd73799f2, 112, 117, 114, #707572 
Deftones,  Diamond Eyes, metal_1025.jpeg,  https://i.scdn.co/image/f8412a557a26b522f720a2ae5018c023e4c0a983, 111, 117, 114, #6f7572 
Deftones,  Adrenaline, metal_1026.jpeg,  https://i.scdn.co/image/ade375636c4ac2b39d35979e5a94469bbc8e5066, 241, 231, 233, #f1e7e9 
DevilDriver,  Trust No One, metal_1027.jpeg,  https://i.scdn.co/image/f171fef93ae1cb226e54360887a9df02cbbfe29a, 76, 67, 57, #4c4339 
DevilDriver,  Trust No One, metal_1028.jpeg,  https://i.scdn.co/image/e4b1d29e3ead4828ff121cd3b524ba9ce3e0a535, 75, 64, 51, #4b4033 
DevilDriver,  Trust No One, metal_1029.jpeg,  https://i.scdn.co/image/efbf6d423364f68148cf05b3ee1ed3a074182b2e, 75, 64, 51, #4b4033 
DevilDriver,  Trust No One, metal_1030.jpeg,  https://i.scdn.co/image/419d2d3a5e442636967b351a600ec522a5ab47aa, 75, 64, 50, #4b4032 
DevilDriver,  Trust No One, metal_1031.jpeg,  https://i.scdn.co/image/80299ccea657b92a19d2a10f6b9acae8786acc74, 75, 64, 51, #4b4033 
DevilDriver,  Trust No One, metal_1032.jpeg,  https://i.scdn.co/image/b66168c5eac02d956c286837bedab3d5d0f395c0, 75, 64, 51, #4b4033 
DevilDriver,  Winter Kills, metal_1033.jpeg,  https://i.scdn.co/image/312c38b2a9490e5609f811455bb84093563f7903, 65, 71, 66, #414742 
DevilDriver,  Winter Kills, metal_1034.jpeg,  https://i.scdn.co/image/260a7a2dd368dd0ed028382439360411cef1d80e, 61, 66, 61, #3d423d 
DevilDriver,  Winter Kills, metal_1035.jpeg,  https://i.scdn.co/image/88d1f5eb776263782e7010f2df1c3870a388b6ef, 70, 68, 61, #46443d 
DevilDriver,  Beast, metal_1036.jpeg,  https://i.scdn.co/image/39004b21c4826dc2b438b1762657feeaaa88645e, 17, 17, 52, #111134 
DevilDriver,  Beast (Special Edition), metal_1037.jpeg,  https://i.scdn.co/image/89bd6df647dbb37a702cfde5f13baef666a152e4, 31, 17, 16, #1f1110 
DevilDriver,  Pray For Villains, metal_1038.jpeg,  https://i.scdn.co/image/cc11503a9bb9b4ecc4d2e7b9450f62022e281324, 169, 164, 155, #a9a49b 
DevilDriver,  Pray For Villains [Special Edition], metal_1039.jpeg,  https://i.scdn.co/image/e6330965a9fa45e87a924b2ff23057f6b7007e7d, 48, 54, 45, #30362d 
DevilDriver,  The Last Kind Words, metal_1040.jpeg,  https://i.scdn.co/image/f58345bc7dded3f13f8eaaea35390b5d8eace652, 87, 70, 34, #574622 
DevilDriver,  The Fury Of Our Maker's Hand, metal_1041.jpeg,  https://i.scdn.co/image/d3157801b89826da2975d9e5206f82f5c67dd9e6, 29, 30, 44, #1d1e2c 
DevilDriver,  The Fury Of Our Maker's Hand [Special Edition], metal_1042.jpeg,  https://i.scdn.co/image/ca78a47eead6e7a94f20379e5012ed7dfc39d49f, 34, 30, 50, #221e32 
DevilDriver,  DevilDriver, metal_1043.jpeg,  https://i.scdn.co/image/aa12ef4973ede27b5111185a3eed6177b2b1edcf, 214, 200, 164, #d6c8a4 
DevilDriver,  DevilDriver (Explicit Version), metal_1044.jpeg,  https://i.scdn.co/image/ca3331ef36cd030a82550cf355edc52e77b6d260, 206, 189, 158, #cebd9e 
Amon Amarth,  Jomsviking, metal_1045.jpeg,  https://i.scdn.co/image/9d1bbe23652537508d0741f66a6cc6f226696e61, 111, 140, 149, #6f8c95 
Amon Amarth,  Jomsviking, metal_1046.jpeg,  https://i.scdn.co/image/4a8761450747a194a9c022be52e1edbd74b3e94a, 123, 144, 154, #7b909a 
Amon Amarth,  Deceiver of the Gods, metal_1047.jpeg,  https://i.scdn.co/image/36dbb7633a075a0112965eeee81006f6debfc6c4, 89, 80, 83, #595053 
Amon Amarth,  Deceiver of the Gods, metal_1048.jpeg,  https://i.scdn.co/image/a4bd176fccc7bff32231325477a92953e50acbd9, 77, 79, 93, #4d4f5d 
Amon Amarth,  Surtur Rising, metal_1049.jpeg,  https://i.scdn.co/image/12e36a3f145df48c01a555c3d64382a6175ff572, 131, 71, 45, #83472d 
Amon Amarth,  Versus the World (Bonus Edition), metal_1050.jpeg,  https://i.scdn.co/image/e73885e1a4b899110a535d153d5d95e2b5b59dbc, 85, 48, 30, #55301e 
Amon Amarth,  Twilight Of The Thunder God, metal_1051.jpeg,  https://i.scdn.co/image/655d7f21d1e99d79de71818e00e5750e531c565d, 93, 79, 75, #5d4f4b 
Amon Amarth,  With Oden On Our Side, metal_1052.jpeg,  https://i.scdn.co/image/972af0688da028052166b3a98c443a11a7359cbb, 45, 28, 21, #2d1c15 
Amon Amarth,  Fate of Norns, metal_1053.jpeg,  https://i.scdn.co/image/43af65a6467003b456df09303709030a0cc422d8, 88, 63, 51, #583f33 
Amon Amarth,  Versus The World, metal_1054.jpeg,  https://i.scdn.co/image/e7eaddbcbed76ac1e95ca8212673f66e4c40e806, 109, 73, 45, #6d492d 
Amon Amarth,  The Crusher, metal_1055.jpeg,  https://i.scdn.co/image/37753fa5eb2d223ce6183dccef27df169d8ed957, 97, 58, 45, #613a2d 
Amon Amarth,  The Crusher (Bonus Edition), metal_1056.jpeg,  https://i.scdn.co/image/7559e97e48f0ba9b70b7f03b6f6b8d30abe1f2f6, 75, 41, 28, #4b291c 
Amon Amarth,  The Avenger (Bonus Edition), metal_1057.jpeg,  https://i.scdn.co/image/27d6911d0a2cdd186fc161ad0d06c539fe12b075, 83, 46, 31, #532e1f 
Amon Amarth,  The Avenger, metal_1058.jpeg,  https://i.scdn.co/image/5d98b123fbf90c9864ae98af162609f2d4eb2973, 115, 66, 43, #73422b 
Amon Amarth,  Once Sent From The Golden Hall (Bonus Edition), metal_1059.jpeg,  https://i.scdn.co/image/59e9fd1cb86adc3c00f400b75369d2ab4f3a90b1, 61, 37, 26, #3d251a 
Amon Amarth,  Once Sent From The Golden Hall, metal_1060.jpeg,  https://i.scdn.co/image/817f1cecc15fdf46ebdfac8f3e97ab803cf981f3, 48, 36, 34, #302422 
Periphery,  Periphery III: Select Difficulty, metal_1061.jpeg,  https://i.scdn.co/image/b4c20914ec773907bbf89f8aa81567b079703ff9, 155, 133, 103, #9b8567 
Periphery,  Periphery III: Select Difficulty, metal_1062.jpeg,  https://i.scdn.co/image/006aa4e5e13f1f9bdfc287e2fe618506ce19aea5, 158, 140, 116, #9e8c74 
Periphery,  Periphery III: Select Difficulty, metal_1063.jpeg,  https://i.scdn.co/image/52aa8fc5e9d469719a3abe431e0442c14ae22b6e, 159, 139, 111, #9f8b6f 
Periphery,  Periphery III: Select Difficulty, metal_1064.jpeg,  https://i.scdn.co/image/99def4a0f594492e2a403469eb1bf8c2ba2e5370, 160, 140, 111, #a08c6f 
Periphery,  Juggernaut: Alpha, metal_1065.jpeg,  https://i.scdn.co/image/2ad8a504df69b15ce4cc3cd4c2bd974594965493, 183, 173, 169, #b7ada9 
Periphery,  Juggernaut: Alpha, metal_1066.jpeg,  https://i.scdn.co/image/d2cc87c3169d8e84c130690853a78ec24bcab7f0, 183, 173, 169, #b7ada9 
Periphery,  Juggernaut: Omega, metal_1067.jpeg,  https://i.scdn.co/image/bc1dc6d8171d0b751ca41eabad77ce7f04299498, 157, 164, 164, #9da4a4 
Periphery,  Clear, metal_1068.jpeg,  https://i.scdn.co/image/662ad502286cff15b1593e8b0531e1884b8f945a, 204, 205, 195, #cccdc3 
Periphery,  Clear, metal_1069.jpeg,  https://i.scdn.co/image/51df55baf0ddeb085845adb3f88de070c36a0e74, 204, 205, 195, #cccdc3 
Periphery,  Clear (EP), metal_1070.jpeg,  https://i.scdn.co/image/153765c04886bc307699b201eec19e14043056da, 203, 205, 195, #cbcdc3 
Periphery,  Clear, metal_1071.jpeg,  https://i.scdn.co/image/54d308e243ac9331f9343ef1495b1f1a762d14fd, 203, 205, 195, #cbcdc3 
Periphery,  Periphery II, metal_1072.jpeg,  https://i.scdn.co/image/3dfe6cca2501421513ab9dba8d036f04944bff56, 32, 9, 10, #20090a 
Periphery,  Periphery II, metal_1073.jpeg,  https://i.scdn.co/image/f600b4e40338e0eef1fea85f7071a9bf0fefb275, 21, 6, 5, #150605 
Periphery,  Periphery II, metal_1074.jpeg,  https://i.scdn.co/image/181fdf5c224739f76ec7a299a7b97c0bf3be7472, 32, 9, 10, #20090a 
Periphery,  Periphery II, metal_1075.jpeg,  https://i.scdn.co/image/4c5fbd22a219fd04fca0552821880756185dc1a0, 30, 8, 9, #1e0809 
Periphery,  Icarus, metal_1076.jpeg,  https://i.scdn.co/image/bd7e71924cf52acd444d1a9b1517fe81939881f1, 46, 45, 51, #2e2d33 
Periphery,  Icarus Lives EP, metal_1077.jpeg,  https://i.scdn.co/image/ba5bc36a40033908a5e102c6484b2133673cab08, 46, 45, 51, #2e2d33 
Periphery,  Icarus EP, metal_1078.jpeg,  https://i.scdn.co/image/f913345457808941edca40d0f4b2fab6cd43ab5f, 46, 45, 51, #2e2d33 
Periphery,  Periphery (Special Edition), metal_1079.jpeg,  https://i.scdn.co/image/e12414071085dcbf4c387a3cf33b6bcc8cd4ab59, 23, 34, 33, #172221 
Periphery,  Periphery [Instrumental], metal_1080.jpeg,  https://i.scdn.co/image/c8d2002251564e2748216a6dd3358a524d62dede, 22, 32, 33, #162021 
Periphery,  Periphery, metal_1081.jpeg,  https://i.scdn.co/image/91e4c01d3d19fec32e28ab82ac483d68563a403a, 201, 219, 220, #c9dbdc 
Periphery,  Periphery, metal_1082.jpeg,  https://i.scdn.co/image/0704d001bd4a156b872dde539603150b63f53713, 212, 223, 224, #d4dfe0 
Periphery,  Periphery, metal_1083.jpeg,  https://i.scdn.co/image/34a3c6343d4cfe77aa8f9b10e88347f8aef34f2c, 204, 219, 221, #ccdbdd 
Periphery,  Periphery, metal_1084.jpeg,  https://i.scdn.co/image/070ad46628b8c2c558fa6a97b46b97290ce2dbc4, 204, 219, 221, #ccdbdd 
Protest The Hero,  Pacific Myth, metal_1085.jpeg,  https://i.scdn.co/image/13466180f6796a6ad3b5e01cbf7f90bdc30b35cb, 30, 45, 67, #1e2d43 
Protest The Hero,  Pacific Myth (Deluxe), metal_1086.jpeg,  https://i.scdn.co/image/f618337aa83eb8f20a85e98f2d9c8012132db168, 33, 47, 67, #212f43 
Protest The Hero,  Pacific Myth (Deluxe Edition), metal_1087.jpeg,  https://i.scdn.co/image/73d463a7827fdddd74c8c24cb1a44348c2452ed5, 33, 46, 66, #212e42 
Protest The Hero,  The Best of Protest the Hero, metal_1088.jpeg,  https://i.scdn.co/image/d27112309039f2f62ead6fa7bf6bb652c6a0e3b6, 54, 44, 42, #362c2a 
Protest The Hero,  Volition, metal_1089.jpeg,  https://i.scdn.co/image/fbcdd9d15eeade040ec1e35bf636ec67d5680fd3, 194, 189, 179, #c2bdb3 
Protest The Hero,  Volition, metal_1090.jpeg,  https://i.scdn.co/image/d6db562e943eb8589612254e34037d1b4627aa4b, 186, 181, 171, #bab5ab 
Protest The Hero,  Volition, metal_1091.jpeg,  https://i.scdn.co/image/bfaa92883d27985a3cb50d44fc32cf554052c22b, 186, 180, 169, #bab4a9 
Protest The Hero,  Scurrilous, metal_1092.jpeg,  https://i.scdn.co/image/c6848a15c48762f1526029a14ba0bbad602bad31, 105, 106, 96, #696a60 
Protest The Hero,  Gallop Meets the Earth (Live), metal_1093.jpeg,  https://i.scdn.co/image/f881874255fba95d93c3ae1f86af3051318cc4b2, 84, 62, 29, #543e1d 
Protest The Hero,  Gallop Meets The Earth, metal_1094.jpeg,  https://i.scdn.co/image/d6534a2b1c2446e7bdd64186d0838caa5c226acd, 86, 65, 33, #564121 
Protest The Hero,  Fortress, metal_1095.jpeg,  https://i.scdn.co/image/a8171b822405d8b82253f2d4089eadc02b1935b8, 124, 97, 89, #7c6159 
Protest The Hero,  Fortress, metal_1096.jpeg,  https://i.scdn.co/image/f1e5e71d9e2e3438940644bd6caa4040d0f2c0ad, 124, 98, 89, #7c6259 
Protest The Hero,  Fortress (Deluxe Edition), metal_1097.jpeg,  https://i.scdn.co/image/3f7c1dcf346f4cb67e96fa5c85540ebb4950761a, 124, 98, 91, #7c625b 
Protest The Hero,  Fortress (Canada), metal_1098.jpeg,  https://i.scdn.co/image/631e93c45c6eb623cd993c586fcbfd935bbb1578, 121, 97, 84, #796154 
Protest The Hero,  Kezia (Remaster), metal_1099.jpeg,  https://i.scdn.co/image/b9c6d2d47f8b054a6205a5dc6abe8d81b26b3a8f, 25, 25, 25, #191919 
