Motörhead,  Ace of Spades, metal_438.jpeg,  https://i.scdn.co/image/2e995954df7886278826654a0dfd92ef864f5f4c 
Motörhead,  Ace Of Spades (Rarities Edition), metal_439.jpeg,  https://i.scdn.co/image/8a56b43eb4f46589edb8c20279cfc76c7c0dbfe4 
Motörhead,  Ace of Spades (Rarities Edition), metal_440.jpeg,  https://i.scdn.co/image/c244755842a6f0923123ceb9178c9a8e1285a415 
Motörhead,  Ace of Spades, metal_441.jpeg,  https://i.scdn.co/image/9e12f8d9115a952a9acb6f1b312f21c460332f73 
Motörhead,  Bomber (Deluxe Edition), metal_442.jpeg,  https://i.scdn.co/image/c74d4b2681ef6e317e08898cd40be75e1715f3ee 
Motörhead,  Bomber (Bonus Track Edition), metal_443.jpeg,  https://i.scdn.co/image/8841ed7d4d1ab6f8159305b84f9e75f559a9af50 
Motörhead,  No Class, metal_444.jpeg,  https://i.scdn.co/image/f17ed6568f9b3d4ecfccdaab0c91443dd5ae3ac7 
Motörhead,  Overkill (Deluxe Edition), metal_445.jpeg,  https://i.scdn.co/image/97b54678c2d9c31022978dc62daad77811a8713a 
Motörhead,  Overkill (Expanded Bonus Track Edition), metal_446.jpeg,  https://i.scdn.co/image/bf1845a8f7a887cb42bc24158f10709366348897 
Motörhead,  Overkill (Bonus Track Edition), metal_447.jpeg,  https://i.scdn.co/image/2e373ebd43ba7ef5f18c662d9f35077131ec0953 
Motörhead,  Motorhead, metal_448.jpeg,  https://i.scdn.co/image/97f51ad6ce0b18f28d02d987cce3bc64409ad5f0 
Judas Priest,  Turbo 30 (Remastered 30th Anniversary Deluxe Edition), metal_449.jpeg,  https://i.scdn.co/image/e532c350221f015f4e6a878a1cbce7bf535c3ecc 
Judas Priest,  Battle Cry, metal_450.jpeg,  https://i.scdn.co/image/6533386fae955850aa91006de0bb95731196e321 
Judas Priest,  The Essential Judas Priest, metal_451.jpeg,  https://i.scdn.co/image/c187133a3686dd458eb1334994e22da158c02d42 
Judas Priest,  Redeemer of Souls (Deluxe), metal_452.jpeg,  https://i.scdn.co/image/319928b2bd5a0d23280b8443f6bf70aa7acd46bf 
Judas Priest,  Redeemer of Souls (Track by Track), metal_453.jpeg,  https://i.scdn.co/image/98e3d5eaf1532ede335417c999ed877344ca0795 
Judas Priest,  Nostradamus, metal_454.jpeg,  https://i.scdn.co/image/39d48dc23c594977d0aa985add38f1b22e281916 
Judas Priest,  Angel Of Retribution, metal_455.jpeg,  https://i.scdn.co/image/a5d3cfa3618ab5b67a5aaeb7890a3b5bace3db2a 
Judas Priest,  Demolition (Explicit Version), metal_456.jpeg,  https://i.scdn.co/image/d139a182773df74e5f0231c8bcb7b8e8c1c4a35e 
Judas Priest,  Demolition (Clean Version), metal_457.jpeg,  https://i.scdn.co/image/b93cffcf5d72023ff69bd881b04b3eafbee2d83a 
Judas Priest,  Priest... Live & Rare!, metal_458.jpeg,  https://i.scdn.co/image/6cdb2597adaeace59195ba2a5591b31a638c58b6 
Judas Priest,  Painkiller, metal_459.jpeg,  https://i.scdn.co/image/d9b728446d892db1627ef5c1f1f6990d934e2517 
Judas Priest,  Ram It Down, metal_460.jpeg,  https://i.scdn.co/image/683805583adada0d66480f9e4f0967d1824857cd 
Judas Priest,  Living After Midnight, metal_461.jpeg,  https://i.scdn.co/image/771d770202a1864721b31eb1bb9252a2e802c52d 
Judas Priest,  Priest...Live!, metal_462.jpeg,  https://i.scdn.co/image/abb24c2e6a3b506baa06717ee65800e7a0eca3eb 
Judas Priest,  Defenders Of The Faith, metal_463.jpeg,  https://i.scdn.co/image/3b62ca1426d8a53aa2be4a9955d39e3bc272ca57 
Judas Priest,  Defenders of the Faith (30th Anniversary Edition) [Remastered], metal_464.jpeg,  https://i.scdn.co/image/e33ae9567736c7ecee5a7ea46e37f47493b9f9da 
Judas Priest,  Screaming For Vengeance, metal_465.jpeg,  https://i.scdn.co/image/25e2b6f33844c92542321bb5c234e801c408beb8 
Judas Priest,  Screaming For Vengeance Special 30th Anniversary Edition, metal_466.jpeg,  https://i.scdn.co/image/29584987c6ffeaa80aac8b433a66a08e000c626a 
Judas Priest,  Point Of Entry, metal_467.jpeg,  https://i.scdn.co/image/5137b91152d671c63738af174c259facfcb8a33b 
Judas Priest,  British Steel, metal_468.jpeg,  https://i.scdn.co/image/2ef222e7f031aefc4b52cb1ec077e2e85b068819 
Judas Priest,  Killing Machine, metal_469.jpeg,  https://i.scdn.co/image/5eb2a9964817089cf1bebfd08caecdbd3a01dd50 
Judas Priest,  Hell Bent For Leather, metal_470.jpeg,  https://i.scdn.co/image/07137531f53b036c61d13e7e0e586a31d2893c11 
Judas Priest,  Unleashed In The East, metal_471.jpeg,  https://i.scdn.co/image/85c07c70737364fdd6a4e5831788f4b5249f5ae5 
Judas Priest,  Stained Class, metal_472.jpeg,  https://i.scdn.co/image/c267e253ec02b5d2ba0a90ea209d6dc8bbcb1558 
Judas Priest,  Sin After Sin, metal_473.jpeg,  https://i.scdn.co/image/d3350455b96b92f8b793aafa63bfc277e23361d4 
Judas Priest,  Sad Wings Of Destiny, metal_474.jpeg,  https://i.scdn.co/image/c0af22e10fbb145510e445d1c8c05a00d373a8e3 
Judas Priest,  Rocka Rolla, metal_475.jpeg,  https://i.scdn.co/image/0489282c5d81a4dd23ce036d020e912f613a490a 
Five Finger Death Punch,  Got Your Six (Deluxe Version), metal_476.jpeg,  https://i.scdn.co/image/4925176f12cc0154c5b0c44a4a4985f1acb2abaa 
Five Finger Death Punch,  Got Your Six, metal_477.jpeg,  https://i.scdn.co/image/bbe1118221915e7577e0c8fca266a9728fc7e4ba 
Five Finger Death Punch,  Got Your Six, metal_478.jpeg,  https://i.scdn.co/image/4925176f12cc0154c5b0c44a4a4985f1acb2abaa 
Five Finger Death Punch,  Got Your Six, metal_479.jpeg,  https://i.scdn.co/image/f1ad4a50d8fd52f19b1f36b5a632c10fe23640c6 
Five Finger Death Punch,  Got Your Six (Deluxe), metal_480.jpeg,  https://i.scdn.co/image/ef674140becd36869f59ec3b2a822f3a70d6c16f 
Five Finger Death Punch,  Got Your Six, metal_481.jpeg,  https://i.scdn.co/image/ef674140becd36869f59ec3b2a822f3a70d6c16f 
Five Finger Death Punch,  Got Your Six, metal_482.jpeg,  https://i.scdn.co/image/a10c0ca245b286a88414f4eb49c6993cb25b6cb4 
Five Finger Death Punch,  The Wrong Side Of Heaven & The Righteous Side Of Hell Vol.2, metal_483.jpeg,  https://i.scdn.co/image/74ce2e3b1172607a23759a919e3fc323404aa350 
Five Finger Death Punch,  The Wrong Side Of Heaven & The Righteous Side Of Hell, metal_484.jpeg,  https://i.scdn.co/image/3e2c4152d922ca4645ab1c54d2e495a00003c096 
Five Finger Death Punch,  American Capitalist, metal_485.jpeg,  https://i.scdn.co/image/9711b3405eeb065524d6ae82ec2bbd50b25e5e85 
Five Finger Death Punch,  American Capitalist, metal_486.jpeg,  https://i.scdn.co/image/9711b3405eeb065524d6ae82ec2bbd50b25e5e85 
Five Finger Death Punch,  American Capitalist, metal_487.jpeg,  https://i.scdn.co/image/adb3e9f065236c2e69de4bb9d5e93690dc885b6d 
Five Finger Death Punch,  War Is The Answer, metal_488.jpeg,  https://i.scdn.co/image/6edf501f44a9c33fc612c9f0f845bd8dbcaf67f9 
Five Finger Death Punch,  War Is The Answer, metal_489.jpeg,  https://i.scdn.co/image/6edf501f44a9c33fc612c9f0f845bd8dbcaf67f9 
Five Finger Death Punch,  War Is the Answer, metal_490.jpeg,  https://i.scdn.co/image/d0c5791f565ae9fbacfc3eb2ce59c1b0a2495bec 
Five Finger Death Punch,  The Way of the Fist, metal_491.jpeg,  https://i.scdn.co/image/1a2a2604373c0058fd6bdbb89bf010bb58609374 
Five Finger Death Punch,  The Way of the Fist, metal_492.jpeg,  https://i.scdn.co/image/7f658b3e64e25cc03852ee52653f68ae2c34ca08 
Gojira,  Magma, metal_493.jpeg,  https://i.scdn.co/image/46237eb5795f31f7c6ccc9033faa927124b3ab0f 
Gojira,  L'Enfant Sauvage, metal_494.jpeg,  https://i.scdn.co/image/820b3b3204c0931f52f371a0cedb626fd7262c47 
Gojira,  L'Enfant Sauvage (Special Edition), metal_495.jpeg,  https://i.scdn.co/image/820b3b3204c0931f52f371a0cedb626fd7262c47 
Gojira,  Les Enfants Sauvages, metal_496.jpeg,  https://i.scdn.co/image/58d2ecf500ae29946601086ba1f808a81faf4d74 
Gojira,  The way of all flesh, metal_497.jpeg,  https://i.scdn.co/image/8de5c8e05f7113c1b5c9acca05409c9f6f0cf307 
Gojira,  The Way of all Flesh, metal_498.jpeg,  https://i.scdn.co/image/f88cbf423e24d65b00374533b82dd59dc2ba6114 
Gojira,  The Way Of All Flesh, metal_499.jpeg,  https://i.scdn.co/image/cdc0687fe3d70a0e835bff4afd731646749c4ed3 
Gojira,  From Mars to Sirius, metal_500.jpeg,  https://i.scdn.co/image/6434c00ead958c6051cbaae3f7094050fca6c253 
Gojira,  From Mars To Sirius, metal_501.jpeg,  https://i.scdn.co/image/e6768fd11483a670401905ac7d0bc24136675acd 
Gojira,  From mars to sirius, metal_502.jpeg,  https://i.scdn.co/image/6434c00ead958c6051cbaae3f7094050fca6c253 
Gojira,  From Mars to Sirius, metal_503.jpeg,  https://i.scdn.co/image/221b1a7db657ed4fb8e4ed95337dab3615f720e7 
Gojira,  The Link Alive, metal_504.jpeg,  https://i.scdn.co/image/2d4c06b5319e54fa332cc3aa0decdecabed4a3fb 
Gojira,  The Link Alive, metal_505.jpeg,  https://i.scdn.co/image/8f157a45772679d56ba5718ba3ce6215f6c6de6d 
Gojira,  The Link Alive, metal_506.jpeg,  https://i.scdn.co/image/9a412d3463a12c0fe68acfbde42d28bd298b58e2 
Gojira,  The Link, metal_507.jpeg,  https://i.scdn.co/image/f9067da016e1efd09d19ebd4ce07b6021357ea84 
Gojira,  The link, metal_508.jpeg,  https://i.scdn.co/image/f9067da016e1efd09d19ebd4ce07b6021357ea84 
Gojira,  The Link, metal_509.jpeg,  https://i.scdn.co/image/4398d01bb6c9d6007259d9d12e7442b600816041 
Gojira,  The Link, metal_510.jpeg,  https://i.scdn.co/image/56e217d0a2c84b70aa775f6ef7f1149ab7081148 
Gojira,  Terra Incognita (2016), metal_511.jpeg,  https://i.scdn.co/image/e9377280de259a0d1b2a476965425ea09394fd6c 
Gojira,  Terra Incognita, metal_512.jpeg,  https://i.scdn.co/image/9ccd764388b90fbd7091f811468fdf005bd24c94 
Gojira,  Terra Incognita, metal_513.jpeg,  https://i.scdn.co/image/51b7de82aab5125b8c0287eae71cfd30645c9a42 
Helloween,  Ride the Sky: The Very Best of 1985-1998, metal_514.jpeg,  https://i.scdn.co/image/1fc5f4de556d55f7bd4fd5706fa6fa06bcf5033c 
Helloween,  Live on 3 Continents, metal_515.jpeg,  https://i.scdn.co/image/9fe7a338f6301a18d8a3a9a281ca8115faaf68e8 
Helloween,  Live on 3 Continents, metal_516.jpeg,  https://i.scdn.co/image/15182ece206d5bbd1307e965db1a33038ede89ee 
Helloween,  Live on 3 Continents, metal_517.jpeg,  https://i.scdn.co/image/51194befbd55d0aa4f756e32dc8724846582687c 
Helloween,  Live on 3 Continents, metal_518.jpeg,  https://i.scdn.co/image/6c98946daed280e5e9890f381aab7d70bb9abeed 
Helloween,  My God-Given Right (Track Commentary Version), metal_519.jpeg,  https://i.scdn.co/image/f9c64bcd513e345de36e4f5ed0d685450a3a6bf9 
Helloween,  My God-Given Right (Track Commentary Version), metal_520.jpeg,  https://i.scdn.co/image/140ebffef4802a4530bb55e9068b466aba10efb9 
Helloween,  Keeper of the Seven Keys: The Legacy, metal_521.jpeg,  https://i.scdn.co/image/6ba76a98f55b91cbb549d5664273f3e5a3d16b86 
Helloween,  Rabbit Don't Come Easy, metal_522.jpeg,  https://i.scdn.co/image/7c59986fa3663749e6a7c066f552f353cd6be57c 
Helloween,  Rabbit don't come easy, metal_523.jpeg,  https://i.scdn.co/image/2087cb0d8cc10bd88c62686591b0bef4f9872112 
Helloween,  Rabbit don't come easy, metal_524.jpeg,  https://i.scdn.co/image/038d86193cf0feab724cf8551f39f9314dbebeaf 
Helloween,  Rabbit don't come easy, metal_525.jpeg,  https://i.scdn.co/image/e19e64aa2fe7e3745d98499011201e1a07f0aa7b 
Helloween,  The Dark Ride, metal_526.jpeg,  https://i.scdn.co/image/5e953b3409503b1698f6ca98d27834d90ed524fe 
Helloween,  The Dark Ride, metal_527.jpeg,  https://i.scdn.co/image/528b43020e51416e0207d7640812b6d5405cf548 
Helloween,  The Dark Ride, metal_528.jpeg,  https://i.scdn.co/image/dcf5996171c6082f0ab6e885cb9268743c241100 
Helloween,  The Dark Ride, metal_529.jpeg,  https://i.scdn.co/image/6c606b4cf623e7c8a49160875aa07523ca1ea42b 
Helloween,  Metal Jukebox, metal_530.jpeg,  https://i.scdn.co/image/ffb5e8cafb47cceeadbb7d37a4f00a1a5171d280 
Helloween,  Better Than Raw (Expanded Edition), metal_531.jpeg,  https://i.scdn.co/image/bcade3720b7a2b713af80799b627a2976bceb2de 
Helloween,  High Live, metal_532.jpeg,  https://i.scdn.co/image/551818ec06059e07e0f2bcdd8f61a3fff158b520 
Helloween,  The Time of the Oath, metal_533.jpeg,  https://i.scdn.co/image/6e2f9509ffe1f9e76c9dbb7045d5bb0dac37264f 
Helloween,  The Time of the Oath, metal_534.jpeg,  https://i.scdn.co/image/103e824482530a05103a20538ee23bedeb8f48b2 
Helloween,  Master of the Rings (Expanded Edition), metal_535.jpeg,  https://i.scdn.co/image/ba5f6f40762ed65e22e1ea60432dd50117c547a0 
Helloween,  Master of the Rings, metal_536.jpeg,  https://i.scdn.co/image/53489f7c9459fd3f90a8bfef469bf79e885dd701 
Helloween,  Chameleon, metal_537.jpeg,  https://i.scdn.co/image/20b3f82360cfb02fac6debafc11cc7c7a58eeeab 
Helloween,  Pink Bubbles Go Ape (Expanded Edition), metal_538.jpeg,  https://i.scdn.co/image/be2ef581cbb2743f5cc6fc15fddec6de4e8c198f 
Helloween,  Walls of Jericho (Bonus Tracks Edition), metal_539.jpeg,  https://i.scdn.co/image/c9dfcb70eae7c78a07828bf5a7686472a6dfab3a 
Helloween,  Walls of Jericho, metal_540.jpeg,  https://i.scdn.co/image/c9dfcb70eae7c78a07828bf5a7686472a6dfab3a 
Nightwish,  Nightwish at Rock Werchter Festival 2008 (Live), metal_541.jpeg,  https://i.scdn.co/image/9bd35bfa5aa4f9d562363227cede4723f29289c0 
Nightwish,  Vehicle Of Spirit: Wembley Arena (Live), metal_542.jpeg,  https://i.scdn.co/image/adef73bc76a8470245766f41d788693600d175bf 
Nightwish,  Vehicle of Spirit: Wembley Arena (Live), metal_543.jpeg,  https://i.scdn.co/image/a278592f4bdeded035298b3c60d9b7f26c8bb797 
Nightwish,  Vehicle Of Spirit: Wembley Arena (Live), metal_544.jpeg,  https://i.scdn.co/image/3c4b3cdb75bce5090ada703e43e316c2f79e09e3 
Nightwish,  The Sound Of Nightwish Reborn, metal_545.jpeg,  https://i.scdn.co/image/c2d1fa0b92ab6d8ad6514ed06102b7c0a9119594 
Nightwish,  Amaranth, metal_546.jpeg,  https://i.scdn.co/image/94670bdaaa93f6fb6bdc1d613fe0c8a588ac1476 
Nightwish,  'The Sounds of Nightwish Reborn: Early Demos for "Dark Passion Play" and B-Sides', metal_547.jpeg,  https://i.scdn.co/image/d662dd01f4afc706cdaf325af39c122940aaa50c 
Nightwish,  Dark Passion Play, metal_548.jpeg,  https://i.scdn.co/image/dc0d67d9d25902be8eedb69d30d384f738f9cb14 
Nightwish,  Dark Passion Play, metal_549.jpeg,  https://i.scdn.co/image/0fe67397a7ae4a3b908cdae152c343fed8fe29d9 
Nightwish,  Dark Passion Play (Finnish Limited Edition), metal_550.jpeg,  https://i.scdn.co/image/fa1fa3babc6187bb14c0f9f1aaf8f4efa4b38184 
Nightwish,  Dark Passion Play, metal_551.jpeg,  https://i.scdn.co/image/e9edba37835a98d52dd8b39e04e068cd88390686 
Nightwish,  Dark Passion Play (Finnish Version), metal_552.jpeg,  https://i.scdn.co/image/48026b9d0ccd9061ee91bc2b420355391529b3ab 
Nightwish,  Dark Passion Play, metal_553.jpeg,  https://i.scdn.co/image/c6da357cfd547022bd8905f7cc1170853de96eb3 
Nightwish,  Dark Passion Play, metal_554.jpeg,  https://i.scdn.co/image/770a3014468958b84f53123f06f21244893dcedf 
Nightwish,  Dark Passion Play (Deluxe Edition), metal_555.jpeg,  https://i.scdn.co/image/a76e135a039c8c814296d2262e49c05edc5a47bb 
Nightwish,  Angels Fall First, metal_556.jpeg,  https://i.scdn.co/image/5c14f3106bf2711ab2ac954ab1b2c830c0a3e8ff 
Nightwish,  Angels Fall First (UK Edition), metal_557.jpeg,  https://i.scdn.co/image/cf1e822d1eea18e62a63804adf7af845e994d0bd 
Nightwish,  Angels Fall First (UK Edition), metal_558.jpeg,  https://i.scdn.co/image/c088bcff74db3aa8f39e6c2ece112966cbd3117b 
Killswitch Engage,  Incarnate, metal_559.jpeg,  https://i.scdn.co/image/e10db295c1aafb8a1c9a71bc44bf4e7b2f6b5a9a 
Killswitch Engage,  Disarm The Descent, metal_560.jpeg,  https://i.scdn.co/image/76feca6cfc42421132f72ec7d132f5ccfaefe07a 
Killswitch Engage,  Disarm The Descent (Special Edition), metal_561.jpeg,  https://i.scdn.co/image/a4040e3a0be7893d9d98eb3c1e43b34d816b719f 
Killswitch Engage,  Killswitch Engage, metal_562.jpeg,  https://i.scdn.co/image/6911bbcae5521dd93d691994ab2585bddd06b6eb 
Killswitch Engage,  Killswitch Engage [Special Edition], metal_563.jpeg,  https://i.scdn.co/image/daea9677851b770a6297677cc685d6012debff8b 
Killswitch Engage,  Killswitch Engage [Special Edition] [iTunes] (Worldwide Excl. US & Canada), metal_564.jpeg,  https://i.scdn.co/image/daea9677851b770a6297677cc685d6012debff8b 
Killswitch Engage,  As Daylight Dies, metal_565.jpeg,  https://i.scdn.co/image/d9a0f5bc80c13b3873a51906fc1ec9dbc557a315 
Killswitch Engage,  As Daylight Dies (Special Edition), metal_566.jpeg,  https://i.scdn.co/image/b7ee10741497fe45932e7a6f12600b3beb564364 
Killswitch Engage,  The End Of Heartache [Special Edition], metal_567.jpeg,  https://i.scdn.co/image/9d9e041f2cd75f1fdd46f4654acc3e46cbcbc829 
Killswitch Engage,  The End Of Heartache, metal_568.jpeg,  https://i.scdn.co/image/c88adf61f3af023002ee1b8e163bc9a7860ff658 
Killswitch Engage,  Alive Or Just Breathing, metal_569.jpeg,  https://i.scdn.co/image/18b6beb94d584949c111020865efa7d5a3d5d70d 
Killswitch Engage,  Alive or Just Breathing, metal_570.jpeg,  https://i.scdn.co/image/909aacf92d22a2cf53b2c9d3a5e303e25ddd6684 
Killswitch Engage,  Alive or Just Breathing [Topshelf Edition], metal_571.jpeg,  https://i.scdn.co/image/fc694dc22c0df62fe6ad5fe510d4f7cfcd018b6d 
Killswitch Engage,  Killswitch Engage, metal_572.jpeg,  https://i.scdn.co/image/87c2eb046c10e706e0f20d84f9f75327c7ec277b 
In Flames,  Battles, metal_573.jpeg,  https://i.scdn.co/image/95e6159b74e259a99370517467dbdab2def542ad 
In Flames,  Battles, metal_574.jpeg,  https://i.scdn.co/image/d68e2cc6a5643af19570ba854c1dd9e43412a90a 
In Flames,  Battles, metal_575.jpeg,  https://i.scdn.co/image/3d78806e54f231859de1b1bc627126c41f57e8b6 
In Flames,  Battles, metal_576.jpeg,  https://i.scdn.co/image/a20279aec246727ce103287568170b0ada4e6380 
In Flames,  Battles, metal_577.jpeg,  https://i.scdn.co/image/5de6c763234be874afdbd691547f513117fc8ac6 
In Flames,  Battles, metal_578.jpeg,  https://i.scdn.co/image/62bd9d27db0483a50f708a3bf2412554fad2fca3 
In Flames,  Sounds from the Heart of Gothenburg (Live), metal_579.jpeg,  https://i.scdn.co/image/660aab7b2e1c49fcde05eb73776b3fd5ed5db360 
In Flames,  Sounds from the Heart of Gothenburg (Live), metal_580.jpeg,  https://i.scdn.co/image/4fc954afef4330ba1d594eb02a8b363d3415e1be 
In Flames,  Soundtrack To Your Escape (Reissue 2014), metal_581.jpeg,  https://i.scdn.co/image/35748a3419626e147faf74a20058ac9f3fa1d206 
In Flames,  Reroute to Remain (Reissue 2014), metal_582.jpeg,  https://i.scdn.co/image/08f4112d64a6ce8dd12953aa509310ad43182e82 
In Flames,  Clayman (Reissue 2014), metal_583.jpeg,  https://i.scdn.co/image/a3408864c1898f2460b03f01ae3368bcc796beb2 
In Flames,  Colony (Reissue 2014), metal_584.jpeg,  https://i.scdn.co/image/578b627dd540fffc31a4ccd830f4561fa7025246 
In Flames,  Whoracle (Reissue 2014), metal_585.jpeg,  https://i.scdn.co/image/6518667825e3aeb07158b3f2ea83e2b86a668527 
In Flames,  The Jester Race (Reissue 2014), metal_586.jpeg,  https://i.scdn.co/image/d343dea9eab5c50ebef82fd22cadf3c3e094f82f 
In Flames,  Subterranean (Reissue 2014), metal_587.jpeg,  https://i.scdn.co/image/8b5f4c18b1eb60778d79e4f5ec15b662b0313ee8 
In Flames,  Lunar Strain (Reissue 2014), metal_588.jpeg,  https://i.scdn.co/image/a057a42a6a3235b0e50256381bf55d0776d44cfc 
Rammstein,  PARIS (LIVE), metal_589.jpeg,  https://i.scdn.co/image/31625c41a10b0ae465d13257b748e2f5b509df3f 
Rammstein,  PARIS (LIVE), metal_590.jpeg,  https://i.scdn.co/image/ca28b5611bfd3a1fa628c9b3167db7b94bd946bb 
Rammstein,  XXI - Klavier, metal_591.jpeg,  https://i.scdn.co/image/e93f7a094664a3aab858f9c9f1b9d8f163269865 
Rammstein,  RARITÄTEN (1994 - 2012), metal_592.jpeg,  https://i.scdn.co/image/8f4bc6f14283d91bbffb8843cd764cce0cb39178 
Rammstein,  RARITÄTEN (1994 - 2012), metal_593.jpeg,  https://i.scdn.co/image/c37b8a5666c817dc787572f0ebcc41ac76a1fe3f 
Rammstein,  RARE TRACKS 1994 - 2012, metal_594.jpeg,  https://i.scdn.co/image/f44212946c82976ce3af3d4b0d45d9ffef068672 
Rammstein,  MADE IN GERMANY 1995 - 2011 (SPECIAL EDITION), metal_595.jpeg,  https://i.scdn.co/image/936342ee96546b99e40aa59f3db53bd6b74ff1f9 
Rammstein,  LIEBE IST FÜR ALLE DA (SPECIAL EDITION), metal_596.jpeg,  https://i.scdn.co/image/8adc2dce73b23f67e60eca3830872b2c4afad9a4 
Rammstein,  LIEBE IST FÜR ALLE DA, metal_597.jpeg,  https://i.scdn.co/image/4bb849bb27c21f5d1d6daded224ad040bd095bf5 
Rammstein,  ROSENROT, metal_598.jpeg,  https://i.scdn.co/image/81a618b8df3ac37506a19f5b4f2bb6193cb8b06a 
Rammstein,  Mutter, metal_599.jpeg,  https://i.scdn.co/image/e1b91774b9cb7ad650e1755074a8e492f9bce20e 
Rammstein,  Mutter, metal_600.jpeg,  https://i.scdn.co/image/652d8440ce9dc5cad9b947074736ba4a775fedb0 
Rammstein,  Live aus Berlin, metal_601.jpeg,  https://i.scdn.co/image/82ff62b5bcb6490bc66ab8d378568e570487b2e6 
Rammstein,  Sehnsucht, metal_602.jpeg,  https://i.scdn.co/image/371d799ebaec660045c9397a530d053557dbd7e7 
Rammstein,  Sehnsucht, metal_603.jpeg,  https://i.scdn.co/image/59fdcdc8133073d6c679fae2fac5eafa1170b08c 
Rammstein,  Herzeleid, metal_604.jpeg,  https://i.scdn.co/image/36986c916fdf168f6e4b72971f68004fefa1cc45 
Rammstein,  Herzeleid, metal_605.jpeg,  https://i.scdn.co/image/29d10c38fc0f36ca5a64ef778be3ac329f882ce9 
Korn,  The Serenity of Suffering, metal_606.jpeg,  https://i.scdn.co/image/c2be5e603e24a0f80d79f602507d87f7ba5493a9 
Korn,  The Serenity of Suffering, metal_607.jpeg,  https://i.scdn.co/image/c2be5e603e24a0f80d79f602507d87f7ba5493a9 
Korn,  The Serenity of Suffering, metal_608.jpeg,  https://i.scdn.co/image/c2be5e603e24a0f80d79f602507d87f7ba5493a9 
Korn,  The Serenity of Suffering (Deluxe), metal_609.jpeg,  https://i.scdn.co/image/c2be5e603e24a0f80d79f602507d87f7ba5493a9 
Korn,  Korn Unplugged, metal_610.jpeg,  https://i.scdn.co/image/de325165e00fa7fbd77c13e2a77a41f288099895 
Korn,  The Paradigm Shift (World Tour Edition), metal_611.jpeg,  https://i.scdn.co/image/11a8e6fa712de794212ad9f515b9c747e7e498bc 
Korn,  The Paradigm Shift, metal_612.jpeg,  https://i.scdn.co/image/0c3f714c57c948049b24d2fb6dbb6a8921447d1f 
Korn,  The Paradigm Shift, metal_613.jpeg,  https://i.scdn.co/image/5fe330b7dd157f4149eac3e16a876ed1061d02e1 
Korn,  The Paradigm Shift, metal_614.jpeg,  https://i.scdn.co/image/5fe330b7dd157f4149eac3e16a876ed1061d02e1 
Korn,  The Paradigm Shift, metal_615.jpeg,  https://i.scdn.co/image/c052e71512eee2184aa546dbe1d5c0dd340d64b1 
Korn,  The Path Of Totality (Special Edition), metal_616.jpeg,  https://i.scdn.co/image/0047b8488d0c2cde2d5e495872ed7a7f7b17062d 
Korn,  The Path Of Totality, metal_617.jpeg,  https://i.scdn.co/image/0047b8488d0c2cde2d5e495872ed7a7f7b17062d 
Korn,  The Path Of Totality, metal_618.jpeg,  https://i.scdn.co/image/0047b8488d0c2cde2d5e495872ed7a7f7b17062d 
Korn,  Korn III: Remember Who You Are, metal_619.jpeg,  https://i.scdn.co/image/987f6eede1c614ed9c1f8c9527ccdce12eafc5b2 
Korn,  Korn III: Remember Who You Are, metal_620.jpeg,  https://i.scdn.co/image/987f6eede1c614ed9c1f8c9527ccdce12eafc5b2 
Korn,  Korn III: Remember Who You Are (Special Edition), metal_621.jpeg,  https://i.scdn.co/image/f11989cbfd0aa22cdb19da9a33072ec3403f3fd7 
Korn,  Untitled, metal_622.jpeg,  https://i.scdn.co/image/42809949e276b1c9f210ea4c65170b089584185d 
Korn,  Live & Rare, metal_623.jpeg,  https://i.scdn.co/image/c4e779b55fc1fda128401849b4560ff39bfa9158 
Korn,  Live & Rare, metal_624.jpeg,  https://i.scdn.co/image/4dd197a2ca2d21b88920bbc7b5a9008e67ab2f59 
Korn,  See You On the Other Side, metal_625.jpeg,  https://i.scdn.co/image/e7bc470f67b359bf1bb18d10efc1be419b3d9312 
Korn,  Take A Look In The Mirror, metal_626.jpeg,  https://i.scdn.co/image/a314c8eb36fc015846bc336389c054fe65af0286 
Korn,  Take A Look In The Mirror, metal_627.jpeg,  https://i.scdn.co/image/a314c8eb36fc015846bc336389c054fe65af0286 
Korn,  Take A Look In The Mirror, metal_628.jpeg,  https://i.scdn.co/image/e29d09b98a7717fd5d62638fc4f141922fc87143 
Korn,  Untouchables, metal_629.jpeg,  https://i.scdn.co/image/a19a6d653814f59c0b7a0bca19fe4a8c04bb3d16 
Korn,  Untouchables, metal_630.jpeg,  https://i.scdn.co/image/443d95cddfe999686a116e647706f024047660a1 
Korn,  Issues, metal_631.jpeg,  https://i.scdn.co/image/2d43e8cad20fcdab479acca165bb97bd70d01246 
Korn,  Issues, metal_632.jpeg,  https://i.scdn.co/image/32e04f1d7399703e8344fd21cf5b570140948b0a 
Korn,  Issues, metal_633.jpeg,  https://i.scdn.co/image/2d43e8cad20fcdab479acca165bb97bd70d01246 
Korn,  Issues, metal_634.jpeg,  https://i.scdn.co/image/2d43e8cad20fcdab479acca165bb97bd70d01246 
Korn,  Issues, metal_635.jpeg,  https://i.scdn.co/image/2d43e8cad20fcdab479acca165bb97bd70d01246 
Korn,  Follow The Leader, metal_636.jpeg,  https://i.scdn.co/image/c26ce66ab4d6fd71658189d0bafeb473234a0f63 
Korn,  Life Is Peachy, metal_637.jpeg,  https://i.scdn.co/image/182006a8ebc9befddb50227dc3453a3fe39934f4 
Korn,  Korn, metal_638.jpeg,  https://i.scdn.co/image/3c6e06c05ef5331aa417e3ec13e87b724b742e62 
Korn,  Korn, metal_639.jpeg,  https://i.scdn.co/image/3c6e06c05ef5331aa417e3ec13e87b724b742e62 
Korn,  Korn, metal_640.jpeg,  https://i.scdn.co/image/9aa2a64083aa7d6bb5e345811315453688d9544f 
System Of A Down,  Hypnotize, metal_641.jpeg,  https://i.scdn.co/image/31292ad6f826b3beaad5f7e327c491d715d4205e 
System Of A Down,  Hypnotize, metal_642.jpeg,  https://i.scdn.co/image/2b4d88d7d8c2ff42f431d5d6d21caa6908ae8a64 
System Of A Down,  Hypnotize, metal_643.jpeg,  https://i.scdn.co/image/a4056292f3bbb2187aa95173d9aa90ac0df2aa51 
System Of A Down,  Hypnotize, metal_644.jpeg,  https://i.scdn.co/image/bf37f625b475fa9f23c23bc00e78eb733b5c840f 
System Of A Down,  Mezmerize, metal_645.jpeg,  https://i.scdn.co/image/2aafc81427c3db0f9e6bc4dcd330938717a12bf1 
System Of A Down,  Mezmerize, metal_646.jpeg,  https://i.scdn.co/image/66eb75e0f3a8a91822ba7154e4b41066e63e51f2 
System Of A Down,  Mezmerize, metal_647.jpeg,  https://i.scdn.co/image/68293897ceaaf6a2d7cb5dbfd74483f791cbdf61 
System Of A Down,  Toxicity, metal_648.jpeg,  https://i.scdn.co/image/1121641f82c66ed6ad26caa8b69d769c075c1a67 
System Of A Down,  Toxicity, metal_649.jpeg,  https://i.scdn.co/image/932e185b217606caa34b837dbe30d54028de9cfc 
System Of A Down,  Toxicity, metal_650.jpeg,  https://i.scdn.co/image/3b74b1b2557ec74868bea0dd5c99ed081d32b6f4 
System Of A Down,  Toxicity, metal_651.jpeg,  https://i.scdn.co/image/b40e4a88ae50ba256837a98005ac90df0177e62e 
System Of A Down,  Steal This Album!, metal_652.jpeg,  https://i.scdn.co/image/76f48e8e0c505a3b7fb544e71736a84f5c16dee1 
System Of A Down,  Steal This Album!, metal_653.jpeg,  https://i.scdn.co/image/96d115089ea33db75c9c402c420823771f592620 
System Of A Down,  Steal This Album!, metal_654.jpeg,  https://i.scdn.co/image/53220aed9aacb20f96470e6a875d7699e3c1b3d2 
