Bullet For My Valentine,  The Poison (Deluxe Version), metal_868.jpeg,  https://i.scdn.co/image/7c6208595c51ea89f9322af9cbaefd0cb0dd89e3 
Bullet For My Valentine,  The Poison, metal_869.jpeg,  https://i.scdn.co/image/159d82a897744928f13be491d442169e1c524d67 
Bullet For My Valentine,  The Poison, metal_870.jpeg,  https://i.scdn.co/image/159d82a897744928f13be491d442169e1c524d67 
Bullet For My Valentine,  The Poison, metal_871.jpeg,  https://i.scdn.co/image/6e926bd15ed6dc199f2963238898e5335ecaf3e8 
Bullet For My Valentine,  The Poison, metal_872.jpeg,  https://i.scdn.co/image/9b77150c9146b4cc97176c73cd9915b86023084c 
Bullet For My Valentine,  The Poison, metal_873.jpeg,  https://i.scdn.co/image/9edae1a421ce20130a0c2293e5e97b239405a068 
Alter Bridge,  Live At The O2 Arena, metal_874.jpeg,  https://i.scdn.co/image/746c03dd230ca4e3efe86cf4901c6bee9a8f4003 
Alter Bridge,  Live At The O2 Arena, metal_875.jpeg,  https://i.scdn.co/image/bbec05e17e88dc36462fb7ee33ec61ebe6bda483 
Alter Bridge,  Live at the O2 Arena, metal_876.jpeg,  https://i.scdn.co/image/c53075c3351671e600161948e5f03414e1bb29cb 
Alter Bridge,  Live at the O2 Arena, metal_877.jpeg,  https://i.scdn.co/image/9cb95e9f91dfd43aeb926c1c7195062eb673a797 
Alter Bridge,  Live at the O2 Arena + Rarities, metal_878.jpeg,  https://i.scdn.co/image/780c02d7aaa585424554c22839ec7b5067705d53 
Alter Bridge,  The Last Hero, metal_879.jpeg,  https://i.scdn.co/image/867f9597cd55130a155f0fdd8ee7986497c11576 
Alter Bridge,  The Last Hero, metal_880.jpeg,  https://i.scdn.co/image/498afa6edce2e8f989b411c5c38faa3db9c5183d 
Alter Bridge,  The Last Hero, metal_881.jpeg,  https://i.scdn.co/image/364d91bfb7953349705fc2eefaf33240b8c06d6c 
Alter Bridge,  The Last Hero, metal_882.jpeg,  https://i.scdn.co/image/6cb7fc0524fc2c9207e1b99616064b5cbc604fe8 
Alter Bridge,  Fortress, metal_883.jpeg,  https://i.scdn.co/image/638afca723c5a4b390ec5a5cf29b6dbf4113a5e1 
Alter Bridge,  Fortress, metal_884.jpeg,  https://i.scdn.co/image/9de55390b59115e214b6c884e6fb062eccaf8fb6 
Alter Bridge,  Live at Wembley-European Tour 2011 (Audio Version), metal_885.jpeg,  https://i.scdn.co/image/ee1a9a4a8e4f3865b4cb161d71d4bf29e00ae0d0 
Alter Bridge,  AB III, metal_886.jpeg,  https://i.scdn.co/image/a79abb6cba4617ca0f68c53b7f9ef23b8f621bd7 
Alter Bridge,  AB III, metal_887.jpeg,  https://i.scdn.co/image/6b27f84af3bd762fa1500b6b376ce61b4618831e 
Alter Bridge,  AB III (Special Edition), metal_888.jpeg,  https://i.scdn.co/image/eb394aff0047ba02c2834aed42034749aa26e027 
Alter Bridge,  Live From Amsterdam, metal_889.jpeg,  https://i.scdn.co/image/00db330a658654e13c104995788a09dd29d7308d 
Alter Bridge,  Live from Amsterdam 2008, metal_890.jpeg,  https://i.scdn.co/image/a4d59e61940126a030cefa8740abd6dfb371aee8 
Alter Bridge,  Blackbird, metal_891.jpeg,  https://i.scdn.co/image/17db897450e1de7dfbb35277c0479047494e44db 
Alter Bridge,  Blackbird (UK-OZ-NZ Version), metal_892.jpeg,  https://i.scdn.co/image/971ddda7f849357e94434665b63019540a2dd9a9 
Alter Bridge,  Blackbird, metal_893.jpeg,  https://i.scdn.co/image/a9195ab0c91cd537a86f2c42dab873845dfb7380 
Alter Bridge,  Blackbird, metal_894.jpeg,  https://i.scdn.co/image/0d7e1d7b5e1cc70c6cd234add6f586f70bbc3d03 
Alter Bridge,  One Day Remains, metal_895.jpeg,  https://i.scdn.co/image/961e6c60161580f1a9f865f3ff571d2bda2bb711 
Alter Bridge,  One Day Remains, metal_896.jpeg,  https://i.scdn.co/image/13b9b4d70d113a85dd2e60d7812e7d7ec3b2558c 
Arch Enemy,  Will To Power, metal_897.jpeg,  https://i.scdn.co/image/f2ea949ac100e05855e0142f64dba43ee82b7faa 
Arch Enemy,  As The Stages Burn! (Live at Wacken 2016), metal_898.jpeg,  https://i.scdn.co/image/9b518c8c7181eeaf353204ec5359c453ec1753eb 
Arch Enemy,  Black Earth (Reissue), metal_899.jpeg,  https://i.scdn.co/image/7ddfd57b907d2ad5c5393e4b2add9d597f3e6a5c 
Arch Enemy,  War Eternal, metal_900.jpeg,  https://i.scdn.co/image/7ccc8b66f70ed291ed62a04808848d639d8b10ea 
Arch Enemy,  Khaos Legions, metal_901.jpeg,  https://i.scdn.co/image/51582e35832e110eb7689d6099bd551339be7d26 
Arch Enemy,  Manifesto of Arch Enemy, metal_902.jpeg,  https://i.scdn.co/image/90957ad471c4b9972a134a24bccd0ce4e60292d3 
Arch Enemy,  The Root of All Evil, metal_903.jpeg,  https://i.scdn.co/image/e13d5e8abbccf7aa019cf7b290b8729af8c9f2f7 
Arch Enemy,  Tyrants of the Rising Sun - Live in Japan, metal_904.jpeg,  https://i.scdn.co/image/f1ed79be9573ca2a4c76774d2cbac60167bd9256 
Arch Enemy,  Rise of the Tyrant, metal_905.jpeg,  https://i.scdn.co/image/f218e1d858f69044eab9f9b25d513cbfbbaa1810 
Arch Enemy,  Doomsday Machine, metal_906.jpeg,  https://i.scdn.co/image/a9da34e96ef91c9614341bc1fec5424ab6b57ab8 
Arch Enemy,  Dead Eyes See No Future - EP, metal_907.jpeg,  https://i.scdn.co/image/5c323444a13f78ec0e1315b28398c48c5a7b3418 
Arch Enemy,  Anthems of Rebellion, metal_908.jpeg,  https://i.scdn.co/image/0bca00632f837ee66fac9d99f1a442f5a227648f 
Arch Enemy,  Wages of Sin, metal_909.jpeg,  https://i.scdn.co/image/0d90c091fc432f305ceed3bcce3bdc865f1756cb 
Arch Enemy,  Burning Bridges (Reissue), metal_910.jpeg,  https://i.scdn.co/image/a751384a2e4bfd80e6c8644ae15c5cea561aea28 
Arch Enemy,  Stigmata (Reissue), metal_911.jpeg,  https://i.scdn.co/image/079d67b5870072ff4aa35547e49f7d636f66f6af 
Arch Enemy,  Black Earth, metal_912.jpeg,  https://i.scdn.co/image/a101df323505fe3ce37d1d6a9187a2b5e1747d50 
Arch Enemy,  Black Earth, metal_913.jpeg,  https://i.scdn.co/image/9860b97e4dee4859bfd922d95c118e9a062c7df9 
Machine Head,  Bloodstone & Diamonds, metal_914.jpeg,  https://i.scdn.co/image/f8b2a62d6e73279d598c32cae728eae45dea611c 
Machine Head,  Bloodstone & Diamonds, metal_915.jpeg,  https://i.scdn.co/image/ac6f4d46ad043417233de6984dc1be31609f37ff 
Machine Head,  Machine F**king Head Live (Special Edition), metal_916.jpeg,  https://i.scdn.co/image/4a3cec0aa806669e7dbc93b17a71abef3b655f67 
Machine Head,  Machine F**king Head Live, metal_917.jpeg,  https://i.scdn.co/image/4a3cec0aa806669e7dbc93b17a71abef3b655f67 
Machine Head,  Unto The Locust, metal_918.jpeg,  https://i.scdn.co/image/f7f8adf9320a6685bd84e325ce97446e2d5f0882 
Machine Head,  Unto The Locust (Special Edition), metal_919.jpeg,  https://i.scdn.co/image/f7f8adf9320a6685bd84e325ce97446e2d5f0882 
Machine Head,  The Blackening, metal_920.jpeg,  https://i.scdn.co/image/bdfc109964355834078a0609e956ac0bf29f4705 
Machine Head,  The Blackening, metal_921.jpeg,  https://i.scdn.co/image/603d8caf6396b2da0a326bfc518dd6135fe34839 
Machine Head,  Through The Ashes Of Empires, metal_922.jpeg,  https://i.scdn.co/image/13307d9b0bfaab31d8d2d24a016563b738960456 
Machine Head,  Hellalive, metal_923.jpeg,  https://i.scdn.co/image/8f5ffd4efe3188f6e6053459d94f69abc02c231c 
Machine Head,  Hellalive (Explicit), metal_924.jpeg,  https://i.scdn.co/image/a794792251c074f61b5083366181b450306de02b 
Machine Head,  Supercharger, metal_925.jpeg,  https://i.scdn.co/image/75fac38828a2d1a1d15f7eaabb02356623af485b 
Machine Head,  The Burning Red, metal_926.jpeg,  https://i.scdn.co/image/7fed8590c566ea9c48752dbfc37277be3ee70c95 
Machine Head,  The Burning Red (Explicit Version), metal_927.jpeg,  https://i.scdn.co/image/54d09d371db64f161d66263faecde68afc6f8272 
Machine Head,  The More Things Change..., metal_928.jpeg,  https://i.scdn.co/image/35058f4e4fed9dd907ca1432785f82c8900957bf 
Machine Head,  The More Things Change... (Explicit Version), metal_929.jpeg,  https://i.scdn.co/image/065bd110b817e364b45fdd356d05d78572b3b775 
Machine Head,  Burn My Eyes, metal_930.jpeg,  https://i.scdn.co/image/5d67b9d76cc42338b62dc7edb52894cc081d755b 
Machine Head,  Burn My Eyes (Explicit Version), metal_931.jpeg,  https://i.scdn.co/image/85a6e30c9b2ba8fc597142bfd985227935a29e60 
Pantera,  The Great Southern Trendkill (20th Anniversary Edition), metal_932.jpeg,  https://i.scdn.co/image/88eef6b8126f2454f3762a3b9148dfb592eb6065 
Pantera,  Far Beyond Bootleg - Live From Donington '94, metal_933.jpeg,  https://i.scdn.co/image/99f8bb01cfec0308ea207d72d41c2d2b79f8235c 
Pantera,  Far Beyond Driven (20th Anniversary Edition Deluxe), metal_934.jpeg,  https://i.scdn.co/image/3331f2d81d21facbeefe3d7d31e315e5c308b151 
Pantera,  Cowboys From Hell (Deluxe), metal_935.jpeg,  https://i.scdn.co/image/c8d0f7f814b466459611ee6011635224f5b9c2e3 
Pantera,  Reinventing The Steel, metal_936.jpeg,  https://i.scdn.co/image/014cb4c5dd1910804b02a3fa4f161323b4a29711 
Pantera,  Official Live: 101 Proof, metal_937.jpeg,  https://i.scdn.co/image/f75472b5099ba84ba68f0b2175923b53af24b30c 
Pantera,  The Great Southern Trendkill, metal_938.jpeg,  https://i.scdn.co/image/fe0ff8d57c505a60bab604603bfb97290dcc4ef2 
Pantera,  Far Beyond Driven, metal_939.jpeg,  https://i.scdn.co/image/038df23f44769b8d1695021b69d45e323b12e8e9 
Pantera,  Vulgar Display Of Power (US Release), metal_940.jpeg,  https://i.scdn.co/image/b84bd3d73fd768a7918d2caf7055806907a193b2 
Pantera,  Cowboys From Hell, metal_941.jpeg,  https://i.scdn.co/image/260ec57a8ffade8261cf5b57123990626395c64f 
Apocalyptica,  Apocalyptica Plays Metallica By Four Cellos, metal_942.jpeg,  https://i.scdn.co/image/538ed989b9b6aeea1c4a69959ea9280a1e15d295 
Apocalyptica,  Plays Metallica by Four Cellos, metal_943.jpeg,  https://i.scdn.co/image/a31cd2f93b6fb17cd2a94576961e5169be926435 
Killswitch Engage,  Incarnate, metal_944.jpeg,  https://i.scdn.co/image/e10db295c1aafb8a1c9a71bc44bf4e7b2f6b5a9a 
Killswitch Engage,  Disarm The Descent, metal_945.jpeg,  https://i.scdn.co/image/76feca6cfc42421132f72ec7d132f5ccfaefe07a 
Killswitch Engage,  Disarm The Descent (Special Edition), metal_946.jpeg,  https://i.scdn.co/image/a4040e3a0be7893d9d98eb3c1e43b34d816b719f 
Killswitch Engage,  Killswitch Engage, metal_947.jpeg,  https://i.scdn.co/image/6911bbcae5521dd93d691994ab2585bddd06b6eb 
Killswitch Engage,  Killswitch Engage [Special Edition], metal_948.jpeg,  https://i.scdn.co/image/daea9677851b770a6297677cc685d6012debff8b 
Killswitch Engage,  Killswitch Engage [Special Edition] [iTunes] (Worldwide Excl. US & Canada), metal_949.jpeg,  https://i.scdn.co/image/daea9677851b770a6297677cc685d6012debff8b 
Killswitch Engage,  As Daylight Dies, metal_950.jpeg,  https://i.scdn.co/image/d9a0f5bc80c13b3873a51906fc1ec9dbc557a315 
Killswitch Engage,  As Daylight Dies (Special Edition), metal_951.jpeg,  https://i.scdn.co/image/b7ee10741497fe45932e7a6f12600b3beb564364 
Killswitch Engage,  The End Of Heartache [Special Edition], metal_952.jpeg,  https://i.scdn.co/image/9d9e041f2cd75f1fdd46f4654acc3e46cbcbc829 
Killswitch Engage,  The End Of Heartache, metal_953.jpeg,  https://i.scdn.co/image/c88adf61f3af023002ee1b8e163bc9a7860ff658 
Killswitch Engage,  Alive Or Just Breathing, metal_954.jpeg,  https://i.scdn.co/image/18b6beb94d584949c111020865efa7d5a3d5d70d 
Killswitch Engage,  Alive or Just Breathing, metal_955.jpeg,  https://i.scdn.co/image/909aacf92d22a2cf53b2c9d3a5e303e25ddd6684 
Killswitch Engage,  Alive or Just Breathing [Topshelf Edition], metal_956.jpeg,  https://i.scdn.co/image/fc694dc22c0df62fe6ad5fe510d4f7cfcd018b6d 
Killswitch Engage,  Killswitch Engage, metal_957.jpeg,  https://i.scdn.co/image/87c2eb046c10e706e0f20d84f9f75327c7ec277b 
Disturbed,  Disturbed - Live at Red Rocks, metal_958.jpeg,  https://i.scdn.co/image/0ff2c929bf00790f714b55768f569fc80ee12699 
Disturbed,  Disturbed - Live at Red Rocks, metal_959.jpeg,  https://i.scdn.co/image/61504c755574e88bcfed14051f35f78f1d81daad 
Disturbed,  Immortalized, metal_960.jpeg,  https://i.scdn.co/image/0f0e46bdf41faaf955dc5d4dcc60177414a0704d 
Disturbed,  Immortalized, metal_961.jpeg,  https://i.scdn.co/image/7367a2a5e647f4f081717995f55395a389ef6dd7 
Disturbed,  Immortalized (Deluxe Version), metal_962.jpeg,  https://i.scdn.co/image/0f0e46bdf41faaf955dc5d4dcc60177414a0704d 
Disturbed,  The Lost Children, metal_963.jpeg,  https://i.scdn.co/image/ce55d4bf3a20c7716852d7e00236045aa6d08085 
Disturbed,  The Lost Children, metal_964.jpeg,  https://i.scdn.co/image/bfdd0bef7236ccaf03dc2f72902d21679afd2ede 
Disturbed,  Asylum, metal_965.jpeg,  https://i.scdn.co/image/14697511fc87c06e730e2ab3c3496619215420d0 
Disturbed,  Asylum, metal_966.jpeg,  https://i.scdn.co/image/14697511fc87c06e730e2ab3c3496619215420d0 
Disturbed,  Asylum (Deluxe), metal_967.jpeg,  https://i.scdn.co/image/68ade2f07821ee362786d16a3a9d70ce84c8f984 
Disturbed,  The Sickness 10th Anniversary Edition, metal_968.jpeg,  https://i.scdn.co/image/684896f889df80e20be26cf31832312cd3b9e08b 
Disturbed,  Indestructible, metal_969.jpeg,  https://i.scdn.co/image/459b5e2caef1bbc87c472d6d549be6e295e02138 
Disturbed,  Indestructible, metal_970.jpeg,  https://i.scdn.co/image/459b5e2caef1bbc87c472d6d549be6e295e02138 
Disturbed,  Indestructible (Japanese Version), metal_971.jpeg,  https://i.scdn.co/image/a1f13067ff9b1a65623e734ecf53890d48fb835f 
Disturbed,  Ten Thousand Fists (Standard Edition), metal_972.jpeg,  https://i.scdn.co/image/e56552bbe33617bf4e68034f1e582d901c46e3a4 
Disturbed,  Music As A Weapon II, metal_973.jpeg,  https://i.scdn.co/image/604b7b6bf8b7e6df821a57957f37993aea60845b 
Disturbed,  Believe (PA Version), metal_974.jpeg,  https://i.scdn.co/image/0b42ddc829650a2f2ca2b0b7926a800532a60831 
Disturbed,  Believe (Amended Version), metal_975.jpeg,  https://i.scdn.co/image/c3d2c5a2b1bbea614be044b415c6d55c0662fc88 
Disturbed,  The Sickness, metal_976.jpeg,  https://i.scdn.co/image/2f7cfa7d9f694b64c0cd3718bee5f1aab7354d3e 
Disturbed,  The Sickness, metal_977.jpeg,  https://i.scdn.co/image/b60005e47782f04c622b8c1971467da7a947ca24 
Hatebreed,  The Concrete Confessional, metal_978.jpeg,  https://i.scdn.co/image/84784901a3d3da6bdbbe1bae62743d8fabd08cd3 
Hatebreed,  The Concrete Confessional, metal_979.jpeg,  https://i.scdn.co/image/9e116b8bba465a56b0968df3ad78f07c09566e84 
Hatebreed,  The Concrete Confessional, metal_980.jpeg,  https://i.scdn.co/image/4a7b64df5b6e6165e48c8b22c199d56fa0e3ceca 
Hatebreed,  The Divinity Of Purpose, metal_981.jpeg,  https://i.scdn.co/image/0e43356739b0fb96fab94c0f7f0ee6a2aa675442 
Hatebreed,  The Rise Of Brutality, metal_982.jpeg,  https://i.scdn.co/image/5bc8ba26cdeb9c29738ba28c186a9564e6719398 
Hatebreed,  The Rise of Brutality, metal_983.jpeg,  https://i.scdn.co/image/00307eaa66ae9ec49c0bc44c85aad70b7acadc0f 
Hatebreed,  The Rise of Brutality, metal_984.jpeg,  https://i.scdn.co/image/ae9ff02cd70428311d288d1c5bd7058fa65b3428 
Hatebreed,  Perseverance (Explicit Version), metal_985.jpeg,  https://i.scdn.co/image/77c1cd5c960cf407ab40f40db297b945d5575010 
Hatebreed,  Perseverance, metal_986.jpeg,  https://i.scdn.co/image/70ca455d80f68d87e4737ebd90324990b1a03a35 
Hatebreed,  Perseverance, metal_987.jpeg,  https://i.scdn.co/image/537e5518248e766452381a3b88db9d76556fecf5 
Hatebreed,  Perseverance (UK edition with 1 bonus track), metal_988.jpeg,  https://i.scdn.co/image/f3b8e490247bee6a688ea2f1aba9519a52704881 
Hatebreed,  Satisfaction Is the Death of Desire, metal_989.jpeg,  https://i.scdn.co/image/fbf74351b3fc1c2707189bdd5612c79c764e5c79 
Hatebreed,  Under The Knife, metal_990.jpeg,  https://i.scdn.co/image/403e79ff011882b38954e1e5ec26a1923ec1a0a6 
Hatebreed,  Under The Knife, metal_991.jpeg,  https://i.scdn.co/image/be8f2915bd79044f52613168e1610ce3197818ab 
Shadows Fall,  Fire From The Sky, metal_992.jpeg,  https://i.scdn.co/image/b4442bd1521f3823c8f422a76703569963f9aaeb 
Shadows Fall,  Fire From The Sky, metal_993.jpeg,  https://i.scdn.co/image/077ff9073798e2391ee0786d2fe26ab53f971beb 
Shadows Fall,  Fire From The Sky, metal_994.jpeg,  https://i.scdn.co/image/324d986f0eff5909c73959138349e508382f95a2 
Shadows Fall,  Madness In Manila: Shadows Fall Live In The Philippines 2009, metal_995.jpeg,  https://i.scdn.co/image/5584f91b66844eec4ed43fa604eeaa7bbaf0a263 
Shadows Fall,  Retribution, metal_996.jpeg,  https://i.scdn.co/image/0da0ff3a99fab42a9d7a152f55944df3f2c4ffc7 
Shadows Fall,  Seeking the Way: The Greatest Hits, metal_997.jpeg,  https://i.scdn.co/image/631957e9e8758065a65089893d8d922d4183117a 
Shadows Fall,  Threads Of Life, metal_998.jpeg,  https://i.scdn.co/image/986693976741bb6801e98d47ae3bfe07d8105d4f 
Shadows Fall,  Fallout From the War, metal_999.jpeg,  https://i.scdn.co/image/fdc8d35c8b2acf87d73233ad18c57dbd11b978b1 
Shadows Fall,  The War Within, metal_1000.jpeg,  https://i.scdn.co/image/69b1d71c90b603c884ae11b664f42cb46901250f 
Shadows Fall,  Fear Will Drag You Down, metal_1001.jpeg,  https://i.scdn.co/image/e558fabd31e40a10b63dbc2eb440f3ce59e2567c 
Shadows Fall,  The Art Of Balance, metal_1002.jpeg,  https://i.scdn.co/image/6e27a215c8e6119097c98ba9ee35d8ecb0b17fac 
Shadows Fall,  Of One Blood, metal_1003.jpeg,  https://i.scdn.co/image/3fadc655cf0e563e386286073b3f77c24d18e239 
Shadows Fall,  Somber Eyes To The Sky, metal_1004.jpeg,  https://i.scdn.co/image/7efe5277d312e8c012086147bd806ff1e8036ae4 
Avenged Sevenfold,  The Stage, metal_1005.jpeg,  https://i.scdn.co/image/8dceefcedf45356c85c0008782c8eb267038ee57 
Avenged Sevenfold,  The Stage, metal_1006.jpeg,  https://i.scdn.co/image/8dceefcedf45356c85c0008782c8eb267038ee57 
Avenged Sevenfold,  The Stage, metal_1007.jpeg,  https://i.scdn.co/image/1a75f74055fae07978896055c3a723f0ec0861a6 
Avenged Sevenfold,  The Stage, metal_1008.jpeg,  https://i.scdn.co/image/baf7c59888ce36c73bd3347cc9eabcc3684ac605 
Avenged Sevenfold,  Hail To The King: Deathbat (Original Video Game Soundtrack), metal_1009.jpeg,  https://i.scdn.co/image/640cac1e257805787f2ef279783784c86ce359ce 
Avenged Sevenfold,  Waking The Fallen: Resurrected, metal_1010.jpeg,  https://i.scdn.co/image/eb9fe262a05ea3db106a1e430b756a5624ca8a9c 
Avenged Sevenfold,  Hail to the King, metal_1011.jpeg,  https://i.scdn.co/image/d6fef16190f1516d0efe91c0d1bc6f28d8aa8865 
Avenged Sevenfold,  Nightmare, metal_1012.jpeg,  https://i.scdn.co/image/22da875c060f901998e1f3518ab8fc08d814f926 
Avenged Sevenfold,  Nightmare, metal_1013.jpeg,  https://i.scdn.co/image/5c40ab586f1a40092a20704195aaca9f990449a2 
Avenged Sevenfold,  Avenged Sevenfold (Explicit Version), metal_1014.jpeg,  https://i.scdn.co/image/fc545ee7c8ae2baca43fb592078910fe0ca66e07 
Avenged Sevenfold,  Avenged Sevenfold, metal_1015.jpeg,  https://i.scdn.co/image/5ec10c00acd62ca49c65929d9188ed8ce6bbe7d3 
Avenged Sevenfold,  City Of Evil (PA Version), metal_1016.jpeg,  https://i.scdn.co/image/88e04419e6cad4f11d2d25c08d9c5d1e87aa1371 
Avenged Sevenfold,  City Of Evil (Non-PA Version), metal_1017.jpeg,  https://i.scdn.co/image/a36e2063659983384a65c0e7c642dce13232322b 
Avenged Sevenfold,  Waking The Fallen, metal_1018.jpeg,  https://i.scdn.co/image/edc7c9767d5db5d27a638d68ace6b4db8b616e0e 
Avenged Sevenfold,  Sounding The Seventh Trumpet, metal_1019.jpeg,  https://i.scdn.co/image/324df75e87a75f4188ea6f907de9774c4962cede 
Deftones,  Gore, metal_1020.jpeg,  https://i.scdn.co/image/badcad8d7a9f219115a0e97efb53a3fb1eadc178 
Deftones,  Koi No Yokan, metal_1021.jpeg,  https://i.scdn.co/image/e565b912d1ef677110bd289bff82cd428577db13 
Deftones,  Koi No Yokan, metal_1022.jpeg,  https://i.scdn.co/image/1627852c32ca8f8f3247a94c5520d818eb711352 
Deftones,  Covers, metal_1023.jpeg,  https://i.scdn.co/image/964d363046a148561bfe66c447ea74f43ed5bfc1 
Deftones,  Diamond Eyes, metal_1024.jpeg,  https://i.scdn.co/image/7dcf3a4f39b5c4084dcff2d0194d011bd73799f2 
Deftones,  Diamond Eyes, metal_1025.jpeg,  https://i.scdn.co/image/f8412a557a26b522f720a2ae5018c023e4c0a983 
Deftones,  Adrenaline, metal_1026.jpeg,  https://i.scdn.co/image/ade375636c4ac2b39d35979e5a94469bbc8e5066 
DevilDriver,  Trust No One, metal_1027.jpeg,  https://i.scdn.co/image/f171fef93ae1cb226e54360887a9df02cbbfe29a 
DevilDriver,  Trust No One, metal_1028.jpeg,  https://i.scdn.co/image/e4b1d29e3ead4828ff121cd3b524ba9ce3e0a535 
DevilDriver,  Trust No One, metal_1029.jpeg,  https://i.scdn.co/image/efbf6d423364f68148cf05b3ee1ed3a074182b2e 
DevilDriver,  Trust No One, metal_1030.jpeg,  https://i.scdn.co/image/419d2d3a5e442636967b351a600ec522a5ab47aa 
DevilDriver,  Trust No One, metal_1031.jpeg,  https://i.scdn.co/image/80299ccea657b92a19d2a10f6b9acae8786acc74 
DevilDriver,  Trust No One, metal_1032.jpeg,  https://i.scdn.co/image/b66168c5eac02d956c286837bedab3d5d0f395c0 
DevilDriver,  Winter Kills, metal_1033.jpeg,  https://i.scdn.co/image/312c38b2a9490e5609f811455bb84093563f7903 
DevilDriver,  Winter Kills, metal_1034.jpeg,  https://i.scdn.co/image/260a7a2dd368dd0ed028382439360411cef1d80e 
DevilDriver,  Winter Kills, metal_1035.jpeg,  https://i.scdn.co/image/88d1f5eb776263782e7010f2df1c3870a388b6ef 
DevilDriver,  Beast, metal_1036.jpeg,  https://i.scdn.co/image/39004b21c4826dc2b438b1762657feeaaa88645e 
DevilDriver,  Beast (Special Edition), metal_1037.jpeg,  https://i.scdn.co/image/89bd6df647dbb37a702cfde5f13baef666a152e4 
DevilDriver,  Pray For Villains, metal_1038.jpeg,  https://i.scdn.co/image/cc11503a9bb9b4ecc4d2e7b9450f62022e281324 
DevilDriver,  Pray For Villains [Special Edition], metal_1039.jpeg,  https://i.scdn.co/image/e6330965a9fa45e87a924b2ff23057f6b7007e7d 
DevilDriver,  The Last Kind Words, metal_1040.jpeg,  https://i.scdn.co/image/f58345bc7dded3f13f8eaaea35390b5d8eace652 
DevilDriver,  The Fury Of Our Maker's Hand, metal_1041.jpeg,  https://i.scdn.co/image/d3157801b89826da2975d9e5206f82f5c67dd9e6 
DevilDriver,  The Fury Of Our Maker's Hand [Special Edition], metal_1042.jpeg,  https://i.scdn.co/image/ca78a47eead6e7a94f20379e5012ed7dfc39d49f 
DevilDriver,  DevilDriver, metal_1043.jpeg,  https://i.scdn.co/image/aa12ef4973ede27b5111185a3eed6177b2b1edcf 
DevilDriver,  DevilDriver (Explicit Version), metal_1044.jpeg,  https://i.scdn.co/image/ca3331ef36cd030a82550cf355edc52e77b6d260 
Amon Amarth,  Jomsviking, metal_1045.jpeg,  https://i.scdn.co/image/9d1bbe23652537508d0741f66a6cc6f226696e61 
Amon Amarth,  Jomsviking, metal_1046.jpeg,  https://i.scdn.co/image/4a8761450747a194a9c022be52e1edbd74b3e94a 
Amon Amarth,  Deceiver of the Gods, metal_1047.jpeg,  https://i.scdn.co/image/36dbb7633a075a0112965eeee81006f6debfc6c4 
Amon Amarth,  Deceiver of the Gods, metal_1048.jpeg,  https://i.scdn.co/image/a4bd176fccc7bff32231325477a92953e50acbd9 
Amon Amarth,  Surtur Rising, metal_1049.jpeg,  https://i.scdn.co/image/12e36a3f145df48c01a555c3d64382a6175ff572 
Amon Amarth,  Versus the World (Bonus Edition), metal_1050.jpeg,  https://i.scdn.co/image/e73885e1a4b899110a535d153d5d95e2b5b59dbc 
Amon Amarth,  Twilight Of The Thunder God, metal_1051.jpeg,  https://i.scdn.co/image/655d7f21d1e99d79de71818e00e5750e531c565d 
Amon Amarth,  With Oden On Our Side, metal_1052.jpeg,  https://i.scdn.co/image/972af0688da028052166b3a98c443a11a7359cbb 
Amon Amarth,  Fate of Norns, metal_1053.jpeg,  https://i.scdn.co/image/43af65a6467003b456df09303709030a0cc422d8 
Amon Amarth,  Versus The World, metal_1054.jpeg,  https://i.scdn.co/image/e7eaddbcbed76ac1e95ca8212673f66e4c40e806 
Amon Amarth,  The Crusher, metal_1055.jpeg,  https://i.scdn.co/image/37753fa5eb2d223ce6183dccef27df169d8ed957 
Amon Amarth,  The Crusher (Bonus Edition), metal_1056.jpeg,  https://i.scdn.co/image/7559e97e48f0ba9b70b7f03b6f6b8d30abe1f2f6 
Amon Amarth,  The Avenger (Bonus Edition), metal_1057.jpeg,  https://i.scdn.co/image/27d6911d0a2cdd186fc161ad0d06c539fe12b075 
Amon Amarth,  The Avenger, metal_1058.jpeg,  https://i.scdn.co/image/5d98b123fbf90c9864ae98af162609f2d4eb2973 
Amon Amarth,  Once Sent From The Golden Hall (Bonus Edition), metal_1059.jpeg,  https://i.scdn.co/image/59e9fd1cb86adc3c00f400b75369d2ab4f3a90b1 
Amon Amarth,  Once Sent From The Golden Hall, metal_1060.jpeg,  https://i.scdn.co/image/817f1cecc15fdf46ebdfac8f3e97ab803cf981f3 
Periphery,  Periphery III: Select Difficulty, metal_1061.jpeg,  https://i.scdn.co/image/b4c20914ec773907bbf89f8aa81567b079703ff9 
Periphery,  Periphery III: Select Difficulty, metal_1062.jpeg,  https://i.scdn.co/image/006aa4e5e13f1f9bdfc287e2fe618506ce19aea5 
Periphery,  Periphery III: Select Difficulty, metal_1063.jpeg,  https://i.scdn.co/image/52aa8fc5e9d469719a3abe431e0442c14ae22b6e 
Periphery,  Periphery III: Select Difficulty, metal_1064.jpeg,  https://i.scdn.co/image/99def4a0f594492e2a403469eb1bf8c2ba2e5370 
Periphery,  Juggernaut: Alpha, metal_1065.jpeg,  https://i.scdn.co/image/2ad8a504df69b15ce4cc3cd4c2bd974594965493 
Periphery,  Juggernaut: Alpha, metal_1066.jpeg,  https://i.scdn.co/image/d2cc87c3169d8e84c130690853a78ec24bcab7f0 
Periphery,  Juggernaut: Omega, metal_1067.jpeg,  https://i.scdn.co/image/bc1dc6d8171d0b751ca41eabad77ce7f04299498 
Periphery,  Clear, metal_1068.jpeg,  https://i.scdn.co/image/662ad502286cff15b1593e8b0531e1884b8f945a 
Periphery,  Clear, metal_1069.jpeg,  https://i.scdn.co/image/51df55baf0ddeb085845adb3f88de070c36a0e74 
Periphery,  Clear (EP), metal_1070.jpeg,  https://i.scdn.co/image/153765c04886bc307699b201eec19e14043056da 
Periphery,  Clear, metal_1071.jpeg,  https://i.scdn.co/image/54d308e243ac9331f9343ef1495b1f1a762d14fd 
Periphery,  Periphery II, metal_1072.jpeg,  https://i.scdn.co/image/3dfe6cca2501421513ab9dba8d036f04944bff56 
Periphery,  Periphery II, metal_1073.jpeg,  https://i.scdn.co/image/f600b4e40338e0eef1fea85f7071a9bf0fefb275 
Periphery,  Periphery II, metal_1074.jpeg,  https://i.scdn.co/image/181fdf5c224739f76ec7a299a7b97c0bf3be7472 
Periphery,  Periphery II, metal_1075.jpeg,  https://i.scdn.co/image/4c5fbd22a219fd04fca0552821880756185dc1a0 
Periphery,  Icarus, metal_1076.jpeg,  https://i.scdn.co/image/bd7e71924cf52acd444d1a9b1517fe81939881f1 
Periphery,  Icarus Lives EP, metal_1077.jpeg,  https://i.scdn.co/image/ba5bc36a40033908a5e102c6484b2133673cab08 
Periphery,  Icarus EP, metal_1078.jpeg,  https://i.scdn.co/image/f913345457808941edca40d0f4b2fab6cd43ab5f 
Periphery,  Periphery (Special Edition), metal_1079.jpeg,  https://i.scdn.co/image/e12414071085dcbf4c387a3cf33b6bcc8cd4ab59 
Periphery,  Periphery [Instrumental], metal_1080.jpeg,  https://i.scdn.co/image/c8d2002251564e2748216a6dd3358a524d62dede 
Periphery,  Periphery, metal_1081.jpeg,  https://i.scdn.co/image/91e4c01d3d19fec32e28ab82ac483d68563a403a 
Periphery,  Periphery, metal_1082.jpeg,  https://i.scdn.co/image/0704d001bd4a156b872dde539603150b63f53713 
Periphery,  Periphery, metal_1083.jpeg,  https://i.scdn.co/image/34a3c6343d4cfe77aa8f9b10e88347f8aef34f2c 
