Metallica,  Hardwired…To Self-Destruct, rock_1.jpeg,  https://i.scdn.co/image/93b28cf6d938563ab2ea6a130aa63a16710eb455 
Metallica,  Hardwired…To Self-Destruct (Deluxe), rock_2.jpeg,  https://i.scdn.co/image/cb1e3828a1e8b7156ef6cfc027c68cafff904323 
Metallica,  Hardwired…To Self-Destruct (Deluxe), rock_3.jpeg,  https://i.scdn.co/image/47da19a3aa94d5f95e32dd79ad7cc7257eea0533 
Metallica,  Hardwired…To Self-Destruct (Deluxe), rock_4.jpeg,  https://i.scdn.co/image/93b28cf6d938563ab2ea6a130aa63a16710eb455 
Metallica,  Metallica Through The Never (Music From The Motion Picture), rock_5.jpeg,  https://i.scdn.co/image/ebfa16fd753035a10518c2fac10793114edf49d7 
Metallica,  Metallica Through The Never (Music From The Motion Picture), rock_6.jpeg,  https://i.scdn.co/image/9554edfdc05083c06a4ec98ac623a827ca920866 
Metallica,  Metallica Through The Never (Music from the Motion Picture), rock_7.jpeg,  https://i.scdn.co/image/1362a06f43c913c2ab376b78755a2c8cccc51362 
Metallica,  Lulu, rock_8.jpeg,  https://i.scdn.co/image/6c951f3f334e05ffacf598e168aed321f5b8ffc3 
Metallica,  ...And Justice For All, rock_9.jpeg,  https://i.scdn.co/image/a8f6cd386459022a5a57d3af9b631a636aee88d8 
Metallica,  ...And Justice For All, rock_10.jpeg,  https://i.scdn.co/image/db797c3e1ef01ecd96ea55787410bd56921cf8a3 
Metallica,  ...And Justice For All, rock_11.jpeg,  https://i.scdn.co/image/9b39d31f336ac340c84fa756cee19bb589020865 
Metallica,  Death Magnetic, rock_12.jpeg,  https://i.scdn.co/image/f9b6792d5fc79490072064f68200bce7c82d8b53 
Metallica,  Death Magnetic, rock_13.jpeg,  https://i.scdn.co/image/e777e126e8f49c599adfcc046e201d166a28c2a7 
Metallica,  Death Magnetic, rock_14.jpeg,  https://i.scdn.co/image/62aa2177e246019eb782cd03028e266bf2ca17d7 
Metallica,  Some Kind Of Monster, rock_15.jpeg,  https://i.scdn.co/image/844cf6dba35b7d64fa5b2ab31b948a01c9e286d9 
Metallica,  Some Kind Of Monster, rock_16.jpeg,  https://i.scdn.co/image/7ff3342f64550323a9216cc94c4f7920f2764385 
Metallica,  Some Kind Of Monster (Live), rock_17.jpeg,  https://i.scdn.co/image/bd28ddb2a6973aa554c5aa1e161b1041a4d93aaa 
Metallica,  St. Anger, rock_18.jpeg,  https://i.scdn.co/image/97274b39ee9f3a9e60719a690ff743ab31dd6f62 
Metallica,  St. Anger, rock_19.jpeg,  https://i.scdn.co/image/e7c527d29e99edbae0318be381c4077a9272a6ea 
Metallica,  St. Anger, rock_20.jpeg,  https://i.scdn.co/image/cee5a66fedfd0fb41ac41742f2c26f46b6f73a67 
Metallica,  S & M, rock_21.jpeg,  https://i.scdn.co/image/3723111645cb827a1ee4a29364c7e4587dfee7e3 
Metallica,  S & M, rock_22.jpeg,  https://i.scdn.co/image/fdfaf41a921c4c55527d1f88cec0014fc04a32f8 
Metallica,  S&M, rock_23.jpeg,  https://i.scdn.co/image/390d4603d8c25a1635863fafd129e86560b2b60d 
Metallica,  Garage Inc., rock_24.jpeg,  https://i.scdn.co/image/807d725709ab669fa4ae0a064532dfe4b06da476 
Metallica,  Garage Inc., rock_25.jpeg,  https://i.scdn.co/image/b9bd225d69141727e50bc769f63d43c17ea3cf95 
Metallica,  Reload, rock_26.jpeg,  https://i.scdn.co/image/a63453a8316030516bdff6ae4add9d72a869d87b 
Metallica,  Reload, rock_27.jpeg,  https://i.scdn.co/image/e38198e475f0375704a88d86c682838dea616cf1 
Metallica,  Reload, rock_28.jpeg,  https://i.scdn.co/image/f0d7210ed0036b9a5a0cfb6208655d1560a1dd25 
Metallica,  Load, rock_29.jpeg,  https://i.scdn.co/image/ede7ac0c0896e39c8f26c8f24737aa1f1af4ef6b 
Metallica,  Load, rock_30.jpeg,  https://i.scdn.co/image/6ac1a523e3fdb90987efbdb69544787af3b907c3 
Metallica,  Load, rock_31.jpeg,  https://i.scdn.co/image/d5ff91dc73c9c4acce0a4068aafddc2bc57c4830 
Metallica,  Live Sh*t: Binge & Purge (Live In Mexico City), rock_32.jpeg,  https://i.scdn.co/image/498d2bae053b8e498a642ccbccb6ce05ef47b49c 
Metallica,  Live Sh*t: Binge & Purge (Live In Mexico City), rock_33.jpeg,  https://i.scdn.co/image/2ec984b25aa96f25de8766a822531e7e77e2175d 
Metallica,  Live S**t: Binge & Purge, rock_34.jpeg,  https://i.scdn.co/image/829a38926b5fbf3967fa0d3cffa749534b4ab0b4 
Metallica,  Metallica, rock_35.jpeg,  https://i.scdn.co/image/0dd4cf1837e63e212b1c2632226fce0c269e7153 
Metallica,  Metallica, rock_36.jpeg,  https://i.scdn.co/image/1e886ca74a1dc17b9a226283b9cc4b765ee25cb8 
Metallica,  Metallica, rock_37.jpeg,  https://i.scdn.co/image/deb44798f4a2fff65c62bf4ca2c9b0ebb4a7f5f2 
Metallica,  Master Of Puppets (Deluxe Box Set / Remastered), rock_38.jpeg,  https://i.scdn.co/image/1484dbc99d5bed82498d2eb536aa0117ad56b3ea 
Metallica,  Master of Puppets (Remastered Deluxe Box Set), rock_39.jpeg,  https://i.scdn.co/image/358a2fb145a535539c39a9f317541248bd173ac4 
Metallica,  Master Of Puppets (Remastered), rock_40.jpeg,  https://i.scdn.co/image/c16d6471e5e1a17a2c9fe9ba6f490ea290c31a6f 
Metallica,  Master Of Puppets (Remastered), rock_41.jpeg,  https://i.scdn.co/image/1484dbc99d5bed82498d2eb536aa0117ad56b3ea 
Metallica,  Master Of Puppets, rock_42.jpeg,  https://i.scdn.co/image/5bc8f5add5aa42632fdc5f66cf30cfde6bfd1025 
Metallica,  Master of Puppets (Remastered), rock_43.jpeg,  https://i.scdn.co/image/358a2fb145a535539c39a9f317541248bd173ac4 
Metallica,  Ride The Lightning (Deluxe / Remastered), rock_44.jpeg,  https://i.scdn.co/image/cd09b8b2c80f59a4159c2a34e1ec8ed0b18ee2d6 
Metallica,  Ride The Lightning (Deluxe / Remastered), rock_45.jpeg,  https://i.scdn.co/image/5f266bde27c766ea4925dde609c6b9db4aabb44e 
Metallica,  Ride The Lightning (Deluxe Remaster), rock_46.jpeg,  https://i.scdn.co/image/b56eb8fcc026c03907cc58b412435348738c48df 
Metallica,  Ride The Lightning (Remastered), rock_47.jpeg,  https://i.scdn.co/image/cd09b8b2c80f59a4159c2a34e1ec8ed0b18ee2d6 
Metallica,  Ride The Lightning (Remastered), rock_48.jpeg,  https://i.scdn.co/image/5f266bde27c766ea4925dde609c6b9db4aabb44e 
Metallica,  Ride The Lightning (Remastered), rock_49.jpeg,  https://i.scdn.co/image/b56eb8fcc026c03907cc58b412435348738c48df 
Metallica,  Kill 'Em All (Deluxe Remaster), rock_50.jpeg,  https://i.scdn.co/image/f968547e906c0a2b0916b78ac68f42edb3a2d71e 
Metallica,  Kill 'Em All (Deluxe / Remastered), rock_51.jpeg,  https://i.scdn.co/image/f84d460f16a8e2f113ef041c7142025a797f3930 
Metallica,  Kill 'Em All (Deluxe / Remastered), rock_52.jpeg,  https://i.scdn.co/image/3dec3d3474b257d0f07b57e017f72015e719f8b0 
Metallica,  Kill 'Em All (Remastered), rock_53.jpeg,  https://i.scdn.co/image/f84d460f16a8e2f113ef041c7142025a797f3930 
Metallica,  Kill 'Em All (Remastered), rock_54.jpeg,  https://i.scdn.co/image/3dec3d3474b257d0f07b57e017f72015e719f8b0 
Metallica,  Kill 'Em All (Remastered), rock_55.jpeg,  https://i.scdn.co/image/f968547e906c0a2b0916b78ac68f42edb3a2d71e 
Foo Fighters,  Concrete and Gold, rock_56.jpeg,  https://i.scdn.co/image/5840a2e94030104a5f34ecbd3d79541040566a97 
Foo Fighters,  Sonic Highways, rock_57.jpeg,  https://i.scdn.co/image/657c3f0ca4c89237ec6dcde06027369f05094e2f 
Foo Fighters,  Wasting Light, rock_58.jpeg,  https://i.scdn.co/image/13b3c650142254a1c9191a5cdda961ab051a2659 
Foo Fighters,  Wasting Light (Deluxe Version), rock_59.jpeg,  https://i.scdn.co/image/d99e8d30e9e16a9bb00107bb1a0719239e9ff67d 
Foo Fighters,  Skin And Bones, rock_60.jpeg,  https://i.scdn.co/image/a48f473bde07f3610efc28765626d7c99e3f7750 
Foo Fighters,  Skin And Bones, rock_61.jpeg,  https://i.scdn.co/image/638e69de6bd89953f5d21721c88de998d1a70098 
Foo Fighters,  In Your Honor, rock_62.jpeg,  https://i.scdn.co/image/b1bd8a1eed252877094236bb2131124d01b91815 
Foo Fighters,  One By One, rock_63.jpeg,  https://i.scdn.co/image/c51d8c7d50066b00cce1acc9ed176508dbf95930 
Foo Fighters,  One By One, rock_64.jpeg,  https://i.scdn.co/image/107218a31a13296f9a579a3466fb00c899bcafd5 
Foo Fighters,  One By One, rock_65.jpeg,  https://i.scdn.co/image/107218a31a13296f9a579a3466fb00c899bcafd5 
Foo Fighters,  One By One, rock_66.jpeg,  https://i.scdn.co/image/3cb99aefac8fa2dacc7e8ed2fe6d888ab19d712a 
Foo Fighters,  There Is Nothing Left To Lose, rock_67.jpeg,  https://i.scdn.co/image/ee5963d32f99547b8750a261957864c45ec02731 
Foo Fighters,  There Is Nothing Left To Lose, rock_68.jpeg,  https://i.scdn.co/image/90b8179b5a6785a8feaba72b8b634dc6f82aa6f1 
Foo Fighters,  The Colour And The Shape, rock_69.jpeg,  https://i.scdn.co/image/82ea041a0c8761445299da55e506995ca1697c29 
Foo Fighters,  The Colour And The Shape (Special Edition), rock_70.jpeg,  https://i.scdn.co/image/24516068add3b29f23e6ecb01d00e85668be2e87 
Foo Fighters,  Foo Fighters, rock_71.jpeg,  https://i.scdn.co/image/ed8981be29fdae9019e377f16b101c839f9555b6 
Queens of the Stone Age,  Villains, rock_72.jpeg,  https://i.scdn.co/image/e7405427a9b99100110c3fbe356d60bb82e1d440 
Queens of the Stone Age,  ...Like Clockwork, rock_73.jpeg,  https://i.scdn.co/image/8230534734ea7dead79f54a303801edc013024a5 
Queens of the Stone Age,  Rated R - Deluxe Edition, rock_74.jpeg,  https://i.scdn.co/image/f007e309f9a4533565e3b9f4096a86e7a1e8f28e 
Queens of the Stone Age,  Rated R - Deluxe Edition, rock_75.jpeg,  https://i.scdn.co/image/2d04050cde824acded4e2e9a58604b05183404c6 
Queens of the Stone Age,  Era Vulgaris Tour Edition (Canadian Tour Edition), rock_76.jpeg,  https://i.scdn.co/image/a1a0dfce2b682d4374722155932ec99cd854d745 
Queens of the Stone Age,  Era Vulgaris (Japan version), rock_77.jpeg,  https://i.scdn.co/image/2a34e39d73058d357a4bdc754bbe965274a44ece 
Queens of the Stone Age,  Era Vulgaris, rock_78.jpeg,  https://i.scdn.co/image/065c91f18a61a2fd8aa9c349ef82ae009726e9f9 
Queens of the Stone Age,  Era Vulgaris, rock_79.jpeg,  https://i.scdn.co/image/03307aa08ad3269d9fc454ef774345768bf44615 
Queens of the Stone Age,  Era Vulgaris, rock_80.jpeg,  https://i.scdn.co/image/9e62dcf271490edb98edce7c8c58c53c773fe183 
Queens of the Stone Age,  Era Vulgaris Tour Edition (International Version), rock_81.jpeg,  https://i.scdn.co/image/c29e7c2fe2dd01ce709a2611744ff6ad5d223df9 
Queens of the Stone Age,  Lullabies To Paralyze (International Version), rock_82.jpeg,  https://i.scdn.co/image/32d7a79175b5116fa6d59039c540fa20c148699c 
Queens of the Stone Age,  Lullabies To Paralyze, rock_83.jpeg,  https://i.scdn.co/image/d298995fc8084bd3ef57830880e89cfc77447072 
Queens of the Stone Age,  Lullabies To Paralyze (Explicit Version), rock_84.jpeg,  https://i.scdn.co/image/45ecde1b5dfa3e94a96d8270ba9c3da4ad3be53b 
Queens of the Stone Age,  Lullabies To Paralyze (Edited Version), rock_85.jpeg,  https://i.scdn.co/image/7a17dbb1efcb5562981d729a9fbe0eb2c7023ab0 
Queens of the Stone Age,  Lullabies To Paralyze, rock_86.jpeg,  https://i.scdn.co/image/edd2193f639967f7fbe9748ea988cea7029f27d0 
Queens of the Stone Age,  Lullabies To Paralyze (UK Only Version), rock_87.jpeg,  https://i.scdn.co/image/9312a4c0511395937fe18680383187ae83667bbc 
Queens of the Stone Age,  Songs For The Deaf (UK Version), rock_88.jpeg,  https://i.scdn.co/image/dc4bbf546091b5965c09c412c371e7b2afa7f847 
Queens of the Stone Age,  Songs For The Deaf, rock_89.jpeg,  https://i.scdn.co/image/ce2399f9d2078083c796baec06a4c8946104b2bf 
Queens of the Stone Age,  Songs For The Deaf, rock_90.jpeg,  https://i.scdn.co/image/d14c42fc1d6e9a9dde88f509f2c23b05fe76b314 
Queens of the Stone Age,  Songs For The Deaf, rock_91.jpeg,  https://i.scdn.co/image/dc3eb9767ddc225fc92b6aa7f8dbcaeaa8bbed2e 
Queens of the Stone Age,  Songs For The Deaf (Explicit Version), rock_92.jpeg,  https://i.scdn.co/image/0c039632ca3b9d5f374a328f2e625928726823a9 
Queens of the Stone Age,  Songs For The Deaf (International Explicit Version), rock_93.jpeg,  https://i.scdn.co/image/d924e754eb216b8f6a59c79a0ad42d9caf64818a 
Queens of the Stone Age,  Rated R, rock_94.jpeg,  https://i.scdn.co/image/736eb8520665f07e08fa523b7a116640935ce818 
Queens of the Stone Age,  Rated R, rock_95.jpeg,  https://i.scdn.co/image/155fd9c2a51fe34ed875f366ac388bef52303eed 
Queens of the Stone Age,  Queens of the Stone Age, rock_96.jpeg,  https://i.scdn.co/image/859501664409e4e9240b0040236ce58ff3d6c22a 
Green Day,  Revolution Radio, rock_97.jpeg,  https://i.scdn.co/image/f8aebe68df82729ac2d4c63fd2749ceaa316cff3 
Green Day,  Demolicious, rock_98.jpeg,  https://i.scdn.co/image/b5b4a6f82e94f5756c225b7df748d6ca7456b8ee 
Green Day,  ¡TRÉ!, rock_99.jpeg,  https://i.scdn.co/image/ab94f80054f34b69576c9608419c35b5817e221d 
Green Day,  ¡TRÉ!, rock_100.jpeg,  https://i.scdn.co/image/5586c297f9d5d904010c01c70e31448389aace36 
Green Day,  ¡DOS!, rock_101.jpeg,  https://i.scdn.co/image/ffdca6e89849fde0e673bb61ff11c2f929b222f6 
Green Day,  ¡DOS!, rock_102.jpeg,  https://i.scdn.co/image/bcad2da725658d74cf1d52ac1ea0c870527b527c 
Green Day,  ¡UNO!, rock_103.jpeg,  https://i.scdn.co/image/2b7b223a5e38de16f39f4edde7795a961c42b574 
Green Day,  ¡UNO!, rock_104.jpeg,  https://i.scdn.co/image/8d407273bae6f402e80907476f082a264151dc92 
Green Day,  ¡UNO!, rock_105.jpeg,  https://i.scdn.co/image/8d407273bae6f402e80907476f082a264151dc92 
Green Day,  21st Century Breakdown, rock_106.jpeg,  https://i.scdn.co/image/674099a68b30a3188ee213cd8ca260fa1daf00e9 
Green Day,  21st Century Breakdown, rock_107.jpeg,  https://i.scdn.co/image/674099a68b30a3188ee213cd8ca260fa1daf00e9 
Green Day,  21st Century Breakdown (DMD w/PDF), rock_108.jpeg,  https://i.scdn.co/image/674099a68b30a3188ee213cd8ca260fa1daf00e9 
Green Day,  21st Century Breakdown, rock_109.jpeg,  https://i.scdn.co/image/674099a68b30a3188ee213cd8ca260fa1daf00e9 
Green Day,  21st Century Breakdown (UK Deluxe pre-order), rock_110.jpeg,  https://i.scdn.co/image/674099a68b30a3188ee213cd8ca260fa1daf00e9 
Green Day,  Last Night On Earth [Live In Tokyo], rock_111.jpeg,  https://i.scdn.co/image/9d1607d7617cb4f2b71e2a2dd7ec13bce0fb929c 
Green Day,  American Idiot (Deluxe), rock_112.jpeg,  https://i.scdn.co/image/e5090800bd76b322e27636a1193955555120a2bb 
Green Day,  American Idiot (Regular Edition), rock_113.jpeg,  https://i.scdn.co/image/2027dbfec96249cdc12ff804738898afce24a7a5 
Green Day,  Shenanigans, rock_114.jpeg,  https://i.scdn.co/image/3276f6dad43cb9cc5c2da4bafd4701195726e028 
Green Day,  Warning, rock_115.jpeg,  https://i.scdn.co/image/99723e65221379b3dc5926b1685f1ff48ed94e90 
Green Day,  Nimrod, rock_116.jpeg,  https://i.scdn.co/image/7673522e8a3be3364f090b36a48d4a1f3d2d695e 
Green Day,  Insomniac, rock_117.jpeg,  https://i.scdn.co/image/dcd4225e58bf1666595a5ce1dd2c4317fc5561e5 
Green Day,  Dookie, rock_118.jpeg,  https://i.scdn.co/image/927a0b3a207f999eaf94aa1f9b92b8900c95e014 
Green Day,  Kerplunk! (U.S. Version), rock_119.jpeg,  https://i.scdn.co/image/7cd5e46da4e30ac7efe9932b6561b96ef6c83911 
Green Day,  Kerplunk, rock_120.jpeg,  https://i.scdn.co/image/053bbeb1e8dd20efde4aa0f9d9dd1b5ce67cbdfa 
Green Day,  Kerplunk, rock_121.jpeg,  https://i.scdn.co/image/46d2098bcfd4c5b23bd242c19348a35f81d0ee34 
Green Day,  1039/Smoothed Out Slappy Hours, rock_122.jpeg,  https://i.scdn.co/image/2415219c08c4476c65fae5ddfb849d8babf7e725 
Kings of Leon,  WALLS, rock_123.jpeg,  https://i.scdn.co/image/2fa0efbdb8fb12cfcdbcc876925ccf926232be5b 
Kings of Leon,  Mechanical Bull, rock_124.jpeg,  https://i.scdn.co/image/7396ed2b70d82edfc4164f7b91fd9d21caee97ce 
Kings of Leon,  Mechanical Bull (Deluxe Version), rock_125.jpeg,  https://i.scdn.co/image/c18148def1fc8e5b40ecf733dc41eefc47c8066e 
Kings of Leon,  Come Around Sundown, rock_126.jpeg,  https://i.scdn.co/image/b280e92fb5a39d5bacd41dca785eb2f7aa29cb26 
Kings of Leon,  Come Around Sundown, rock_127.jpeg,  https://i.scdn.co/image/68def583290f962f191ff420e5cc85539c4c266a 
Kings of Leon,  Come Around Sundown (Deluxe Edition), rock_128.jpeg,  https://i.scdn.co/image/786950959030796c86cc5edda07675926709ce92 
Kings of Leon,  Come Around Sundown (Deluxe Version), rock_129.jpeg,  https://i.scdn.co/image/68def583290f962f191ff420e5cc85539c4c266a 
Kings of Leon,  Only By The Night, rock_130.jpeg,  https://i.scdn.co/image/8efb25315084d6a01748deb0af455fa154775bda 
Kings of Leon,  Only By The Night, rock_131.jpeg,  https://i.scdn.co/image/a935b174468d4dba5e16680a738882def3a6363c 
Kings of Leon,  Live From SoHo, rock_132.jpeg,  https://i.scdn.co/image/0704cde3b7099e25ab03f4d16f9536ab5a05bc25 
Kings of Leon,  Because Of The Times, rock_133.jpeg,  https://i.scdn.co/image/02ccc70b89fb263a265b8a597dc23cd487139c8d 
Kings of Leon,  Because Of The Times, rock_134.jpeg,  https://i.scdn.co/image/371a2cccfcc46a221b2f084d41cf64674f6871aa 
Kings of Leon,  Because Of The Times, rock_135.jpeg,  https://i.scdn.co/image/6516785b2cd43bb173645935902e599b8fe98488 
Kings of Leon,  Because Of The Times, rock_136.jpeg,  https://i.scdn.co/image/681007fa58864dbeda1013f8c6ce1cb241aca108 
Kings of Leon,  Day Old Belgian Blues, rock_137.jpeg,  https://i.scdn.co/image/c2d147c28f740b1fcc9bbe99802742335d81adeb 
Kings of Leon,  Aha Shake Heartbreak, rock_138.jpeg,  https://i.scdn.co/image/26bdee2d3327a0aa22d2260145acefb2c8e01afb 
Kings of Leon,  Aha Shake Heartbreak, rock_139.jpeg,  https://i.scdn.co/image/a5d2241b5df4987a9a3031730edce5d7e30471f4 
Kings of Leon,  Aha Shake Heartbreak, rock_140.jpeg,  https://i.scdn.co/image/bab617d44e7db41290245465d6eed04a9181920d 
Kings of Leon,  Aha Shake Heartbreak, rock_141.jpeg,  https://i.scdn.co/image/a89d1b480b147415e1217a5ecaac06fc68f3f4c0 
Kings of Leon,  Aha Shake Heartbreak, rock_142.jpeg,  https://i.scdn.co/image/f48d2f75a5ac7d0f4c6808b8b5414645c73ecb6a 
Kings of Leon,  Aha Shake Heartbreak, rock_143.jpeg,  https://i.scdn.co/image/f48d2f75a5ac7d0f4c6808b8b5414645c73ecb6a 
Kings of Leon,  Youth And Young Manhood, rock_144.jpeg,  https://i.scdn.co/image/904cee65018c3f5ab258ab00d3cf710c205f1366 
Kings of Leon,  Youth And Young Manhood, rock_145.jpeg,  https://i.scdn.co/image/50052dd3c9c409ab29157a4912ee7dd7d4e2f76b 
Kings of Leon,  Youth And Young Manhood, rock_146.jpeg,  https://i.scdn.co/image/9f431875dd201421ffd3652ae05bafb3086eaeac 
Kings of Leon,  Youth And Young Manhood, rock_147.jpeg,  https://i.scdn.co/image/14ce9d3acf0450885c07c1dfc89ab1ca05a8d86b 
Kings of Leon,  Youth And Young Manhood, rock_148.jpeg,  https://i.scdn.co/image/904cee65018c3f5ab258ab00d3cf710c205f1366 
Kings of Leon,  Youth And Young Manhood, rock_149.jpeg,  https://i.scdn.co/image/a491e8df0c8fc8c585b1eda2e126ded0195a6909 
Royal Blood,  How Did We Get So Dark?, rock_150.jpeg,  https://i.scdn.co/image/9ccf4a8669fcd328d7288d4232518cf0cc0747f8 
Royal Blood,  Royal Blood, rock_151.jpeg,  https://i.scdn.co/image/95283dfdb1a58e4fd01dff2fc90fd1293d187897 
Royal Blood,  Royal Blood, rock_152.jpeg,  https://i.scdn.co/image/677b1f3ec3ca3dd72fb67cdb642fc27c34d0b3f1 
Royal Blood,  Royal Blood, rock_153.jpeg,  https://i.scdn.co/image/677b1f3ec3ca3dd72fb67cdb642fc27c34d0b3f1 
Red Hot Chili Peppers,  The Getaway, rock_154.jpeg,  https://i.scdn.co/image/8deed63f89e0a215e90de1ee5809780921a47747 
Red Hot Chili Peppers,  I'm With You, rock_155.jpeg,  https://i.scdn.co/image/66ab66e38e40a9202e8417a0b59ad86a210637a7 
Red Hot Chili Peppers,  Stadium Arcadium (U.S. Version), rock_156.jpeg,  https://i.scdn.co/image/fd62b1f4f697284a024784706949bff3a6e1a27e 
Red Hot Chili Peppers,  By The Way, rock_157.jpeg,  https://i.scdn.co/image/b14027718a46fb43d8c6d8c88092fba9f75d9d21 
Red Hot Chili Peppers,  By The Way (Deluxe Version), rock_158.jpeg,  https://i.scdn.co/image/b14027718a46fb43d8c6d8c88092fba9f75d9d21 
Red Hot Chili Peppers,  Californication, rock_159.jpeg,  https://i.scdn.co/image/260c7a6da14bb13a4cc9e75bf5b549fb87fa22a9 
Red Hot Chili Peppers,  Californication (Deluxe Version), rock_160.jpeg,  https://i.scdn.co/image/260c7a6da14bb13a4cc9e75bf5b549fb87fa22a9 
Red Hot Chili Peppers,  One Hot Minute, rock_161.jpeg,  https://i.scdn.co/image/8be0af1cf1c77db65874606af8b7a50f85cfae69 
Red Hot Chili Peppers,  One Hot Minute (Deluxe Version), rock_162.jpeg,  https://i.scdn.co/image/c21abf8489821a05c7cf7425a01b08cee1b501d8 
Red Hot Chili Peppers,  Blood Sugar Sex Magik (Deluxe Version), rock_163.jpeg,  https://i.scdn.co/image/5a6a1c6514398dc4004c6348a83d77694a3883d4 
Red Hot Chili Peppers,  Blood Sugar Sex Magik (U.S. Version), rock_164.jpeg,  https://i.scdn.co/image/5a6a1c6514398dc4004c6348a83d77694a3883d4 
Red Hot Chili Peppers,  Mother's Milk, rock_165.jpeg,  https://i.scdn.co/image/5e553d65e84fde60e3293ce2138a52e5f5b3ec10 
Red Hot Chili Peppers,  The Uplift Mofo Party Plan, rock_166.jpeg,  https://i.scdn.co/image/84bf42bcc130f847d44e5651f0bddd60f3152981 
Red Hot Chili Peppers,  The Uplift Mofo Party Plan, rock_167.jpeg,  https://i.scdn.co/image/d10dee89f572280b7a5b3b5086a4d492576f0c88 
Red Hot Chili Peppers,  Freaky Styley, rock_168.jpeg,  https://i.scdn.co/image/70eedbb4441396ba0aeb016379b8addf74761437 
Red Hot Chili Peppers,  Red Hot Chili Peppers, rock_169.jpeg,  https://i.scdn.co/image/650e2c461ef27144a18782eb377e6f99220492c8 
Red Hot Chili Peppers,  The Getaway, rock_170.jpeg,  https://i.scdn.co/image/8deed63f89e0a215e90de1ee5809780921a47747 
Red Hot Chili Peppers,  I'm With You, rock_171.jpeg,  https://i.scdn.co/image/66ab66e38e40a9202e8417a0b59ad86a210637a7 
Red Hot Chili Peppers,  Stadium Arcadium (U.S. Version), rock_172.jpeg,  https://i.scdn.co/image/fd62b1f4f697284a024784706949bff3a6e1a27e 
Red Hot Chili Peppers,  By The Way, rock_173.jpeg,  https://i.scdn.co/image/b14027718a46fb43d8c6d8c88092fba9f75d9d21 
Red Hot Chili Peppers,  By The Way (Deluxe Version), rock_174.jpeg,  https://i.scdn.co/image/b14027718a46fb43d8c6d8c88092fba9f75d9d21 
Red Hot Chili Peppers,  Californication, rock_175.jpeg,  https://i.scdn.co/image/260c7a6da14bb13a4cc9e75bf5b549fb87fa22a9 
Red Hot Chili Peppers,  Californication (Deluxe Version), rock_176.jpeg,  https://i.scdn.co/image/260c7a6da14bb13a4cc9e75bf5b549fb87fa22a9 
Red Hot Chili Peppers,  One Hot Minute, rock_177.jpeg,  https://i.scdn.co/image/8be0af1cf1c77db65874606af8b7a50f85cfae69 
Red Hot Chili Peppers,  One Hot Minute (Deluxe Version), rock_178.jpeg,  https://i.scdn.co/image/c21abf8489821a05c7cf7425a01b08cee1b501d8 
Red Hot Chili Peppers,  Blood Sugar Sex Magik (Deluxe Version), rock_179.jpeg,  https://i.scdn.co/image/5a6a1c6514398dc4004c6348a83d77694a3883d4 
Red Hot Chili Peppers,  Blood Sugar Sex Magik (U.S. Version), rock_180.jpeg,  https://i.scdn.co/image/5a6a1c6514398dc4004c6348a83d77694a3883d4 
Red Hot Chili Peppers,  Mother's Milk, rock_181.jpeg,  https://i.scdn.co/image/5e553d65e84fde60e3293ce2138a52e5f5b3ec10 
Red Hot Chili Peppers,  The Uplift Mofo Party Plan, rock_182.jpeg,  https://i.scdn.co/image/84bf42bcc130f847d44e5651f0bddd60f3152981 
Red Hot Chili Peppers,  The Uplift Mofo Party Plan, rock_183.jpeg,  https://i.scdn.co/image/d10dee89f572280b7a5b3b5086a4d492576f0c88 
Red Hot Chili Peppers,  Freaky Styley, rock_184.jpeg,  https://i.scdn.co/image/70eedbb4441396ba0aeb016379b8addf74761437 
Red Hot Chili Peppers,  Red Hot Chili Peppers, rock_185.jpeg,  https://i.scdn.co/image/650e2c461ef27144a18782eb377e6f99220492c8 
Thirty Seconds To Mars,  Commentary Album (Explicit), rock_186.jpeg,  https://i.scdn.co/image/adedbfc7a5fe1d8060da1e17a3a089e4066bbb2f 
Thirty Seconds To Mars,  LOVE LUST FAITH + DREAMS, rock_187.jpeg,  https://i.scdn.co/image/ff25ffab28fb73bffb54365fbafd34cd8ce06ded 
Thirty Seconds To Mars,  LOVE LUST FAITH + DREAMS, rock_188.jpeg,  https://i.scdn.co/image/ff25ffab28fb73bffb54365fbafd34cd8ce06ded 
Thirty Seconds To Mars,  LOVE LUST FAITH + DREAMS, rock_189.jpeg,  https://i.scdn.co/image/5541584ac360462a4ddb5c564dc2633028723b40 
Thirty Seconds To Mars,  LOVE LUST FAITH + DREAMS, rock_190.jpeg,  https://i.scdn.co/image/ea95aa9bc9b411fa9527cb47a442fd7b5eb57afa 
Thirty Seconds To Mars,  LOVE LUST FAITH + DREAMS, rock_191.jpeg,  https://i.scdn.co/image/1e1386992fc3757bcbfbc5cf4f7e8f9c1aa395f9 
Thirty Seconds To Mars,  LOVE LUST FAITH + DREAMS (Edited Version), rock_192.jpeg,  https://i.scdn.co/image/ff25ffab28fb73bffb54365fbafd34cd8ce06ded 
Thirty Seconds To Mars,  LOVE LUST FAITH + DREAMS, rock_193.jpeg,  https://i.scdn.co/image/5541584ac360462a4ddb5c564dc2633028723b40 
Thirty Seconds To Mars,  This Is War, rock_194.jpeg,  https://i.scdn.co/image/a2bfad83d3b89870eabf843e01a9e5d3eba7ea4c 
Thirty Seconds To Mars,  This Is War, rock_195.jpeg,  https://i.scdn.co/image/91ca9f4a3feef302bc955469ecb4c7d14d811dac 
Thirty Seconds To Mars,  This Is War, rock_196.jpeg,  https://i.scdn.co/image/91ca9f4a3feef302bc955469ecb4c7d14d811dac 
Thirty Seconds To Mars,  This Is War, rock_197.jpeg,  https://i.scdn.co/image/84ce824c5137fd96f018db464b33a36e7d09fd2b 
Thirty Seconds To Mars,  A Beautiful Lie, rock_198.jpeg,  https://i.scdn.co/image/6eaf63d14a68f49fe15597f4a2fb55d3f2251ed7 
Thirty Seconds To Mars,  A Beautiful Lie, rock_199.jpeg,  https://i.scdn.co/image/8446efaa818fa4675af99f48ea978f9de782cd95 
Thirty Seconds To Mars,  A Beautiful Lie (Brazilian Version), rock_200.jpeg,  https://i.scdn.co/image/dbf5058d38af34468df23b3135cf81715dbb6d31 
Thirty Seconds To Mars,  30 Seconds To Mars, rock_201.jpeg,  https://i.scdn.co/image/b709893c7ab7b502de0a19b8bfa33247dc557752 
Incubus,  8, rock_202.jpeg,  https://i.scdn.co/image/81358c6e5e3da4ac6b3ba7cd03fe237c18546238 
Incubus,  8, rock_203.jpeg,  https://i.scdn.co/image/be21d6d2a18632812991afa73667dc478238a9a1 
Incubus,  The Essential Incubus, rock_204.jpeg,  https://i.scdn.co/image/59a536f0bf0ddaa427e4c732a061c33fe7578757 
Incubus,  The Essential Incubus, rock_205.jpeg,  https://i.scdn.co/image/77d6b53062c0a9d12839708501977b219955e838 
Incubus,  Incubus HQ Live, rock_206.jpeg,  https://i.scdn.co/image/3c7c72baaee7fb020a8d64b8996be78d221ad2c4 
Incubus,  Incubus HQ Live Deluxe Edition, rock_207.jpeg,  https://i.scdn.co/image/3e30af00f7d00291a6ac80afa360e97ac25e4126 
Incubus,  Monuments And Melodies, rock_208.jpeg,  https://i.scdn.co/image/7c1338ca0fbdb6e829b9d3a7b899d7e1e17b2c80 
Incubus,  Monuments And Melodies, rock_209.jpeg,  https://i.scdn.co/image/765efc627aba8fb9529bfad29c1d1ef35c28c339 
Incubus,  Monuments And Melodies, rock_210.jpeg,  https://i.scdn.co/image/a5147dda73f2fec1dfaa7047886a169d3a9aafe4 
Incubus,  Light Grenades, rock_211.jpeg,  https://i.scdn.co/image/a7f3336043c5525ecf743c6ab837691cf9903197 
Incubus,  Light Grenades, rock_212.jpeg,  https://i.scdn.co/image/a7f3336043c5525ecf743c6ab837691cf9903197 
Incubus,  Light Grenades, rock_213.jpeg,  https://i.scdn.co/image/a7f3336043c5525ecf743c6ab837691cf9903197 
