Oasis,  (What's The Story) Morning Glory? (Remastered), rock_462.jpeg,  https://i.scdn.co/image/54042a0dfa97fada8c3d80e07494ebae1ea67d27 
Oasis,  (What's the Story) Morning Glory? (Remastered), rock_463.jpeg,  https://i.scdn.co/image/52137b2c4850dbb6e0683ab2d4beaff86abf832b 
Oasis,  Definitely Maybe (Remastered), rock_464.jpeg,  https://i.scdn.co/image/6786e3bc40deb7b4aa1f5682fd1c9adb23c9f5ae 
Oasis,  Definitely Maybe (Remastered), rock_465.jpeg,  https://i.scdn.co/image/6786e3bc40deb7b4aa1f5682fd1c9adb23c9f5ae 
Oasis,  Definitely Maybe, rock_466.jpeg,  https://i.scdn.co/image/cada11a2c7fe821de51162eb0aa33ef80b32581c 
Oasis,  Definitely Maybe (Remastered) [Deluxe Version], rock_467.jpeg,  https://i.scdn.co/image/0f3d59aef7581cbfcf03983c480558eee7daeaf5 
Oasis,  Definitely Maybe (Remastered) [Deluxe Edition], rock_468.jpeg,  https://i.scdn.co/image/91de83ad5c99c0dafa48e0bd1225832ecf69a58a 
Oasis,  Definitely Maybe (Remastered), rock_469.jpeg,  https://i.scdn.co/image/91de83ad5c99c0dafa48e0bd1225832ecf69a58a 
Oasis,  Definitely Maybe (Remastered), rock_470.jpeg,  https://i.scdn.co/image/0d11b88320846914f730d61495c1ac1b3bfead96 
Oasis,  Definitely Maybe (Remastered Deluxe), rock_471.jpeg,  https://i.scdn.co/image/d767ba00684c1e5d43d2964d74b6a842f31f5664 
Oasis,  Definitely Maybe (Remastered) [Deluxe Version], rock_472.jpeg,  https://i.scdn.co/image/9edc6c4f462cdda2dc9509393f7b0d14e7520e48 
Oasis,  DEFINITELY MAYBE, rock_473.jpeg,  https://i.scdn.co/image/74a3bea3700c880cd5e2e7cf351ef0f262379051 
Oasis,  Definitely Maybe, rock_474.jpeg,  https://i.scdn.co/image/04493b4537452a70f61a63295764c82de887dcfe 
Oasis,  Definitely Maybe (Remastered), rock_475.jpeg,  https://i.scdn.co/image/0f3d59aef7581cbfcf03983c480558eee7daeaf5 
Oasis,  Definitely Maybe (Remastered), rock_476.jpeg,  https://i.scdn.co/image/0d11b88320846914f730d61495c1ac1b3bfead96 
Oasis,  Definitely Maybe (Remastered), rock_477.jpeg,  https://i.scdn.co/image/9edc6c4f462cdda2dc9509393f7b0d14e7520e48 
Oasis,  Stop The Clocks, rock_478.jpeg,  https://i.scdn.co/image/ce5870af2b8882c36a4d08006d4d61bf6bb7c7fc 
Papa Roach,  Crooked Teeth (Deluxe Version), rock_479.jpeg,  https://i.scdn.co/image/264a159950e7cca4f7b2fde1e38d991681218676 
Papa Roach,  Crooked Teeth (Deluxe), rock_480.jpeg,  https://i.scdn.co/image/3abbbb6c65519b3701cde442b321c105112c22d3 
Papa Roach,  F.E.A.R. (Deluxe Edition), rock_481.jpeg,  https://i.scdn.co/image/a74f492f62896fdbfcee8b6b4a29ff6baf62f65c 
Papa Roach,  F.E.A.R. - Commentary, rock_482.jpeg,  https://i.scdn.co/image/596b3f9b93928bd17d3975d683a9d9462ceb7391 
Papa Roach,  F.E.A.R., rock_483.jpeg,  https://i.scdn.co/image/012486298de81ebbc3fa8cd7ca8dd9c5e7904738 
Papa Roach,  F.E.A.R., rock_484.jpeg,  https://i.scdn.co/image/91f717965585aebfc4c9d312036ceef83c832ee0 
Papa Roach,  F.E.A.R., rock_485.jpeg,  https://i.scdn.co/image/596b3f9b93928bd17d3975d683a9d9462ceb7391 
Papa Roach,  The Connection (Deluxe Edition), rock_486.jpeg,  https://i.scdn.co/image/1f9ff98815222857c2d4d7e78d96839754a5747e 
Papa Roach,  The Connection, rock_487.jpeg,  https://i.scdn.co/image/6d7cc72b4378908dd40e4cadd01e20007cd02b3d 
Papa Roach,  The Connection, rock_488.jpeg,  https://i.scdn.co/image/cc17e88e5b05affa14e7ad7d7cfee0dabfcd7def 
Papa Roach,  Metamorphosis, rock_489.jpeg,  https://i.scdn.co/image/23f23645954a40a3c75a59d91ebaa20b6526b83b 
Papa Roach,  Metamorphosis, rock_490.jpeg,  https://i.scdn.co/image/59717ca314f5612ae773750242c6496d4291f679 
Papa Roach,  The Paramour Sessions, rock_491.jpeg,  https://i.scdn.co/image/d2b8269e7e92ca97b733a55bd42291915879bed0 
Papa Roach,  The Paramour Sessions, rock_492.jpeg,  https://i.scdn.co/image/0c1b6fd590816757b472736d9720a9d07de70761 
Papa Roach,  The Paramour Sessions, rock_493.jpeg,  https://i.scdn.co/image/97274fbb0a21ff2f5da88502ed62ecd49924fe16 
Papa Roach,  The Paramour Sessions (International Version), rock_494.jpeg,  https://i.scdn.co/image/f7a4addedc7872ae99bbe28f6fa6e9a5ae225b19 
Papa Roach,  The Paramour Sessions (Latin American Version), rock_495.jpeg,  https://i.scdn.co/image/93ebf424c31288a71dda532d8aea1ad958690154 
Papa Roach,  The Paramour Sessions (UK Version), rock_496.jpeg,  https://i.scdn.co/image/f7a4addedc7872ae99bbe28f6fa6e9a5ae225b19 
Papa Roach,  Getting Away With Murder (International Tour Edition), rock_497.jpeg,  https://i.scdn.co/image/41d30f4446879462b9ca150e256b6c4220417548 
Papa Roach,  Getting Away With Murder (Expanded Edition), rock_498.jpeg,  https://i.scdn.co/image/fc5a273afbd2639ed5ee77dd392d6d2c4b86e579 
Papa Roach,  Getting Away With Murder (Expanded Edition), rock_499.jpeg,  https://i.scdn.co/image/8dea8438172b050495485010d99c12347d244b1f 
Papa Roach,  Getting Away With Murder, rock_500.jpeg,  https://i.scdn.co/image/11ec090b6190ca0e8251e3a5f588e559b112192c 
Papa Roach,  Infest, rock_501.jpeg,  https://i.scdn.co/image/564521a9305a3b2bbb9e184d0a650162c038e1a8 
Papa Roach,  Infest, rock_502.jpeg,  https://i.scdn.co/image/c767fe7e96066992ed8901ac9e55efeb31d0e9b6 
Papa Roach,  Infest, rock_503.jpeg,  https://i.scdn.co/image/eae7ff9b44595bcc1802f2fe857b77ef027d7dcf 
Papa Roach,  Infest (UK Version), rock_504.jpeg,  https://i.scdn.co/image/a9366091b298eb9a738ee0936616b5583bf3a398 
Pearl Jam,  Let's Play Two (Live / Original Motion Picture Soundtrack), rock_505.jpeg,  https://i.scdn.co/image/cd2b9a3e019c80664b8f14fecaefb67f29715e4c 
Pearl Jam,  Let's Play Two (Live / Original Motion Picture Soundtrack), rock_506.jpeg,  https://i.scdn.co/image/d3848409c73388d5efd2c2a72592227994293e04 
Pearl Jam,  Lightning Bolt, rock_507.jpeg,  https://i.scdn.co/image/accc94d0e8bc2dab31bc38c1af0d5ba580602506 
Pearl Jam,  Lightning Bolt, rock_508.jpeg,  https://i.scdn.co/image/a3d1ccd6c9ef4e9d12b8ef79a7e04b536513e062 
Pearl Jam,  Backspacer, rock_509.jpeg,  https://i.scdn.co/image/892431f169fc465814053353dd170ccee72af5b5 
Pearl Jam,  Backspacer, rock_510.jpeg,  https://i.scdn.co/image/892431f169fc465814053353dd170ccee72af5b5 
Pearl Jam,  Backspacer, rock_511.jpeg,  https://i.scdn.co/image/892431f169fc465814053353dd170ccee72af5b5 
Pearl Jam,  Backspacer, rock_512.jpeg,  https://i.scdn.co/image/eeb8242eccfcf21c7f299295a5fec10b163f26e3 
Pearl Jam,  Backspacer (Japanese Version), rock_513.jpeg,  https://i.scdn.co/image/892431f169fc465814053353dd170ccee72af5b5 
Pearl Jam,  Backspacer, rock_514.jpeg,  https://i.scdn.co/image/892431f169fc465814053353dd170ccee72af5b5 
Pearl Jam,  Pearl Jam, rock_515.jpeg,  https://i.scdn.co/image/cd82c5cea34df662f00d88af6dffbd49e1413bfb 
Pearl Jam,  Pearl Jam (2017 Mix), rock_516.jpeg,  https://i.scdn.co/image/cd82c5cea34df662f00d88af6dffbd49e1413bfb 
Pearl Jam,  Riot Act, rock_517.jpeg,  https://i.scdn.co/image/ef2d621c1ca876e1b9ad2b76dd64c3e6ea225b78 
Pearl Jam,  Binaural, rock_518.jpeg,  https://i.scdn.co/image/e7297e9738ceaf313a2ed6e906035863602a036b 
Pearl Jam,  Binaural, rock_519.jpeg,  https://i.scdn.co/image/1c81838ceed8851c37adb3456a53fa35e46f2daf 
Pearl Jam,  Yield, rock_520.jpeg,  https://i.scdn.co/image/4c609573bbdf52586205f3a63ce50c9e01c8d656 
Pearl Jam,  Yield, rock_521.jpeg,  https://i.scdn.co/image/77c17804f5bcb51a93aed3b4e86a7881644d1fdb 
Pearl Jam,  No Code, rock_522.jpeg,  https://i.scdn.co/image/21c1def8608845536129720866d14294e19b4d87 
Pearl Jam,  Spin The Black Circle Live In Seattle '95, rock_523.jpeg,  https://i.scdn.co/image/a61e331a87f008cb2720d753aa3c14f700e68a6e 
Pearl Jam,  Vitalogy, rock_524.jpeg,  https://i.scdn.co/image/e398cd73e2c4de189d712adcd14f4f454f89f9d7 
Pearl Jam,  Vs., rock_525.jpeg,  https://i.scdn.co/image/36218136f9e645d979ee3a1a5b3abb6c386571b6 
Pearl Jam,  Ten Redux, rock_526.jpeg,  https://i.scdn.co/image/3276265827c8190a7569227bdd7029e357cab0c2 
Pearl Jam,  Ten, rock_527.jpeg,  https://i.scdn.co/image/425e1fef6d70a48a103dfd168a556b7f72f72865 
Rage Against The Machine,  Renegades, rock_528.jpeg,  https://i.scdn.co/image/3c9c017c3df6735e2f76b2e7dd6c6e7c709a179f 
Rage Against The Machine,  Live at the Grand Olympic Auditorium, rock_529.jpeg,  https://i.scdn.co/image/4840f4993cf0cfc15b4c3134420c35258e4a7fef 
Rage Against The Machine,  The Battle Of Los Angeles, rock_530.jpeg,  https://i.scdn.co/image/d36b38316f7c9f8c6e3b66305811fe5ae1517b1a 
Rage Against The Machine,  Evil Empire, rock_531.jpeg,  https://i.scdn.co/image/d78afcdcd80e39d229bf3360b86111dd9b8c441c 
Rage Against The Machine,  Irvine Meadows (17 June '95) [Remastered] [Live], rock_532.jpeg,  https://i.scdn.co/image/35a375d546fa085f94f0f3a3e20bc960c6acee98 
Rage Against The Machine,  Rage Against The Machine, rock_533.jpeg,  https://i.scdn.co/image/5f60f693d1eab3e00166ade80b32dc1143347e2c 
Rage Against The Machine,  Rage Against The Machine - XX (20th Anniversary Special Edition), rock_534.jpeg,  https://i.scdn.co/image/85236cc12312fac9405206c25bd38479e63a04d6 
Rise Against,  Wolves, rock_535.jpeg,  https://i.scdn.co/image/185de62775573a18d5f3767f90291cd572a24f66 
Rise Against,  Wolves, rock_536.jpeg,  https://i.scdn.co/image/60008e46598d78631331045938dc156676b0d50b 
Rise Against,  Wolves, rock_537.jpeg,  https://i.scdn.co/image/185de62775573a18d5f3767f90291cd572a24f66 
Rise Against,  The Black Market, rock_538.jpeg,  https://i.scdn.co/image/6c2b0d963024997558a81994c3efe03e1e27db5d 
Rise Against,  The Black Market, rock_539.jpeg,  https://i.scdn.co/image/6c2b0d963024997558a81994c3efe03e1e27db5d 
Rise Against,  The Black Market, rock_540.jpeg,  https://i.scdn.co/image/3fea18f13d34a1572f0dac18cb7e4f4cab027aa0 
Rise Against,  Rpm10, rock_541.jpeg,  https://i.scdn.co/image/1a79de6d30efa7760ca934cce185c2c5867ce03e 
Rise Against,  Rpm10, rock_542.jpeg,  https://i.scdn.co/image/8d8be811845e906b0fd31e97fdb765cdd2405ad7 
Rise Against,  Long Forgotten Songs: B-Sides & Covers 2000-2013, rock_543.jpeg,  https://i.scdn.co/image/19e23bfd694d17de6aa7c7518236fcf9a4ed1f92 
Rise Against,  Long Forgotten Songs: B-Sides & Covers 2000-2013, rock_544.jpeg,  https://i.scdn.co/image/ce62ab9756755b9e766540df612b9b9a5f542da9 
Rise Against,  Endgame / Appeal To Reason / Siren Song Of The Counter Culture / The Sufferer & The Witness, rock_545.jpeg,  https://i.scdn.co/image/d04a3b3aa700cd6712d66cf9ba9339e5cd71b8ef 
Rise Against,  Endgame / Appeal To Reason / Siren Song Of The Counter Culture / The Sufferer & The Witness, rock_546.jpeg,  https://i.scdn.co/image/77dcb50115820514b198cd2eec8ea2b92277b525 
Rise Against,  Endgame, rock_547.jpeg,  https://i.scdn.co/image/b506968a958ad390518c3d9e4f45e79cf3b64be1 
Rise Against,  Endgame, rock_548.jpeg,  https://i.scdn.co/image/db417fb79878f4b62bf0bbee58d7409eb7b58d81 
Rise Against,  Appeal To Reason, rock_549.jpeg,  https://i.scdn.co/image/1e20b659e0ad162ef57b7a9eb3461556ba47fab8 
Rise Against,  Appeal To Reason, rock_550.jpeg,  https://i.scdn.co/image/9821a760f8bc0dc59f186ee184c624e5fe51abb2 
Rise Against,  Appeal To Reason (International Version), rock_551.jpeg,  https://i.scdn.co/image/0cce32ecc97b1bc19d454f5575c46e08303bc9de 
Rise Against,  The Sufferer & The Witness, rock_552.jpeg,  https://i.scdn.co/image/cd709f1586aa9f00d283874f35710eb8a1007646 
Rise Against,  The Sufferer & The Witness, rock_553.jpeg,  https://i.scdn.co/image/8d137e62ecdbe4e76b04f1b73bc882e1bcf71e5f 
Rise Against,  The Sufferer & The Witness, rock_554.jpeg,  https://i.scdn.co/image/deb0845eb2913bc4a10cd1ce7fe0ded2974600c4 
Rise Against,  The Sufferer & The Witness, rock_555.jpeg,  https://i.scdn.co/image/f5ac1ade923d3da5990e2c9c193ba62977b6fb92 
Rise Against,  The Sufferer & The Witness, rock_556.jpeg,  https://i.scdn.co/image/97b1b3da33cd4e0cd63932e79a6b1b2f32bfee33 
Rise Against,  The Sufferer & The Witness, rock_557.jpeg,  https://i.scdn.co/image/ec14df19b819adb23a149612234e182cd78df25a 
Rise Against,  Siren Song Of The Counter-Culture, rock_558.jpeg,  https://i.scdn.co/image/8bd92d3256a5f5ce9dd793684452c1121368b91e 
Rise Against,  Siren Song Of The Counter-Culture (Japan Version / International Version), rock_559.jpeg,  https://i.scdn.co/image/021f9e330f30ccd802f23b05bf7c87ad8b2389db 
Rise Against,  Siren Song Of The Counter-Culture (Japan Version / International Version), rock_560.jpeg,  https://i.scdn.co/image/3d0e67e3458c4d0bc851670db9a244361abee147 
Rise Against,  Revolutions Per Minute, rock_561.jpeg,  https://i.scdn.co/image/764d8f9ab43779c4a349ba3d741ead0bc252d9a7 
Rise Against,  The Unraveling, rock_562.jpeg,  https://i.scdn.co/image/a14ffcde2fe4d59e3458b500aa30b885c59f4c79 
Rise Against,  The Unraveling (Re-Issue), rock_563.jpeg,  https://i.scdn.co/image/a01732f995030b262bccb7709b3708d7b126c89c 
The Smashing Pumpkins,  Monuments To An Elegy, rock_564.jpeg,  https://i.scdn.co/image/9bff78d4d1d2455c98ce1eaaee3acd92763d67ff 
The Smashing Pumpkins,  Oceania, rock_565.jpeg,  https://i.scdn.co/image/5b3a90dc919c87abd58b1d63944431a169165b1c 
The Smashing Pumpkins,  Machina / The Machines Of God, rock_566.jpeg,  https://i.scdn.co/image/d77470ce39ca532aa6e63abb955193a47758b985 
The Smashing Pumpkins,  Adore (2014 Remaster), rock_567.jpeg,  https://i.scdn.co/image/dc7b67318832d638f27f826f42e0b48dca85eb5a 
The Smashing Pumpkins,  Adore (2014 Remaster), rock_568.jpeg,  https://i.scdn.co/image/8f18915c1ff113bac89d67f2fa4f412d7fbecc5a 
The Smashing Pumpkins,  Mellon Collie and the Infinite Sadness (2012 - Remaster), rock_569.jpeg,  https://i.scdn.co/image/5281fb40593e18fcacb40daac1d455dc1777e072 
The Smashing Pumpkins,  Pisces Iscariot (2012 - Remaster), rock_570.jpeg,  https://i.scdn.co/image/5af2c262e227db33308fb3bb59259d5a69e5c7a8 
The Smashing Pumpkins,  Siamese Dream (2011 - Remaster), rock_571.jpeg,  https://i.scdn.co/image/0139b7d3d070df2f78f6ff5fbd92e5a1e20b127c 
The Smashing Pumpkins,  Siamese Dream (2011 - Remaster), rock_572.jpeg,  https://i.scdn.co/image/ce86657031d042f221b0ab7e4c09ff0655cf8f59 
The Smashing Pumpkins,  Gish (2011 - Remaster), rock_573.jpeg,  https://i.scdn.co/image/b16109cfee4239ef5e68e9a36c3d7e1b8805852e 
The Smashing Pumpkins,  Gish, rock_574.jpeg,  https://i.scdn.co/image/c7cae12c9f40c822f0f2ce3a3bfa9cd45dc9481a 
Three Days Grace,  Human, rock_575.jpeg,  https://i.scdn.co/image/3a5c755f77be1fa8c3569a731da7ad77cb5ab6dd 
Three Days Grace,  Human, rock_576.jpeg,  https://i.scdn.co/image/e6406c1031d1869d551680e5a47ab4af29f7f07c 
Three Days Grace,  Transit Of Venus, rock_577.jpeg,  https://i.scdn.co/image/304346fdd3ba2ac08a60ff5d0bef757ad3fd9280 
Three Days Grace,  Life Starts Now, rock_578.jpeg,  https://i.scdn.co/image/aef7b737c64d94f7d35ba221b76682c78f02172f 
Three Days Grace,  Life Starts Now, rock_579.jpeg,  https://i.scdn.co/image/f893f9439b098a93e28e5dda004bb0dd7b063170 
Three Days Grace,  Life Starts Now, rock_580.jpeg,  https://i.scdn.co/image/0c1b65e11f846eece7f25442df9b104ff2dd8221 
Three Days Grace,  Three Days Grace (Deluxe Version), rock_581.jpeg,  https://i.scdn.co/image/3e8d606984416611844a7c95cfcc78d1a51ea4cc 
Three Days Grace,  One-X, rock_582.jpeg,  https://i.scdn.co/image/05c2e50a55edbf11d1e760f3d36d6aee1f471c35 
Three Days Grace,  One-X, rock_583.jpeg,  https://i.scdn.co/image/fdbdf54c69e505c617b128d19e670d753573add6 
Three Days Grace,  Three Days Grace, rock_584.jpeg,  https://i.scdn.co/image/3e8d606984416611844a7c95cfcc78d1a51ea4cc 
Three Days Grace,  Three Days Grace, rock_585.jpeg,  https://i.scdn.co/image/3e8d606984416611844a7c95cfcc78d1a51ea4cc 
Stone Temple Pilots,  Core (Super Deluxe Edition), rock_586.jpeg,  https://i.scdn.co/image/3f3d3acdc4290356a2d7a35dd88de23e4cd03303 
Stone Temple Pilots,  Stone Temple Pilots, rock_587.jpeg,  https://i.scdn.co/image/f1d298a03e0cfa7ee81a7e0076f04e436ff0974b 
Stone Temple Pilots,  Stone Temple Pilots, rock_588.jpeg,  https://i.scdn.co/image/f1d298a03e0cfa7ee81a7e0076f04e436ff0974b 
Stone Temple Pilots,  Stone Temple Pilots (Deluxe), rock_589.jpeg,  https://i.scdn.co/image/8f80e51fc58f845e51cb0a6f358608b18cf64d23 
Stone Temple Pilots,  Shangri-LA DEE DA, rock_590.jpeg,  https://i.scdn.co/image/d256d80bed280a075f72325e01c3f94c7eafd230 
Stone Temple Pilots,  No. 4, rock_591.jpeg,  https://i.scdn.co/image/5143e9fd07529b6dc4165d35f261fc1a12bd3736 
Stone Temple Pilots,  Tiny Music...Songs From The Vatican Gift Shop, rock_592.jpeg,  https://i.scdn.co/image/92fd4336229c7366ffad21af0185ddb58f7ce3b6 
Stone Temple Pilots,  Purple, rock_593.jpeg,  https://i.scdn.co/image/9544e5967a8c1bf456193523daf0d080155b95e4 
Stone Temple Pilots,  Core, rock_594.jpeg,  https://i.scdn.co/image/ff71d87f1851d43bac44a37da93bcb2a21a7c103 
Stone Temple Pilots,  Core (Remastered), rock_595.jpeg,  https://i.scdn.co/image/3f3d3acdc4290356a2d7a35dd88de23e4cd03303 
The White Stripes,  Under Great White Northern Lights, rock_596.jpeg,  https://i.scdn.co/image/f798e7e0a44c5435a0a9d1498fb0c189e8bd9999 
The White Stripes,  Under Great White Northern Lights, rock_597.jpeg,  https://i.scdn.co/image/702c45740debbf4be1949de64279406c147e3142 
The White Stripes,  Icky Thump, rock_598.jpeg,  https://i.scdn.co/image/b2cf57e292961ac1c5beaf369786abc0322d898d 
The White Stripes,  Icky Thump, rock_599.jpeg,  https://i.scdn.co/image/e5cf9a7071c5132e6f150f21520851857af0222c 
The White Stripes,  Get Behind Me Satan, rock_600.jpeg,  https://i.scdn.co/image/97130661ec51fa8a325678044deacb1529c2915f 
The White Stripes,  Get Behind Me Satan, rock_601.jpeg,  https://i.scdn.co/image/d1f56ac0d045ca980d28cc4cc926fbb353cffaa0 
The White Stripes,  Get Behind Me Satan, rock_602.jpeg,  https://i.scdn.co/image/ac718619172b6b864a19a909f05b9c4f94c455d6 
The White Stripes,  Get Behind Me Satan, rock_603.jpeg,  https://i.scdn.co/image/ac718619172b6b864a19a909f05b9c4f94c455d6 
The White Stripes,  Elephant, rock_604.jpeg,  https://i.scdn.co/image/5eb63fa378e1221f2d7083fe149b8a067d3737ab 
The White Stripes,  Elephant, rock_605.jpeg,  https://i.scdn.co/image/87d0205a5fff8d8e128d55d02b7e2788231d6095 
The White Stripes,  Elephant, rock_606.jpeg,  https://i.scdn.co/image/b9ff83c29bd0a00b8e179183615e1588500fcb92 
The White Stripes,  White Blood Cells, rock_607.jpeg,  https://i.scdn.co/image/5a136dec5ceb728f84580622abe769421b75c465 
The White Stripes,  White Blood Cells, rock_608.jpeg,  https://i.scdn.co/image/b8e373d85224dedbccd36fd124d25bc7174c85f5 
The White Stripes,  White Blood Cells, rock_609.jpeg,  https://i.scdn.co/image/b599e1b25d4bccb81b88cc1cb21770b59f027884 
The White Stripes,  De Stijl, rock_610.jpeg,  https://i.scdn.co/image/cc77ae9aded4029862ec3b91cd71a145bf1ebd0f 
The White Stripes,  De Stijl, rock_611.jpeg,  https://i.scdn.co/image/f5565d636783afaf4981efa4e9b1bf19e3c98175 
The White Stripes,  De Stijl, rock_612.jpeg,  https://i.scdn.co/image/533889fc097dc41af1237680a76d0e65fe319b8a 
The White Stripes,  The White Stripes, rock_613.jpeg,  https://i.scdn.co/image/15ab3673f5491ba8b858e042d342186816e67fc0 
The White Stripes,  The White Stripes, rock_614.jpeg,  https://i.scdn.co/image/ba42886df7c3e953a050d847f4228d87b74fc200 
The White Stripes,  The White Stripes, rock_615.jpeg,  https://i.scdn.co/image/ce30e7f86f097729dc08c446b2da0a95fbd3850d 
Breaking Benjamin,  Dark Before Dawn, rock_616.jpeg,  https://i.scdn.co/image/2886e34fd3ceaf11c6f5873809f5869d72706947 
Breaking Benjamin,  Dark Before Dawn, rock_617.jpeg,  https://i.scdn.co/image/25a2f074fa2d1f983e23dba8fd9c6c0bf0f42193 
Breaking Benjamin,  Shallow Bay: The Best Of Breaking Benjamin (Explicit), rock_618.jpeg,  https://i.scdn.co/image/8328345a83c7e13709cf904a8053c888323907cd 
Breaking Benjamin,  Shallow Bay: The Best Of Breaking Benjamin (Explicit), rock_619.jpeg,  https://i.scdn.co/image/d5594899a9ed44378042cf33d5a8c79e342cc57e 
Breaking Benjamin,  Shallow Bay: The Best Of Breaking Benjamin (Clean), rock_620.jpeg,  https://i.scdn.co/image/4de608b696e8094db647c8165279144ca6274ad9 
Breaking Benjamin,  Shallow Bay: The Best Of Breaking Benjamin Deluxe Edition (Explicit), rock_621.jpeg,  https://i.scdn.co/image/8b092fd96684275e3791cbdd4ff7bc30f255a63c 
Breaking Benjamin,  Shallow Bay: The Best Of Breaking Benjamin Deluxe Edition (Explicit), rock_622.jpeg,  https://i.scdn.co/image/96a4b2c7b785b82fc251ffb621e4184b27b5286c 
Breaking Benjamin,  Shallow Bay: The Best Of Breaking Benjamin Deluxe Edition (Clean), rock_623.jpeg,  https://i.scdn.co/image/80c13adcbf0213f9d4ffe3c52d316ca5d2c63d3e 
Breaking Benjamin,  Breaking Benjamin: Digital Box Set, rock_624.jpeg,  https://i.scdn.co/image/ef4ee510ac7bfedc1ed54c924dc2c51fb17ffe6b 
Breaking Benjamin,  Dear Agony, rock_625.jpeg,  https://i.scdn.co/image/ad4b7a621db877f249bf1f24dc19cb00d9147b5c 
Breaking Benjamin,  Dear Agony, rock_626.jpeg,  https://i.scdn.co/image/62503337bce943a7264d8c2d9dd7ff1570e4aa4b 
Breaking Benjamin,  Phobia, rock_627.jpeg,  https://i.scdn.co/image/b0fa9fc6434ddfa8c2855cc372f7c8f1dc9c5aa6 
Breaking Benjamin,  Phobia, rock_628.jpeg,  https://i.scdn.co/image/ff9f677b4f3fba51d1a2e507acc2174e0fa814d2 
Breaking Benjamin,  Phobia, rock_629.jpeg,  https://i.scdn.co/image/f5833bfb97bd059b2377e2072e231a4f7870f281 
Breaking Benjamin,  Phobia (Clean Version), rock_630.jpeg,  https://i.scdn.co/image/60f9b69aa68780b33f9a6f873e628da0e05b735b 
Breaking Benjamin,  We Are Not Alone, rock_631.jpeg,  https://i.scdn.co/image/b0275b06f85e3e3717ef7ed6a8211168c0045ba1 
Breaking Benjamin,  We Are Not Alone, rock_632.jpeg,  https://i.scdn.co/image/59b8f6adc6540c4f8a671af003cde2c20506b223 
Breaking Benjamin,  We Are Not Alone (Clean Version), rock_633.jpeg,  https://i.scdn.co/image/19508d9905973a7da0181f2d0273b2a3b3be5a17 
Breaking Benjamin,  We Are Not Alone (Edited Version), rock_634.jpeg,  https://i.scdn.co/image/4227be33a3d69048701628dadb45bd08df15c163 
Breaking Benjamin,  We Are Not Alone (Edited Version), rock_635.jpeg,  https://i.scdn.co/image/e80ccde8404069fefcd17974879adb62f8f0e42f 
Breaking Benjamin,  Saturate, rock_636.jpeg,  https://i.scdn.co/image/d98cc29c0e67a9a72de0541aee7c49d5506f7faf 
Breaking Benjamin,  Saturate, rock_637.jpeg,  https://i.scdn.co/image/8161963653a26cd7e25f7b7e5b724d4893dcd86a 
3 Doors Down,  Us And The Night, rock_638.jpeg,  https://i.scdn.co/image/44d0e946fdd970f5ecde8c2ea29fc5902f1e39d9 
3 Doors Down,  Us And The Night, rock_639.jpeg,  https://i.scdn.co/image/a2e8bb7985a00ea896f8d027d733afdfd3b42761 
3 Doors Down,  The Greatest Hits, rock_640.jpeg,  https://i.scdn.co/image/87de456a057c78790931d121b630aa92364da51c 
3 Doors Down,  The Greatest Hits, rock_641.jpeg,  https://i.scdn.co/image/6aee161c099bc4531420655ee0e353d0c56db7ff 
3 Doors Down,  The Greatest Hits, rock_642.jpeg,  https://i.scdn.co/image/87de456a057c78790931d121b630aa92364da51c 
3 Doors Down,  Time Of My Life (Deluxe Version), rock_643.jpeg,  https://i.scdn.co/image/8fee9181586b808e7362d2a9c65501deecc7eede 
3 Doors Down,  Time Of My Life, rock_644.jpeg,  https://i.scdn.co/image/bf42af0e68d990178ffbdca15ac3c9ff1dc54a9d 
3 Doors Down,  Seventeen Days, rock_645.jpeg,  https://i.scdn.co/image/8e459cde47453e49d3f2dd9362517cdeb5408713 
3 Doors Down,  Seventeen Days (International Version), rock_646.jpeg,  https://i.scdn.co/image/09dac363e0f62db79aec2b4710b46b2ac60e43d9 
3 Doors Down,  Seventeen Days, rock_647.jpeg,  https://i.scdn.co/image/9191b7e47ac3cb302e31973f70b15a2783b09a4a 
3 Doors Down,  Seventeen Days (UK Version), rock_648.jpeg,  https://i.scdn.co/image/09dac363e0f62db79aec2b4710b46b2ac60e43d9 
3 Doors Down,  Away From The Sun, rock_649.jpeg,  https://i.scdn.co/image/1c09b3f029fe28b9c9f67b18473db70f71ecf858 
3 Doors Down,  Away From The Sun, rock_650.jpeg,  https://i.scdn.co/image/dab8ec55dbbb0c3323394426f6e59c22603f784e 
3 Doors Down,  Away From The Sun (UK edition with 2 bonus tracks), rock_651.jpeg,  https://i.scdn.co/image/dab8ec55dbbb0c3323394426f6e59c22603f784e 
3 Doors Down,  The Better Life, rock_652.jpeg,  https://i.scdn.co/image/a72c4d23ba9039fe5be628f336e25eb565321174 
3 Doors Down,  The Better Life, rock_653.jpeg,  https://i.scdn.co/image/bb3c060a58d446efb2edccb31c3a03f05002e5a1 
Audioslave,  Revelations, rock_654.jpeg,  https://i.scdn.co/image/709b4d9163f432823ee9c8afe7e8795d9e08b4f5 
Audioslave,  Revelations, rock_655.jpeg,  https://i.scdn.co/image/d01ed08ffd0593821634c55dce6b1ab57bec2788 
Audioslave,  Revelations, rock_656.jpeg,  https://i.scdn.co/image/709b4d9163f432823ee9c8afe7e8795d9e08b4f5 
Audioslave,  Out Of Exile (UK Only Version), rock_657.jpeg,  https://i.scdn.co/image/69e66d1dec4a6f987d7a462adb3b65009d3d796d 
Audioslave,  Out of Exile, rock_658.jpeg,  https://i.scdn.co/image/c0502e2fc11b45ebcb7ca68a43cf5ed62092fb93 
Audioslave,  Out of Exile, rock_659.jpeg,  https://i.scdn.co/image/2135233efc1cd17247432dc7da4fba8d72844a7e 
Audioslave,  Audioslave, rock_660.jpeg,  https://i.scdn.co/image/fcb9d0a1fa6e5687f0236e99cc7ef270fd227080 
Audioslave,  Audioslave, rock_661.jpeg,  https://i.scdn.co/image/c8363cbdb1b5a11ce19d0d6bab36819101983fcb 
Audioslave,  Audioslave, rock_662.jpeg,  https://i.scdn.co/image/d0cd8c42f2816b208641d030f809d155a7484756 
Trapt,  DNA, rock_663.jpeg,  https://i.scdn.co/image/6d5c0758f42ccb87a7458fe51077595671536d5c 
Trapt,  The Acoustic Collection, rock_664.jpeg,  https://i.scdn.co/image/46daeca874010cc468ffffbcbe626aa3d19b9e76 
Trapt,  Reborn, rock_665.jpeg,  https://i.scdn.co/image/c0ff70198e85dd7995ebf3e19cd13ab30ef7e76f 
Trapt,  Reborn (Deluxe Edition), rock_666.jpeg,  https://i.scdn.co/image/f792c187cfde2d42d5c56d270862951294f585f8 
Trapt,  Headstrong, rock_667.jpeg,  https://i.scdn.co/image/ef483771769a5e53c795d5d153a97e96e710d01c 
Trapt,  No Apologies, rock_668.jpeg,  https://i.scdn.co/image/350b0cad0a20a0e0ce94b0cd58d36c951b02470b 
Trapt,  No Apologies, rock_669.jpeg,  https://i.scdn.co/image/a10120e69f129791e154b4ea176fe7dc381f47c1 
Trapt,  Only Through the Pain, rock_670.jpeg,  https://i.scdn.co/image/17d417d80bf618ba275d8a9aec4732cb0209c464 
Trapt,  Snapshot: Trapt, rock_671.jpeg,  https://i.scdn.co/image/5b08d86486f514c7ad6a734c406fc52fd04335c1 
Trapt,  Live, rock_672.jpeg,  https://i.scdn.co/image/3c73b5dae72c427494e98291af0b871d2a725115 
Trapt,  Someone In Control, rock_673.jpeg,  https://i.scdn.co/image/7c056c2fdc0104ee6598110a7d7255e9aeb40219 
Trapt,  Trapt (PA Version), rock_674.jpeg,  https://i.scdn.co/image/6103ffe2f88473ad1e2689218ba3330c9ecfad21 
