Pearl Jam,  No Code, rock_646.jpeg,  https://i.scdn.co/image/21c1def8608845536129720866d14294e19b4d87 
Pearl Jam,  Spin The Black Circle Live In Seattle '95, rock_647.jpeg,  https://i.scdn.co/image/a61e331a87f008cb2720d753aa3c14f700e68a6e 
Pearl Jam,  Vitalogy, rock_648.jpeg,  https://i.scdn.co/image/e398cd73e2c4de189d712adcd14f4f454f89f9d7 
Pearl Jam,  Vs., rock_649.jpeg,  https://i.scdn.co/image/36218136f9e645d979ee3a1a5b3abb6c386571b6 
Pearl Jam,  Ten Redux, rock_650.jpeg,  https://i.scdn.co/image/3276265827c8190a7569227bdd7029e357cab0c2 
Pearl Jam,  Ten, rock_651.jpeg,  https://i.scdn.co/image/425e1fef6d70a48a103dfd168a556b7f72f72865 
Rage Against The Machine,  Renegades, rock_652.jpeg,  https://i.scdn.co/image/3c9c017c3df6735e2f76b2e7dd6c6e7c709a179f 
Rage Against The Machine,  Live at the Grand Olympic Auditorium, rock_653.jpeg,  https://i.scdn.co/image/4840f4993cf0cfc15b4c3134420c35258e4a7fef 
Rage Against The Machine,  The Battle Of Los Angeles, rock_654.jpeg,  https://i.scdn.co/image/d36b38316f7c9f8c6e3b66305811fe5ae1517b1a 
Rage Against The Machine,  Evil Empire, rock_655.jpeg,  https://i.scdn.co/image/d78afcdcd80e39d229bf3360b86111dd9b8c441c 
Rage Against The Machine,  Irvine Meadows (17 June '95) [Remastered] [Live], rock_656.jpeg,  https://i.scdn.co/image/35a375d546fa085f94f0f3a3e20bc960c6acee98 
Rage Against The Machine,  Rage Against The Machine, rock_657.jpeg,  https://i.scdn.co/image/5f60f693d1eab3e00166ade80b32dc1143347e2c 
Rage Against The Machine,  Rage Against The Machine - XX (20th Anniversary Special Edition), rock_658.jpeg,  https://i.scdn.co/image/85236cc12312fac9405206c25bd38479e63a04d6 
Rise Against,  Wolves, rock_659.jpeg,  https://i.scdn.co/image/185de62775573a18d5f3767f90291cd572a24f66 
Rise Against,  Wolves, rock_660.jpeg,  https://i.scdn.co/image/60008e46598d78631331045938dc156676b0d50b 
Rise Against,  Wolves, rock_661.jpeg,  https://i.scdn.co/image/185de62775573a18d5f3767f90291cd572a24f66 
Rise Against,  The Black Market, rock_662.jpeg,  https://i.scdn.co/image/6c2b0d963024997558a81994c3efe03e1e27db5d 
Rise Against,  The Black Market, rock_663.jpeg,  https://i.scdn.co/image/6c2b0d963024997558a81994c3efe03e1e27db5d 
Rise Against,  The Black Market, rock_664.jpeg,  https://i.scdn.co/image/3fea18f13d34a1572f0dac18cb7e4f4cab027aa0 
Rise Against,  Rpm10, rock_665.jpeg,  https://i.scdn.co/image/1a79de6d30efa7760ca934cce185c2c5867ce03e 
Rise Against,  Rpm10, rock_666.jpeg,  https://i.scdn.co/image/8d8be811845e906b0fd31e97fdb765cdd2405ad7 
Rise Against,  Long Forgotten Songs: B-Sides & Covers 2000-2013, rock_667.jpeg,  https://i.scdn.co/image/19e23bfd694d17de6aa7c7518236fcf9a4ed1f92 
Rise Against,  Long Forgotten Songs: B-Sides & Covers 2000-2013, rock_668.jpeg,  https://i.scdn.co/image/ce62ab9756755b9e766540df612b9b9a5f542da9 
Rise Against,  Endgame / Appeal To Reason / Siren Song Of The Counter Culture / The Sufferer & The Witness, rock_669.jpeg,  https://i.scdn.co/image/d04a3b3aa700cd6712d66cf9ba9339e5cd71b8ef 
Rise Against,  Endgame / Appeal To Reason / Siren Song Of The Counter Culture / The Sufferer & The Witness, rock_670.jpeg,  https://i.scdn.co/image/77dcb50115820514b198cd2eec8ea2b92277b525 
Rise Against,  Endgame, rock_671.jpeg,  https://i.scdn.co/image/b506968a958ad390518c3d9e4f45e79cf3b64be1 
Rise Against,  Endgame, rock_672.jpeg,  https://i.scdn.co/image/db417fb79878f4b62bf0bbee58d7409eb7b58d81 
Rise Against,  Appeal To Reason, rock_673.jpeg,  https://i.scdn.co/image/1e20b659e0ad162ef57b7a9eb3461556ba47fab8 
Rise Against,  Appeal To Reason, rock_674.jpeg,  https://i.scdn.co/image/9821a760f8bc0dc59f186ee184c624e5fe51abb2 
Rise Against,  Appeal To Reason (International Version), rock_675.jpeg,  https://i.scdn.co/image/0cce32ecc97b1bc19d454f5575c46e08303bc9de 
Rise Against,  The Sufferer & The Witness, rock_676.jpeg,  https://i.scdn.co/image/cd709f1586aa9f00d283874f35710eb8a1007646 
Rise Against,  The Sufferer & The Witness, rock_677.jpeg,  https://i.scdn.co/image/8d137e62ecdbe4e76b04f1b73bc882e1bcf71e5f 
Rise Against,  The Sufferer & The Witness, rock_678.jpeg,  https://i.scdn.co/image/deb0845eb2913bc4a10cd1ce7fe0ded2974600c4 
Rise Against,  The Sufferer & The Witness, rock_679.jpeg,  https://i.scdn.co/image/f5ac1ade923d3da5990e2c9c193ba62977b6fb92 
Rise Against,  The Sufferer & The Witness, rock_680.jpeg,  https://i.scdn.co/image/97b1b3da33cd4e0cd63932e79a6b1b2f32bfee33 
Rise Against,  The Sufferer & The Witness, rock_681.jpeg,  https://i.scdn.co/image/ec14df19b819adb23a149612234e182cd78df25a 
Rise Against,  Siren Song Of The Counter-Culture, rock_682.jpeg,  https://i.scdn.co/image/8bd92d3256a5f5ce9dd793684452c1121368b91e 
Rise Against,  Siren Song Of The Counter-Culture (Japan Version / International Version), rock_683.jpeg,  https://i.scdn.co/image/021f9e330f30ccd802f23b05bf7c87ad8b2389db 
Rise Against,  Siren Song Of The Counter-Culture (Japan Version / International Version), rock_684.jpeg,  https://i.scdn.co/image/3d0e67e3458c4d0bc851670db9a244361abee147 
Rise Against,  Revolutions Per Minute, rock_685.jpeg,  https://i.scdn.co/image/764d8f9ab43779c4a349ba3d741ead0bc252d9a7 
Rise Against,  The Unraveling, rock_686.jpeg,  https://i.scdn.co/image/a14ffcde2fe4d59e3458b500aa30b885c59f4c79 
Rise Against,  The Unraveling (Re-Issue), rock_687.jpeg,  https://i.scdn.co/image/a01732f995030b262bccb7709b3708d7b126c89c 
The Smashing Pumpkins,  Monuments To An Elegy, rock_688.jpeg,  https://i.scdn.co/image/9bff78d4d1d2455c98ce1eaaee3acd92763d67ff 
The Smashing Pumpkins,  Monuments To An Elegy, rock_689.jpeg,  https://i.scdn.co/image/3981d8ac7ed877bcee098f44412dd0d928bbaa22 
The Smashing Pumpkins,  Monuments to an Elegy, rock_690.jpeg,  https://i.scdn.co/image/16e83c73a0d0bf6dfad83347b2a2bb1e619c0f0c 
The Smashing Pumpkins,  Monuments to an Elegy, rock_691.jpeg,  https://i.scdn.co/image/fc1daaed78b202f65573cac41be449edf444da2f 
The Smashing Pumpkins,  Monuments to an Elegy, rock_692.jpeg,  https://i.scdn.co/image/fc1daaed78b202f65573cac41be449edf444da2f 
The Smashing Pumpkins,  Monuments To An Elegy, rock_693.jpeg,  https://i.scdn.co/image/4196a6c2642deb647aed33338d5a603918d20588 
The Smashing Pumpkins,  MONUMENTS TO AN ELEGY, rock_694.jpeg,  https://i.scdn.co/image/220250c9f45e0b0810617f5aea2c72c651d535a7 
The Smashing Pumpkins,  Monuments to an Elegy, rock_695.jpeg,  https://i.scdn.co/image/c4b918fc4b75bf43225aeb68dc20fa110f8703b4 
The Smashing Pumpkins,  Monuments to an Elegy, rock_696.jpeg,  https://i.scdn.co/image/fc1daaed78b202f65573cac41be449edf444da2f 
The Smashing Pumpkins,  Monuments to an Elegy, rock_697.jpeg,  https://i.scdn.co/image/f60306a56b9a32759dd551385712f6ca210dda41 
The Smashing Pumpkins,  Oceania, rock_698.jpeg,  https://i.scdn.co/image/d875b090a644baf5bc1cd0ebb033a65f950a7655 
The Smashing Pumpkins,  Oceania, rock_699.jpeg,  https://i.scdn.co/image/ff407ded33d35336983eb9732c57fe4fd6e0ecb9 
The Smashing Pumpkins,  Oceania, rock_700.jpeg,  https://i.scdn.co/image/62da80ca83f9f419767d1feb49da35b839747b7d 
The Smashing Pumpkins,  Oceania, rock_701.jpeg,  https://i.scdn.co/image/62da80ca83f9f419767d1feb49da35b839747b7d 
The Smashing Pumpkins,  Oceania, rock_702.jpeg,  https://i.scdn.co/image/ff407ded33d35336983eb9732c57fe4fd6e0ecb9 
The Smashing Pumpkins,  Oceania, rock_703.jpeg,  https://i.scdn.co/image/2501304d47b7e6e8a17e74094b97b60fcd329679 
The Smashing Pumpkins,  Oceania, rock_704.jpeg,  https://i.scdn.co/image/5b3a90dc919c87abd58b1d63944431a169165b1c 
The Smashing Pumpkins,  Machina / The Machines Of God, rock_705.jpeg,  https://i.scdn.co/image/d77470ce39ca532aa6e63abb955193a47758b985 
The Smashing Pumpkins,  Adore (2014 Remaster), rock_706.jpeg,  https://i.scdn.co/image/dc7b67318832d638f27f826f42e0b48dca85eb5a 
The Smashing Pumpkins,  Adore (2014 Remaster), rock_707.jpeg,  https://i.scdn.co/image/8f18915c1ff113bac89d67f2fa4f412d7fbecc5a 
The Smashing Pumpkins,  Mellon Collie and the Infinite Sadness (2012 - Remaster), rock_708.jpeg,  https://i.scdn.co/image/5281fb40593e18fcacb40daac1d455dc1777e072 
The Smashing Pumpkins,  Pisces Iscariot (2012 - Remaster), rock_709.jpeg,  https://i.scdn.co/image/5af2c262e227db33308fb3bb59259d5a69e5c7a8 
The Smashing Pumpkins,  Siamese Dream (2011 - Remaster), rock_710.jpeg,  https://i.scdn.co/image/0139b7d3d070df2f78f6ff5fbd92e5a1e20b127c 
The Smashing Pumpkins,  Siamese Dream (2011 - Remaster), rock_711.jpeg,  https://i.scdn.co/image/ce86657031d042f221b0ab7e4c09ff0655cf8f59 
The Smashing Pumpkins,  Gish (2011 - Remaster), rock_712.jpeg,  https://i.scdn.co/image/b16109cfee4239ef5e68e9a36c3d7e1b8805852e 
The Smashing Pumpkins,  Gish, rock_713.jpeg,  https://i.scdn.co/image/c7cae12c9f40c822f0f2ce3a3bfa9cd45dc9481a 
Three Days Grace,  Human, rock_714.jpeg,  https://i.scdn.co/image/3a5c755f77be1fa8c3569a731da7ad77cb5ab6dd 
Three Days Grace,  Human, rock_715.jpeg,  https://i.scdn.co/image/e6406c1031d1869d551680e5a47ab4af29f7f07c 
Three Days Grace,  Transit Of Venus, rock_716.jpeg,  https://i.scdn.co/image/304346fdd3ba2ac08a60ff5d0bef757ad3fd9280 
Three Days Grace,  Life Starts Now, rock_717.jpeg,  https://i.scdn.co/image/aef7b737c64d94f7d35ba221b76682c78f02172f 
Three Days Grace,  Life Starts Now, rock_718.jpeg,  https://i.scdn.co/image/f893f9439b098a93e28e5dda004bb0dd7b063170 
Three Days Grace,  Life Starts Now, rock_719.jpeg,  https://i.scdn.co/image/0c1b65e11f846eece7f25442df9b104ff2dd8221 
Three Days Grace,  Three Days Grace (Deluxe Version), rock_720.jpeg,  https://i.scdn.co/image/3e8d606984416611844a7c95cfcc78d1a51ea4cc 
Three Days Grace,  One-X, rock_721.jpeg,  https://i.scdn.co/image/05c2e50a55edbf11d1e760f3d36d6aee1f471c35 
Three Days Grace,  One-X, rock_722.jpeg,  https://i.scdn.co/image/fdbdf54c69e505c617b128d19e670d753573add6 
Three Days Grace,  Three Days Grace, rock_723.jpeg,  https://i.scdn.co/image/3e8d606984416611844a7c95cfcc78d1a51ea4cc 
Three Days Grace,  Three Days Grace, rock_724.jpeg,  https://i.scdn.co/image/3e8d606984416611844a7c95cfcc78d1a51ea4cc 
Stone Temple Pilots,  Core (Super Deluxe Edition), rock_725.jpeg,  https://i.scdn.co/image/3f3d3acdc4290356a2d7a35dd88de23e4cd03303 
Stone Temple Pilots,  Stone Temple Pilots, rock_726.jpeg,  https://i.scdn.co/image/f1d298a03e0cfa7ee81a7e0076f04e436ff0974b 
Stone Temple Pilots,  Stone Temple Pilots, rock_727.jpeg,  https://i.scdn.co/image/f1d298a03e0cfa7ee81a7e0076f04e436ff0974b 
Stone Temple Pilots,  Stone Temple Pilots (Deluxe), rock_728.jpeg,  https://i.scdn.co/image/8f80e51fc58f845e51cb0a6f358608b18cf64d23 
Stone Temple Pilots,  Shangri-LA DEE DA, rock_729.jpeg,  https://i.scdn.co/image/d256d80bed280a075f72325e01c3f94c7eafd230 
Stone Temple Pilots,  No. 4, rock_730.jpeg,  https://i.scdn.co/image/5143e9fd07529b6dc4165d35f261fc1a12bd3736 
Stone Temple Pilots,  Tiny Music...Songs From The Vatican Gift Shop, rock_731.jpeg,  https://i.scdn.co/image/92fd4336229c7366ffad21af0185ddb58f7ce3b6 
Stone Temple Pilots,  Purple, rock_732.jpeg,  https://i.scdn.co/image/9544e5967a8c1bf456193523daf0d080155b95e4 
Stone Temple Pilots,  Core, rock_733.jpeg,  https://i.scdn.co/image/ff71d87f1851d43bac44a37da93bcb2a21a7c103 
Stone Temple Pilots,  Core (Remastered), rock_734.jpeg,  https://i.scdn.co/image/3f3d3acdc4290356a2d7a35dd88de23e4cd03303 
The White Stripes,  Under Great White Northern Lights, rock_735.jpeg,  https://i.scdn.co/image/f798e7e0a44c5435a0a9d1498fb0c189e8bd9999 
The White Stripes,  Under Great White Northern Lights, rock_736.jpeg,  https://i.scdn.co/image/702c45740debbf4be1949de64279406c147e3142 
The White Stripes,  Icky Thump, rock_737.jpeg,  https://i.scdn.co/image/b2cf57e292961ac1c5beaf369786abc0322d898d 
The White Stripes,  Icky Thump, rock_738.jpeg,  https://i.scdn.co/image/e5cf9a7071c5132e6f150f21520851857af0222c 
The White Stripes,  Get Behind Me Satan, rock_739.jpeg,  https://i.scdn.co/image/97130661ec51fa8a325678044deacb1529c2915f 
The White Stripes,  Get Behind Me Satan, rock_740.jpeg,  https://i.scdn.co/image/d1f56ac0d045ca980d28cc4cc926fbb353cffaa0 
The White Stripes,  Get Behind Me Satan, rock_741.jpeg,  https://i.scdn.co/image/ac718619172b6b864a19a909f05b9c4f94c455d6 
The White Stripes,  Get Behind Me Satan, rock_742.jpeg,  https://i.scdn.co/image/ac718619172b6b864a19a909f05b9c4f94c455d6 
The White Stripes,  Elephant, rock_743.jpeg,  https://i.scdn.co/image/5eb63fa378e1221f2d7083fe149b8a067d3737ab 
The White Stripes,  Elephant, rock_744.jpeg,  https://i.scdn.co/image/87d0205a5fff8d8e128d55d02b7e2788231d6095 
The White Stripes,  Elephant, rock_745.jpeg,  https://i.scdn.co/image/b9ff83c29bd0a00b8e179183615e1588500fcb92 
The White Stripes,  White Blood Cells, rock_746.jpeg,  https://i.scdn.co/image/5a136dec5ceb728f84580622abe769421b75c465 
The White Stripes,  White Blood Cells, rock_747.jpeg,  https://i.scdn.co/image/b8e373d85224dedbccd36fd124d25bc7174c85f5 
The White Stripes,  White Blood Cells, rock_748.jpeg,  https://i.scdn.co/image/b599e1b25d4bccb81b88cc1cb21770b59f027884 
The White Stripes,  De Stijl, rock_749.jpeg,  https://i.scdn.co/image/cc77ae9aded4029862ec3b91cd71a145bf1ebd0f 
The White Stripes,  De Stijl, rock_750.jpeg,  https://i.scdn.co/image/f5565d636783afaf4981efa4e9b1bf19e3c98175 
The White Stripes,  De Stijl, rock_751.jpeg,  https://i.scdn.co/image/533889fc097dc41af1237680a76d0e65fe319b8a 
The White Stripes,  The White Stripes, rock_752.jpeg,  https://i.scdn.co/image/15ab3673f5491ba8b858e042d342186816e67fc0 
The White Stripes,  The White Stripes, rock_753.jpeg,  https://i.scdn.co/image/ba42886df7c3e953a050d847f4228d87b74fc200 
The White Stripes,  The White Stripes, rock_754.jpeg,  https://i.scdn.co/image/ce30e7f86f097729dc08c446b2da0a95fbd3850d 
Breaking Benjamin,  Dark Before Dawn, rock_755.jpeg,  https://i.scdn.co/image/2886e34fd3ceaf11c6f5873809f5869d72706947 
Breaking Benjamin,  Dark Before Dawn, rock_756.jpeg,  https://i.scdn.co/image/25a2f074fa2d1f983e23dba8fd9c6c0bf0f42193 
Breaking Benjamin,  Shallow Bay: The Best Of Breaking Benjamin (Explicit), rock_757.jpeg,  https://i.scdn.co/image/8328345a83c7e13709cf904a8053c888323907cd 
Breaking Benjamin,  Shallow Bay: The Best Of Breaking Benjamin (Explicit), rock_758.jpeg,  https://i.scdn.co/image/d5594899a9ed44378042cf33d5a8c79e342cc57e 
Breaking Benjamin,  Shallow Bay: The Best Of Breaking Benjamin (Clean), rock_759.jpeg,  https://i.scdn.co/image/4de608b696e8094db647c8165279144ca6274ad9 
Breaking Benjamin,  Shallow Bay: The Best Of Breaking Benjamin Deluxe Edition (Explicit), rock_760.jpeg,  https://i.scdn.co/image/8b092fd96684275e3791cbdd4ff7bc30f255a63c 
Breaking Benjamin,  Shallow Bay: The Best Of Breaking Benjamin Deluxe Edition (Explicit), rock_761.jpeg,  https://i.scdn.co/image/96a4b2c7b785b82fc251ffb621e4184b27b5286c 
Breaking Benjamin,  Shallow Bay: The Best Of Breaking Benjamin Deluxe Edition (Clean), rock_762.jpeg,  https://i.scdn.co/image/80c13adcbf0213f9d4ffe3c52d316ca5d2c63d3e 
Breaking Benjamin,  Breaking Benjamin: Digital Box Set, rock_763.jpeg,  https://i.scdn.co/image/ef4ee510ac7bfedc1ed54c924dc2c51fb17ffe6b 
Breaking Benjamin,  Dear Agony, rock_764.jpeg,  https://i.scdn.co/image/ad4b7a621db877f249bf1f24dc19cb00d9147b5c 
Breaking Benjamin,  Dear Agony, rock_765.jpeg,  https://i.scdn.co/image/62503337bce943a7264d8c2d9dd7ff1570e4aa4b 
Breaking Benjamin,  Phobia, rock_766.jpeg,  https://i.scdn.co/image/b0fa9fc6434ddfa8c2855cc372f7c8f1dc9c5aa6 
Breaking Benjamin,  Phobia, rock_767.jpeg,  https://i.scdn.co/image/ff9f677b4f3fba51d1a2e507acc2174e0fa814d2 
Breaking Benjamin,  Phobia, rock_768.jpeg,  https://i.scdn.co/image/f5833bfb97bd059b2377e2072e231a4f7870f281 
Breaking Benjamin,  Phobia (Clean Version), rock_769.jpeg,  https://i.scdn.co/image/60f9b69aa68780b33f9a6f873e628da0e05b735b 
Breaking Benjamin,  We Are Not Alone, rock_770.jpeg,  https://i.scdn.co/image/b0275b06f85e3e3717ef7ed6a8211168c0045ba1 
Breaking Benjamin,  We Are Not Alone, rock_771.jpeg,  https://i.scdn.co/image/59b8f6adc6540c4f8a671af003cde2c20506b223 
Breaking Benjamin,  We Are Not Alone (Clean Version), rock_772.jpeg,  https://i.scdn.co/image/19508d9905973a7da0181f2d0273b2a3b3be5a17 
Breaking Benjamin,  We Are Not Alone (Edited Version), rock_773.jpeg,  https://i.scdn.co/image/4227be33a3d69048701628dadb45bd08df15c163 
Breaking Benjamin,  We Are Not Alone (Edited Version), rock_774.jpeg,  https://i.scdn.co/image/e80ccde8404069fefcd17974879adb62f8f0e42f 
Breaking Benjamin,  Saturate, rock_775.jpeg,  https://i.scdn.co/image/d98cc29c0e67a9a72de0541aee7c49d5506f7faf 
Breaking Benjamin,  Saturate, rock_776.jpeg,  https://i.scdn.co/image/8161963653a26cd7e25f7b7e5b724d4893dcd86a 
3 Doors Down,  Us And The Night, rock_777.jpeg,  https://i.scdn.co/image/44d0e946fdd970f5ecde8c2ea29fc5902f1e39d9 
3 Doors Down,  Us And The Night, rock_778.jpeg,  https://i.scdn.co/image/a2e8bb7985a00ea896f8d027d733afdfd3b42761 
3 Doors Down,  The Greatest Hits, rock_779.jpeg,  https://i.scdn.co/image/87de456a057c78790931d121b630aa92364da51c 
3 Doors Down,  The Greatest Hits, rock_780.jpeg,  https://i.scdn.co/image/6aee161c099bc4531420655ee0e353d0c56db7ff 
3 Doors Down,  The Greatest Hits, rock_781.jpeg,  https://i.scdn.co/image/87de456a057c78790931d121b630aa92364da51c 
3 Doors Down,  Time Of My Life (Deluxe Version), rock_782.jpeg,  https://i.scdn.co/image/8fee9181586b808e7362d2a9c65501deecc7eede 
3 Doors Down,  Time Of My Life, rock_783.jpeg,  https://i.scdn.co/image/bf42af0e68d990178ffbdca15ac3c9ff1dc54a9d 
3 Doors Down,  Time Of My Life (Deluxe Version), rock_784.jpeg,  https://i.scdn.co/image/c85254bba86a8df3e56aeb7bc85b65d38dfa47f6 
3 Doors Down,  Time Of My Life, rock_785.jpeg,  https://i.scdn.co/image/65e8970631b52e947de39c887856f0f092009170 
3 Doors Down,  The Better Life (Rarities Edition), rock_786.jpeg,  https://i.scdn.co/image/5584464a46bd3046a23654dcbb3de4adeec54149 
3 Doors Down,  The Better Life (Rarities Edition), rock_787.jpeg,  https://i.scdn.co/image/d6a39b425040cdf2822bf52a873b75a1be114278 
3 Doors Down,  Where My Christmas Lives, rock_788.jpeg,  https://i.scdn.co/image/881d578b9f8369baab7d48d8df1206321afbdd43 
3 Doors Down,  Where My Christmas Lives, rock_789.jpeg,  https://i.scdn.co/image/4bb5ab4d28efa19dc72e8dfd51e6cbfd79c95362 
3 Doors Down,  3 Doors Down, rock_790.jpeg,  https://i.scdn.co/image/57cd0756157de17745b4155a18c78beb992e046d 
3 Doors Down,  3 Doors Down, rock_791.jpeg,  https://i.scdn.co/image/9424f7ef0974b2f0085e3e5f8cf55a410d38717a 
3 Doors Down,  3 Doors Down, rock_792.jpeg,  https://i.scdn.co/image/9332148bbf842b28f8ff0c11d6efd73ec2c11cfc 
3 Doors Down,  3 Doors Down (UK Version), rock_793.jpeg,  https://i.scdn.co/image/20af01a88dc0001e004712e2b9386f9443781988 
3 Doors Down,  The Better Life - Deluxe Edition, rock_794.jpeg,  https://i.scdn.co/image/d583f1543f6a9fd58e5f79bc3a5358d943258096 
3 Doors Down,  The Better Life - Deluxe Edition, rock_795.jpeg,  https://i.scdn.co/image/47988b1a50f6aa7d5d3622930f7d341373da468f 
3 Doors Down,  Seventeen Days, rock_796.jpeg,  https://i.scdn.co/image/8e459cde47453e49d3f2dd9362517cdeb5408713 
3 Doors Down,  Seventeen Days (International Version), rock_797.jpeg,  https://i.scdn.co/image/09dac363e0f62db79aec2b4710b46b2ac60e43d9 
3 Doors Down,  Seventeen Days, rock_798.jpeg,  https://i.scdn.co/image/9191b7e47ac3cb302e31973f70b15a2783b09a4a 
3 Doors Down,  Seventeen Days (UK Version), rock_799.jpeg,  https://i.scdn.co/image/09dac363e0f62db79aec2b4710b46b2ac60e43d9 
3 Doors Down,  Away From The Sun, rock_800.jpeg,  https://i.scdn.co/image/1c09b3f029fe28b9c9f67b18473db70f71ecf858 
3 Doors Down,  Away From The Sun, rock_801.jpeg,  https://i.scdn.co/image/dab8ec55dbbb0c3323394426f6e59c22603f784e 
3 Doors Down,  Away From The Sun (UK edition with 2 bonus tracks), rock_802.jpeg,  https://i.scdn.co/image/dab8ec55dbbb0c3323394426f6e59c22603f784e 
3 Doors Down,  The Better Life, rock_803.jpeg,  https://i.scdn.co/image/a72c4d23ba9039fe5be628f336e25eb565321174 
3 Doors Down,  The Better Life, rock_804.jpeg,  https://i.scdn.co/image/bb3c060a58d446efb2edccb31c3a03f05002e5a1 
Audioslave,  Revelations, rock_805.jpeg,  https://i.scdn.co/image/709b4d9163f432823ee9c8afe7e8795d9e08b4f5 
Audioslave,  Revelations, rock_806.jpeg,  https://i.scdn.co/image/d01ed08ffd0593821634c55dce6b1ab57bec2788 
Audioslave,  Revelations, rock_807.jpeg,  https://i.scdn.co/image/709b4d9163f432823ee9c8afe7e8795d9e08b4f5 
Audioslave,  Out Of Exile (UK Only Version), rock_808.jpeg,  https://i.scdn.co/image/69e66d1dec4a6f987d7a462adb3b65009d3d796d 
Audioslave,  Out of Exile, rock_809.jpeg,  https://i.scdn.co/image/c0502e2fc11b45ebcb7ca68a43cf5ed62092fb93 
Audioslave,  Out of Exile, rock_810.jpeg,  https://i.scdn.co/image/2135233efc1cd17247432dc7da4fba8d72844a7e 
Audioslave,  Audioslave, rock_811.jpeg,  https://i.scdn.co/image/fcb9d0a1fa6e5687f0236e99cc7ef270fd227080 
Audioslave,  Audioslave, rock_812.jpeg,  https://i.scdn.co/image/c8363cbdb1b5a11ce19d0d6bab36819101983fcb 
Audioslave,  Audioslave, rock_813.jpeg,  https://i.scdn.co/image/d0cd8c42f2816b208641d030f809d155a7484756 
Trapt,  DNA, rock_814.jpeg,  https://i.scdn.co/image/6d5c0758f42ccb87a7458fe51077595671536d5c 
Trapt,  The Acoustic Collection, rock_815.jpeg,  https://i.scdn.co/image/46daeca874010cc468ffffbcbe626aa3d19b9e76 
Trapt,  Reborn, rock_816.jpeg,  https://i.scdn.co/image/c0ff70198e85dd7995ebf3e19cd13ab30ef7e76f 
Trapt,  Reborn (Deluxe Edition), rock_817.jpeg,  https://i.scdn.co/image/f792c187cfde2d42d5c56d270862951294f585f8 
Trapt,  Headstrong, rock_818.jpeg,  https://i.scdn.co/image/ef483771769a5e53c795d5d153a97e96e710d01c 
Trapt,  No Apologies, rock_819.jpeg,  https://i.scdn.co/image/350b0cad0a20a0e0ce94b0cd58d36c951b02470b 
Trapt,  No Apologies, rock_820.jpeg,  https://i.scdn.co/image/a10120e69f129791e154b4ea176fe7dc381f47c1 
Trapt,  Only Through the Pain, rock_821.jpeg,  https://i.scdn.co/image/17d417d80bf618ba275d8a9aec4732cb0209c464 
Trapt,  Snapshot: Trapt, rock_822.jpeg,  https://i.scdn.co/image/5b08d86486f514c7ad6a734c406fc52fd04335c1 
Trapt,  Live, rock_823.jpeg,  https://i.scdn.co/image/3c73b5dae72c427494e98291af0b871d2a725115 
Trapt,  Someone In Control, rock_824.jpeg,  https://i.scdn.co/image/7c056c2fdc0104ee6598110a7d7255e9aeb40219 
Trapt,  Trapt (PA Version), rock_825.jpeg,  https://i.scdn.co/image/6103ffe2f88473ad1e2689218ba3330c9ecfad21 
Trapt,  Trapt, rock_826.jpeg,  https://i.scdn.co/image/9f33f5cf499abd8862dcd6a3955504d1cea0a625 
Seether,  Poison The Parish, rock_827.jpeg,  https://i.scdn.co/image/a0a15309695a292701c9afb5ed7a6e0742563530 
Seether,  Poison The Parish, rock_828.jpeg,  https://i.scdn.co/image/b6184ef483e11b1d7892ad6e962c3d01340ab1f5 
Seether,  Poison The Parish (Deluxe Edition), rock_829.jpeg,  https://i.scdn.co/image/a0a15309695a292701c9afb5ed7a6e0742563530 
Seether,  Poison The Parish (Deluxe Edition), rock_830.jpeg,  https://i.scdn.co/image/b6184ef483e11b1d7892ad6e962c3d01340ab1f5 
Seether,  Isolate And Medicate, rock_831.jpeg,  https://i.scdn.co/image/e09f0c22535a225d6d35e15041d862d25dcd2920 
Seether,  Isolate And Medicate, rock_832.jpeg,  https://i.scdn.co/image/28073730bdc7e49141953ce7c63b8a6fef0970fe 
Seether,  Isolate And Medicate (Deluxe Edition), rock_833.jpeg,  https://i.scdn.co/image/28073730bdc7e49141953ce7c63b8a6fef0970fe 
Seether,  Isolate And Medicate (Deluxe Edition), rock_834.jpeg,  https://i.scdn.co/image/91feb90641b2bd629f27447deb539e2c658337f3 
Seether,  Isolate And Medicate (Deluxe Edition), rock_835.jpeg,  https://i.scdn.co/image/e09f0c22535a225d6d35e15041d862d25dcd2920 
Seether,  Isolate And Medicate (Deluxe Edition), rock_836.jpeg,  https://i.scdn.co/image/15c808e018a37a54fb3ed616b8a497c307350a47 
Seether,  Seether: 2002-2013, rock_837.jpeg,  https://i.scdn.co/image/9a28070901aadbac79dfe8f3af1455dbee5b3ebf 
Seether,  Seether: 2002-2013, rock_838.jpeg,  https://i.scdn.co/image/6bcfe64c2b7343db5f1a83bb5a13e4cd4b2465f0 
Seether,  Seether: 2002 - 2013 (Deluxe Version), rock_839.jpeg,  https://i.scdn.co/image/36a4cb0038db77b8cf764e2e2af30b2b5df0b43c 
Seether,  Seether: 2002 - 2013, rock_840.jpeg,  https://i.scdn.co/image/36a4cb0038db77b8cf764e2e2af30b2b5df0b43c 
Seether,  Seether: 2002 - 2013, rock_841.jpeg,  https://i.scdn.co/image/ad7bd5e5952a910e49aaeb0268079f4c59f373a2 
Seether,  Seether: 2002-2013 (Commentary), rock_842.jpeg,  https://i.scdn.co/image/6bcfe64c2b7343db5f1a83bb5a13e4cd4b2465f0 
Seether,  Holding Onto Strings Better Left To Fray (Bonus Commentary), rock_843.jpeg,  https://i.scdn.co/image/c935a0666ef40bdddeb2ef6859ddd8d4563ae40c 
Seether,  Holding Onto Strings Better Left To Fray (Bonus Commentary), rock_844.jpeg,  https://i.scdn.co/image/85461bbd254fb54e27f6d09733c8949639bf2f6d 
Seether,  Holding Onto Strings Better Left To Fray (Deluxe Version), rock_845.jpeg,  https://i.scdn.co/image/0d98edfeb8e710e6b0041ff8b9d7daac0eeb0623 
Seether,  Holding Onto Strings Better Left To Fray (Deluxe Version), rock_846.jpeg,  https://i.scdn.co/image/29319a38c19d349f7f7ab465a679d71616bc2650 
Seether,  Holding Onto Strings Better Left To Fray (Deluxe Version), rock_847.jpeg,  https://i.scdn.co/image/85461bbd254fb54e27f6d09733c8949639bf2f6d 
Seether,  Holding Onto Strings Better Left To Fray, rock_848.jpeg,  https://i.scdn.co/image/85461bbd254fb54e27f6d09733c8949639bf2f6d 
Seether,  Holding Onto Strings Better Left To Fray, rock_849.jpeg,  https://i.scdn.co/image/c935a0666ef40bdddeb2ef6859ddd8d4563ae40c 
Seether,  Finding Beauty In Negative Spaces (Bonus Track Version), rock_850.jpeg,  https://i.scdn.co/image/7001a96d5942ed25ba45f66d2d4b0a9ccee1e3a4 
Seether,  Finding Beauty In Negative Spaces (Bonus Track Version), rock_851.jpeg,  https://i.scdn.co/image/3fd7f6038a053e90aef4df67a3138166c20ede2f 
Seether,  Finding Beauty In Negative Spaces, rock_852.jpeg,  https://i.scdn.co/image/10cb53d4f01c7c871d3c9edb7ffbfd93dcde7b17 
Seether,  Finding Beauty In Negative Spaces (Bonus Track Version), rock_853.jpeg,  https://i.scdn.co/image/e7a6d119b4170de473b99a6d503479d9a90fe56d 
Seether,  Finding Beauty In Negative Spaces (Bonus Track Version), rock_854.jpeg,  https://i.scdn.co/image/29319a38c19d349f7f7ab465a679d71616bc2650 
