Queen,  A Night At The Opera, rock_1293.jpeg,  https://i.scdn.co/image/017de672573a061abe4330627d43b6dd4caf3da3 
Queen,  A Night At The Opera (Deluxe Edition 2011 Remaster), rock_1294.jpeg,  https://i.scdn.co/image/017de672573a061abe4330627d43b6dd4caf3da3 
Queen,  A Night At The Opera (Deluxe Remastered Version), rock_1295.jpeg,  https://i.scdn.co/image/f6e02ce8bc9e91afa0e220703072c20bf72c72c5 
Queen,  A Night At The Opera (Deluxe Edition 2011 Remaster), rock_1296.jpeg,  https://i.scdn.co/image/5f3e00ff03e69f8b7a778a7f64973dd0e64538cb 
Queen,  Sheer Heart Attack (2011 Remaster), rock_1297.jpeg,  https://i.scdn.co/image/5fff02f02c6a91861da51e957d355d2d1c7462d9 
Queen,  Sheer Heart Attack, rock_1298.jpeg,  https://i.scdn.co/image/a677891fc92543f76547e16ea65cfc6c0ebf60f7 
Queen,  Sheer Heart Attack (2011 Remaster), rock_1299.jpeg,  https://i.scdn.co/image/a677891fc92543f76547e16ea65cfc6c0ebf60f7 
Queen,  Sheer Heart Attack, rock_1300.jpeg,  https://i.scdn.co/image/2b0ba3d29944b7a5dca98739c0d5cdb8a9de65cd 
Queen,  Sheer Heart Attack (Deluxe Remastered Version), rock_1301.jpeg,  https://i.scdn.co/image/23febcfad6d12001a0df5a5f4c33e9ff78f8b2f1 
Queen,  Sheer Heart Attack (Deluxe Edition 2011 Remaster), rock_1302.jpeg,  https://i.scdn.co/image/5fff02f02c6a91861da51e957d355d2d1c7462d9 
Queen,  Queen II (2011 Remaster), rock_1303.jpeg,  https://i.scdn.co/image/8d1114bb58ddb8e56be00c65d68e9ec0a534ba70 
Queen,  Queen II (2011 Remaster), rock_1304.jpeg,  https://i.scdn.co/image/5c7d5799746a1a5c11218f4e041ea21ae640d0ae 
Queen,  Queen II, rock_1305.jpeg,  https://i.scdn.co/image/5c7d5799746a1a5c11218f4e041ea21ae640d0ae 
Queen,  Queen II, rock_1306.jpeg,  https://i.scdn.co/image/ae3ba99df1c7544c66bc588ee54b22472c4b6455 
Queen,  Queen II (Deluxe Remastered Version), rock_1307.jpeg,  https://i.scdn.co/image/49fbab728178f97e141d7849ffddc6782ed0c191 
Queen,  Queen II (Deluxe Edition 2011 Remaster), rock_1308.jpeg,  https://i.scdn.co/image/8d1114bb58ddb8e56be00c65d68e9ec0a534ba70 
Queen,  Queen II (Deluxe Edition 2011 Remaster), rock_1309.jpeg,  https://i.scdn.co/image/5c7d5799746a1a5c11218f4e041ea21ae640d0ae 
Queen,  Queen (2011 Remaster), rock_1310.jpeg,  https://i.scdn.co/image/2119c5ea381f5352bbe0171627a1cba7febef39d 
Queen,  Queen, rock_1311.jpeg,  https://i.scdn.co/image/eb96eab096a91b51b7222f308b8c86d4969bc24d 
Queen,  Queen (2011 Remaster), rock_1312.jpeg,  https://i.scdn.co/image/eb96eab096a91b51b7222f308b8c86d4969bc24d 
Queen,  Queen, rock_1313.jpeg,  https://i.scdn.co/image/954f6f18d88664ec78f57054bf85d9a273af70c0 
Queen,  Queen (Deluxe Remastered Version), rock_1314.jpeg,  https://i.scdn.co/image/81f015c5faaddf86f186dd98ccc963a82b1425d0 
Queen,  Queen (Deluxe Edition 2011 Remaster), rock_1315.jpeg,  https://i.scdn.co/image/b9b3b96fefd9e9ed9c037df66e6c8a0bd163dbd0 
Queen,  Queen (Deluxe Edition 2011 Remaster), rock_1316.jpeg,  https://i.scdn.co/image/2119c5ea381f5352bbe0171627a1cba7febef39d 
Queen,  At The BBC, rock_1317.jpeg,  https://i.scdn.co/image/55f76a8f738caccb902c5cc0803fd575a581c4dc 
Lynyrd Skynyrd,  One More For The Fans (Live), rock_1318.jpeg,  https://i.scdn.co/image/1e533d55913422d045b285422c016c3674264fa5 
Lynyrd Skynyrd,  One More for the Fans (Live), rock_1319.jpeg,  https://i.scdn.co/image/920a316a841a8690d1dddd782e41627ead84bf6d 
Lynyrd Skynyrd,  Pronounced Leh-nerd Skin-nerd (Live From Jacksonville At The Florida Theatre), rock_1320.jpeg,  https://i.scdn.co/image/f5228c8a99d5f3498a5094a741aa3278826a9c42 
Lynyrd Skynyrd,  Pronounced ’lĕh‐’nérd ’skin‐’nérd Live from Jacksonville at the Florida Theatre, rock_1321.jpeg,  https://i.scdn.co/image/b47e10eb92a8860461e6c197a15e8919cd99bbd5 
Lynyrd Skynyrd,  Second Helping (Live From Jacksonville at The Florida Theatre), rock_1322.jpeg,  https://i.scdn.co/image/2b4e7bd027f4fb8d5f96c4752809786c78bd301a 
Lynyrd Skynyrd,  Second Helping Live from Jacksonville at the Florida Theatre, rock_1323.jpeg,  https://i.scdn.co/image/3d77c012476507d806af47de8be30a5b83321fdf 
Lynyrd Skynyrd,  Second Helping - Live From Jacksonville At The Florida Theatre, rock_1324.jpeg,  https://i.scdn.co/image/45ad40dc8bf9d856141f082a3ba3a28daffd401b 
Lynyrd Skynyrd,  Second Helping Live from Jacksonville at the Florida Theatre, rock_1325.jpeg,  https://i.scdn.co/image/697ddec3bcba7adcec2adef1f83740e863199860 
Lynyrd Skynyrd,  Second Helping Live from Jacksonville at the Florida Theatre (Live), rock_1326.jpeg,  https://i.scdn.co/image/430fbde27a36f0e7e88257d94d9c01b1d1b71794 
Lynyrd Skynyrd,  Last Of A Dyin' Breed, rock_1327.jpeg,  https://i.scdn.co/image/59cc3155da6326b88b97ec57383f15cafb9f5199 
Lynyrd Skynyrd,  Last Of A Dyin' Breed (Special Edition), rock_1328.jpeg,  https://i.scdn.co/image/59cc3155da6326b88b97ec57383f15cafb9f5199 
Lynyrd Skynyrd,  Skynyrd Nation, rock_1329.jpeg,  https://i.scdn.co/image/bffb7a5bee6386c4de41fd4c710ad603bdeb7ec4 
Lynyrd Skynyrd,  Live From Freedom Hall, rock_1330.jpeg,  https://i.scdn.co/image/7330490ed432b1c78984d2c2e6f67fe2e8a01b8a 
Lynyrd Skynyrd,  God & Guns, rock_1331.jpeg,  https://i.scdn.co/image/f9063a3bff504a16fc54e9d302484ebb9a5ed94a 
Lynyrd Skynyrd,  God & Guns [Special Edition], rock_1332.jpeg,  https://i.scdn.co/image/7ab42ac6b44f0b9c22c6aa4ca4df5bb5611453d8 
Lynyrd Skynyrd,  Sweet Home Alabama Live At Rockpalast, rock_1333.jpeg,  https://i.scdn.co/image/15017be21c51fa820043f62371a692a0c84dfaf1 
Lynyrd Skynyrd,  Sweet Home Alabama - Live At Rockpalast 1996, rock_1334.jpeg,  https://i.scdn.co/image/66a93ca2473dfb9b17b1586383c37f0c6143a8a2 
Lynyrd Skynyrd,  Lynyrd Skynyrd - Lyve, rock_1335.jpeg,  https://i.scdn.co/image/9f63514c23dd5b48c62ac96e83ec2572e1a81c6d 
Lynyrd Skynyrd,  Vicious Cycle, rock_1336.jpeg,  https://i.scdn.co/image/4572b09311afbcf4a6b12c9f0b08fbd57d03384e 
Lynyrd Skynyrd,  Christmas Time Again, rock_1337.jpeg,  https://i.scdn.co/image/ef39623ddfa7e7fcd02edf0316e3d8d89e4d8a34 
Lynyrd Skynyrd,  Then and Now, rock_1338.jpeg,  https://i.scdn.co/image/1bb93c7819222ea9227f8eb1eb698e3345091e3f 
Lynyrd Skynyrd,  Edge of Forever, rock_1339.jpeg,  https://i.scdn.co/image/bf8d088eda7b06670fda7ed3aa9cd59762bfbf2e 
Lynyrd Skynyrd,  Twenty, rock_1340.jpeg,  https://i.scdn.co/image/fb45d54dda9fd64cc1656d17cb84d74e2de41b5a 
Lynyrd Skynyrd,  Freebird The Movie, rock_1341.jpeg,  https://i.scdn.co/image/2a08dcbc62954c0e38cd582a22f9958b5caa0f76 
Lynyrd Skynyrd,  Freebird The Movie, rock_1342.jpeg,  https://i.scdn.co/image/3ecc280f5490052b5275f32e1bb14dd4bcfcd54b 
Lynyrd Skynyrd,  Endangered Species, rock_1343.jpeg,  https://i.scdn.co/image/0e018145fda804470295a0043283a399a50cb640 
Lynyrd Skynyrd,  The Last Rebel, rock_1344.jpeg,  https://i.scdn.co/image/9d214bd3fd4d46e5f3bd4ae64e74b40f3fb5f7be 
Lynyrd Skynyrd,  1991, rock_1345.jpeg,  https://i.scdn.co/image/395b6be02bf788ca02ac424b99317e29c7abd95e 
Lynyrd Skynyrd,  Southern By The Grace Of God, rock_1346.jpeg,  https://i.scdn.co/image/3adae929ef97cbf698b0c38944fd4a39d50f32d0 
Lynyrd Skynyrd,  Southern By The Grace Of God (UK Mid Price), rock_1347.jpeg,  https://i.scdn.co/image/0dc8fae0ef89bea6b0f5a309e2987653249a8be0 
Lynyrd Skynyrd,  Southern By The Grace Of God- Lynyrd Skynyrd Tribute Tour - 1987 (Live), rock_1348.jpeg,  https://i.scdn.co/image/ba31bc7e41aaab0deb28270a81365f287fdf231d 
Aerosmith,  Live In Berlin, rock_1349.jpeg,  https://i.scdn.co/image/01210ee8bf96e0d6c8e6941df6d6ee0663d8401c 
Aerosmith,  Music From Another Dimension!, rock_1350.jpeg,  https://i.scdn.co/image/332e01f24f1eb71d898eb0db8d3d641eea5b0240 
Aerosmith,  Music From Another Dimension!, rock_1351.jpeg,  https://i.scdn.co/image/67590c0e999b34b74d95e1a363e4528587f8d846 
Aerosmith,  Honkin' On Bobo, rock_1352.jpeg,  https://i.scdn.co/image/66d729bc29c5e05a119d33f4e91afc33b29ad337 
Aerosmith,  Honkin' On Bobo, rock_1353.jpeg,  https://i.scdn.co/image/dd5b64419efb3726433dcaf86d94bb851f03c068 
Aerosmith,  Just Push Play, rock_1354.jpeg,  https://i.scdn.co/image/7b661758bc3def38e8a43769fdbe088aa5f151e4 
Aerosmith,  A Little South Of Sanity, rock_1355.jpeg,  https://i.scdn.co/image/bddee6b497adbdf4dcb6446124ff6f1a86feb762 
Aerosmith,  A Little South Of Sanity, rock_1356.jpeg,  https://i.scdn.co/image/7b12f61b18d7c0cc5fbbd4e2504b08c8b68d292e 
Aerosmith,  A Little South Of Sanity, rock_1357.jpeg,  https://i.scdn.co/image/9ee558c7a0b8d92aae720a6491405a6d035ff930 
Aerosmith,  A Little South Of Sanity (Edited Version), rock_1358.jpeg,  https://i.scdn.co/image/026513fff702914437edfecd869980521f442a25 
Aerosmith,  Nine Lives, rock_1359.jpeg,  https://i.scdn.co/image/e33fe68751b36a8dde200eca575cb581298904d3 
Aerosmith,  Transmissions: Live On Air, rock_1360.jpeg,  https://i.scdn.co/image/c56c42f64e0f586a830323dddfe618d0f2275865 
Aerosmith,  Get A Grip, rock_1361.jpeg,  https://i.scdn.co/image/f42de1a4044ccc34256ef9576d713c2c9b8eb7b9 
Aerosmith,  Get A Grip (Reissue - Remaster), rock_1362.jpeg,  https://i.scdn.co/image/74e421371cfa65ef69729ca33d016d0ff00b3e25 
Aerosmith,  Pump (Remastered), rock_1363.jpeg,  https://i.scdn.co/image/8158eb882d0333fab83da6ce5db876fb9db3d236 
Aerosmith,  Pump (Remastered), rock_1364.jpeg,  https://i.scdn.co/image/4b94531b6cea2cc8907ef1f8ce5ad57bbfed89b8 
Aerosmith,  Permanent Vacation (Reissue Remastered), rock_1365.jpeg,  https://i.scdn.co/image/f5e5c85d09b2aa5b518e060c1eedb7b15b34cb5e 
Aerosmith,  Permanent Vacation (Remastered), rock_1366.jpeg,  https://i.scdn.co/image/4e0ff6b66679463554bd59504da292487f8879ea 
Aerosmith,  Classics Live II, rock_1367.jpeg,  https://i.scdn.co/image/7cfff8966cbc684c159ff03e8b6e70d0c3e1b6d8 
Aerosmith,  Classics Live, rock_1368.jpeg,  https://i.scdn.co/image/d3f8ea58f90f2f4778a5d82d3ce473b123ae1991 
Aerosmith,  Done With Mirrors, rock_1369.jpeg,  https://i.scdn.co/image/021212a0d54490259d7f8ab3cfc6575a1cfa701f 
Aerosmith,  Done With Mirrors, rock_1370.jpeg,  https://i.scdn.co/image/dad9e36a2bf63f2b653e04408dd4413692325870 
Aerosmith,  Rock In A Hard Place, rock_1371.jpeg,  https://i.scdn.co/image/691acbc4ad502bb2863265866c5183772b0b8b89 
Aerosmith,  Night In The Ruts, rock_1372.jpeg,  https://i.scdn.co/image/5a33f9e9b6a7198c4686348decb6a6ac6cba653f 
Aerosmith,  Live! Bootleg, rock_1373.jpeg,  https://i.scdn.co/image/c40fc2fa3b575154bbae5b319e909c65b12882dc 
Aerosmith,  Draw The Line, rock_1374.jpeg,  https://i.scdn.co/image/1e7d7326995bcb9915429b530236accf38136289 
Aerosmith,  Rocks, rock_1375.jpeg,  https://i.scdn.co/image/eafe99f28b2ca36fb7d2632b670c53d77603ce62 
Aerosmith,  Toys In The Attic, rock_1376.jpeg,  https://i.scdn.co/image/c34dd22b96e2fe11f75a9db24d1a6a3382832f77 
Aerosmith,  Get Your Wings, rock_1377.jpeg,  https://i.scdn.co/image/4b2e4e97717b8acc610ec7a24c8405e70d52a397 
Aerosmith,  AEROSMITH, rock_1378.jpeg,  https://i.scdn.co/image/cbe7e5044b2a0f0102c268a6107f56a553bc5042 
Aerosmith,  Aerosmith, rock_1379.jpeg,  https://i.scdn.co/image/67272b180000fe6b4992ee8b42b62d20517bd97e 
Dire Straits,  Live At The BBC, rock_1380.jpeg,  https://i.scdn.co/image/4618e2a12ecd32466de903e387cdb8eb860e5710 
Dire Straits,  Live At The BBC, rock_1381.jpeg,  https://i.scdn.co/image/432303356ee5e71c39048f0e6c815276d861498b 
Dire Straits,  Live In Concert, rock_1382.jpeg,  https://i.scdn.co/image/f79fc681315c3e661f1d2ad41734969e0355b457 
Dire Straits,  On The Night (Remastered), rock_1383.jpeg,  https://i.scdn.co/image/90c383031ac3d4c92a7006fae526358ecb3d5dfa 
Dire Straits,  On The Night (Remastered), rock_1384.jpeg,  https://i.scdn.co/image/fa176d19a1dc00bad8f882ab3e8cdaf970dc3f69 
Dire Straits,  Live: On The Night, rock_1385.jpeg,  https://i.scdn.co/image/0a2aad5ca09ac7ec6800f05b19ab1889a4963cc4 
Dire Straits,  On Every Street (Remastered Version), rock_1386.jpeg,  https://i.scdn.co/image/ee0c9f516b4f4059c095123b995a7ac009077215 
Dire Straits,  On Every Street (Remastered), rock_1387.jpeg,  https://i.scdn.co/image/b9ffa5d45a578b22a5a34efee9271d41e09e7d5e 
Dire Straits,  On Every Street (Remastered), rock_1388.jpeg,  https://i.scdn.co/image/959be629c81420db65dbea6a51ff5f58f414f92e 
Dire Straits,  Brothers In Arms (Remastered), rock_1389.jpeg,  https://i.scdn.co/image/ee6d0d264005b0549be5fa76d0cf6e57d0a542ce 
Dire Straits,  Brothers In Arms, rock_1390.jpeg,  https://i.scdn.co/image/d24a735d8ff6ef1b39abc09a3129260a21b2e55b 
Dire Straits,  Brothers In Arms, rock_1391.jpeg,  https://i.scdn.co/image/101eb29d13d8896657a55d83600897ead55e2c74 
Dire Straits,  Brothers In Arms - 20th Anniversary Edition, rock_1392.jpeg,  https://i.scdn.co/image/3778238d42009b2284712b5f84b20d0b7efebc17 
Dire Straits,  Alchemy: Dire Straits Live (Remastered), rock_1393.jpeg,  https://i.scdn.co/image/8008d4446ede6a702acd64a332bbf5f7eac49d4e 
Dire Straits,  Alchemy: Dire Straits Live (Remastered), rock_1394.jpeg,  https://i.scdn.co/image/0ae18498959fe200b0a1b6f62857463c4de60fc7 
Dire Straits,  Love Over Gold (Remastered), rock_1395.jpeg,  https://i.scdn.co/image/1f72f4f4cbf206e3f34f7171b8a8af18ba01de07 
Dire Straits,  Love Over Gold, rock_1396.jpeg,  https://i.scdn.co/image/ec9aef862e7591ee35de17935a4c4695428fdd51 
Dire Straits,  Love Over Gold, rock_1397.jpeg,  https://i.scdn.co/image/fa2d0868728c64ec99cf89477c3308fd16d9eace 
Dire Straits,  Making Movies (Remastered), rock_1398.jpeg,  https://i.scdn.co/image/4548ee109f6640f79dabc4fde5458a3ffc8c55ca 
Dire Straits,  Making Movies, rock_1399.jpeg,  https://i.scdn.co/image/4f0ac1c3e7fa9e770562423f147837b9aea88230 
Dire Straits,  Making Movies, rock_1400.jpeg,  https://i.scdn.co/image/632d8b590a0a2b9c657dff9ab2f7d94de4e76f14 
Dire Straits,  Communique (Remastered), rock_1401.jpeg,  https://i.scdn.co/image/855e83152c32e328866f8f3c62625b779f0f9ac0 
Dire Straits,  Communique, rock_1402.jpeg,  https://i.scdn.co/image/d84a10a8b537dbb8943e00562855a56cf36da1a1 
Dire Straits,  Communique (Remastered), rock_1403.jpeg,  https://i.scdn.co/image/a1e695882dbfd451e18749cf84532099b031dc8a 
Dire Straits,  Dire Straits (Remastered), rock_1404.jpeg,  https://i.scdn.co/image/c8280e7f593f25b79bb49941ad59a73c9cfb41d9 
Dire Straits,  Dire Straits, rock_1405.jpeg,  https://i.scdn.co/image/a635106f337f4216c7c05f72e43aac71c89c9d77 
Dire Straits,  Dire Straits (Remastered), rock_1406.jpeg,  https://i.scdn.co/image/54ecdefaba171f38e0f37996caae841468f73eee 
Led Zeppelin,  The Complete BBC Sessions, rock_1407.jpeg,  https://i.scdn.co/image/776b35448d2877049145bf9f2a32f7b938c3dd6e 
Led Zeppelin,  Celebration Day, rock_1408.jpeg,  https://i.scdn.co/image/a867ac7ab82d75f79a29aff6cce5237df9ab3c78 
Led Zeppelin,  Mothership (Remastered), rock_1409.jpeg,  https://i.scdn.co/image/37e17a2b4df113e3de4b57f46d87b625345134e5 
Led Zeppelin,  How The West Was Won, rock_1410.jpeg,  https://i.scdn.co/image/44c112bf5add71ba1aac63d4f9f582061d89975e 
Led Zeppelin,  Coda (Deluxe Edition), rock_1411.jpeg,  https://i.scdn.co/image/08b6a5ab34c2af00d2ff35941306f390865fc2f9 
Led Zeppelin,  Coda (Remastered), rock_1412.jpeg,  https://i.scdn.co/image/080fea392cce7b4a2b79b95ef0238f6baaf33796 
Led Zeppelin,  Coda, rock_1413.jpeg,  https://i.scdn.co/image/2e743754e9a9da28a7d81952a13a061ff851587b 
Led Zeppelin,  In Through The Out Door (Deluxe Edition), rock_1414.jpeg,  https://i.scdn.co/image/403030ad9f4748de2a5668347c73c0dc5f06cd20 
Led Zeppelin,  In Through The Out Door (Remastered), rock_1415.jpeg,  https://i.scdn.co/image/6a9c478ccd4b7efb1b2dddef7433f092368ac902 
Led Zeppelin,  In Through The Out Door, rock_1416.jpeg,  https://i.scdn.co/image/928be7b3ed311440d4690e36987df56a7218142e 
Led Zeppelin,  The Song Remains The Same, rock_1417.jpeg,  https://i.scdn.co/image/5cbc901e77a03044834c96c81711a1c83a656a8a 
Led Zeppelin,  Presence (Deluxe Edition), rock_1418.jpeg,  https://i.scdn.co/image/cfcaa033ac88cc889d4dff652471ec3c879563e4 
Led Zeppelin,  Presence (Remastered), rock_1419.jpeg,  https://i.scdn.co/image/db19c43d6ff020a59a76f47ac19c8ff85fd79552 
Led Zeppelin,  Presence, rock_1420.jpeg,  https://i.scdn.co/image/51d0f9107d3b6719724dd62cd4614b77e2e496e8 
Led Zeppelin,  Physical Graffiti, rock_1421.jpeg,  https://i.scdn.co/image/e9e82cfa89aaeb1f6b1f8756a98e40ccc65e8a01 
Led Zeppelin,  Physical Graffiti, rock_1422.jpeg,  https://i.scdn.co/image/c4e126e8e773f048bd35e3cbf1c0476323a3d72c 
Led Zeppelin,  Physical Graffiti (Deluxe Edition), rock_1423.jpeg,  https://i.scdn.co/image/e4d437831cccc9967dc92726c59e855ac59d6abd 
Led Zeppelin,  Physical Graffiti (Deluxe Edition), rock_1424.jpeg,  https://i.scdn.co/image/e4d437831cccc9967dc92726c59e855ac59d6abd 
Led Zeppelin,  Houses Of The Holy (Deluxe Edition), rock_1425.jpeg,  https://i.scdn.co/image/686ba2cb84fd5b12f9c2dbcca46434f93532157c 
Led Zeppelin,  Houses Of The Holy (Remastered), rock_1426.jpeg,  https://i.scdn.co/image/ce0c417e5384e470a7d89c912fddb65ef6ba7e25 
Led Zeppelin,  Houses Of The Holy, rock_1427.jpeg,  https://i.scdn.co/image/5e97557ac3342a8d3f0edd10eedcbf3ec04e9f88 
Led Zeppelin,  Led Zeppelin IV (Deluxe Edition), rock_1428.jpeg,  https://i.scdn.co/image/557a6058e3de72bf37ffcd2c12dd5932276df344 
Led Zeppelin,  Led Zeppelin IV (Remastered Version), rock_1429.jpeg,  https://i.scdn.co/image/e3e5693621719d65dbc8d4322bbf02d3b822d162 
Led Zeppelin,  Led Zeppelin III (Remastered Deluxe Edition), rock_1430.jpeg,  https://i.scdn.co/image/9e42f70cb9660d6667f0964d9b69eb55a793283b 
Led Zeppelin,  Led Zeppelin III (Remastered), rock_1431.jpeg,  https://i.scdn.co/image/e6e513e68c4eefdfc7bc213b35061c9c30b42dfa 
Led Zeppelin,  Led Zeppelin II (Deluxe Edition), rock_1432.jpeg,  https://i.scdn.co/image/336b332be6bb8ea9d541204d8a8bd812c13cd9e7 
Led Zeppelin,  Led Zeppelin II (Remastered Deluxe Edition), rock_1433.jpeg,  https://i.scdn.co/image/336b332be6bb8ea9d541204d8a8bd812c13cd9e7 
Led Zeppelin,  Led Zeppelin II (Remastered), rock_1434.jpeg,  https://i.scdn.co/image/4ca386c897e953aa67e5ff247c5e51677e3ba1b1 
Led Zeppelin,  Led Zeppelin II, rock_1435.jpeg,  https://i.scdn.co/image/5fa3a6cc1848ea743a293d2088046746d1b09608 
Led Zeppelin,  Led Zeppelin (Remastered Deluxe Edition), rock_1436.jpeg,  https://i.scdn.co/image/809018900c4e3293d656c5a23d5ca871fc8f7c5d 
Led Zeppelin,  Led Zeppelin (Deluxe Edition), rock_1437.jpeg,  https://i.scdn.co/image/809018900c4e3293d656c5a23d5ca871fc8f7c5d 
Led Zeppelin,  Led Zeppelin (Remastered), rock_1438.jpeg,  https://i.scdn.co/image/71e6a72a1b3a00d2ddabee9a3e2d5ade3be25409 
Led Zeppelin,  Led Zeppelin, rock_1439.jpeg,  https://i.scdn.co/image/71e6a72a1b3a00d2ddabee9a3e2d5ade3be25409 
Fleetwood Mac,  Say You Will, rock_1440.jpeg,  https://i.scdn.co/image/fb57a38ad62f25271f875792653ce570978133ca 
Fleetwood Mac,  Shrine '69, rock_1441.jpeg,  https://i.scdn.co/image/ca3fbc79d2971f94c5dd95b20acb1c9a4a190aae 
Fleetwood Mac,  The Dance, rock_1442.jpeg,  https://i.scdn.co/image/0be47e52efdec43e2ef29f74ae488aad965e316f 
Fleetwood Mac,  Time, rock_1443.jpeg,  https://i.scdn.co/image/a82cee4e15dd412e2aa6e681f29802e7505f863c 
Fleetwood Mac,  Behind The Mask, rock_1444.jpeg,  https://i.scdn.co/image/0d9e330b16043f0280e11eff278c5796bc37c82c 
Fleetwood Mac,  Tango In The Night (Remastered), rock_1445.jpeg,  https://i.scdn.co/image/45553d8b9ee287544e870a0bf98b6e01f9728b1a 
Fleetwood Mac,  Tango In the Night (Deluxe), rock_1446.jpeg,  https://i.scdn.co/image/6745f6af5d57f2ee14cb320ce1edf9fda05c08e2 
Fleetwood Mac,  Live In Boston, rock_1447.jpeg,  https://i.scdn.co/image/07c670cf8bffcf5a929d94a3dccd65f5f5e8bcbf 
Fleetwood Mac,  Mirage (Deluxe), rock_1448.jpeg,  https://i.scdn.co/image/d8d4d0801b91bbd2212ff9ea14593708cf824930 
Fleetwood Mac,  Mirage (Remastered), rock_1449.jpeg,  https://i.scdn.co/image/02b26aeef7ff5234b94791cde16f5c494ce75b0a 
Fleetwood Mac,  Live, rock_1450.jpeg,  https://i.scdn.co/image/0a02844fd6af48a5e628546b6e63563bf1c35c3b 
Fleetwood Mac,  Tusk (Deluxe), rock_1451.jpeg,  https://i.scdn.co/image/243adea7c80f769775727489bb5eef45bc24c6db 
Fleetwood Mac,  Tusk (Remastered), rock_1452.jpeg,  https://i.scdn.co/image/eea405ef8c9614d882149ebbccf7135ad57b8844 
Fleetwood Mac,  Rumours, rock_1453.jpeg,  https://i.scdn.co/image/45921abb56197ee80becee61f1d4241bb5212e58 
Fleetwood Mac,  Rumours (Deluxe), rock_1454.jpeg,  https://i.scdn.co/image/42195211685a0b44f8d8d51b02b2605acb2c5b10 
Fleetwood Mac,  Rumours (Super Deluxe), rock_1455.jpeg,  https://i.scdn.co/image/5d6296e45ce540774713b30bc4e74a87df6604f2 
Fleetwood Mac,  Fleetwood Mac, rock_1456.jpeg,  https://i.scdn.co/image/9e1484c528939f05c09f062fd482d7d07a7bf263 
Fleetwood Mac,  Heroes Are Hard To Find, rock_1457.jpeg,  https://i.scdn.co/image/1661aee8fd606afbbc1a4742749c9c3a5978f258 
Fleetwood Mac,  Mystery To Me, rock_1458.jpeg,  https://i.scdn.co/image/e20b2ce79146a967e37ff1413af3290a2923eafc 
Fleetwood Mac,  Penguin, rock_1459.jpeg,  https://i.scdn.co/image/25b86c1661b8342fa502598097d49ff295f8486b 
Fleetwood Mac,  Bare Trees, rock_1460.jpeg,  https://i.scdn.co/image/e08e6e3d794111024d046bdd128fd2b21a5a8fcf 
Fleetwood Mac,  Future Games, rock_1461.jpeg,  https://i.scdn.co/image/37069124e2533ee5991068cf321e629cb00da839 
Fleetwood Mac,  Kiln House, rock_1462.jpeg,  https://i.scdn.co/image/8fb411ec0cbc7ca13e610ca570b39beee4febaca 
Fleetwood Mac,  Mr Wonderful, rock_1463.jpeg,  https://i.scdn.co/image/39721fe31f65e70c9542278c11143140a40441bf 
Fleetwood Mac,  Mr. Wonderful, rock_1464.jpeg,  https://i.scdn.co/image/851400bfe4fd17019f29186d26b48832052cfbad 
Fleetwood Mac,  Mr. Wonderful, rock_1465.jpeg,  https://i.scdn.co/image/8e89a22afa2539e9cd4700c393a6e5171483f733 
Fleetwood Mac,  Fleetwood Mac, rock_1466.jpeg,  https://i.scdn.co/image/2ac4a0aea6122571e91bebbd7fe76c9895750f79 
Fleetwood Mac,  Fleetwood Mac, rock_1467.jpeg,  https://i.scdn.co/image/02acc1e049318449ce5f70dfc885a8b16805c688 
Fleetwood Mac,  Fleetwood Mac, rock_1468.jpeg,  https://i.scdn.co/image/b0ed31f10255b88449460bc79bc195f7f363408c 
Fleetwood Mac,  Fleetwood Mac, rock_1469.jpeg,  https://i.scdn.co/image/18ff8fd42c9499416a3bc54c4f8fed27cdb50488 
Fleetwood Mac,  Fleetwood Mac [1968], rock_1470.jpeg,  https://i.scdn.co/image/445f8956cd4b1f84bc87f465720bc132c2ca025c 
Journey,  Frontiers+8, rock_1471.jpeg,  https://i.scdn.co/image/5c710d7110970d58305e2bf683fb7c2803138b44 
Journey,  Escape+7, rock_1472.jpeg,  https://i.scdn.co/image/7712caa1b4386c2dbda5798460521c9025289bf8 
Journey,  Greatest Hits 1 & 2, rock_1473.jpeg,  https://i.scdn.co/image/c1bd4f74c8d0eb21c833afaad23afdfffc66dcd4 
Metallica,  Metallica Through The Never (Music From The Motion Picture), rock_1.jpeg,  https://i.scdn.co/image/ebfa16fd753035a10518c2fac10793114edf49d7 
Metallica,  Metallica Through The Never (Music From The Motion Picture), rock_2.jpeg,  https://i.scdn.co/image/9554edfdc05083c06a4ec98ac623a827ca920866 
Metallica,  Metallica Through The Never (Music from the Motion Picture), rock_3.jpeg,  https://i.scdn.co/image/1362a06f43c913c2ab376b78755a2c8cccc51362 
Metallica,  Lulu, rock_4.jpeg,  https://i.scdn.co/image/6c951f3f334e05ffacf598e168aed321f5b8ffc3 
Metallica,  ...And Justice For All, rock_5.jpeg,  https://i.scdn.co/image/a8f6cd386459022a5a57d3af9b631a636aee88d8 
Metallica,  ...And Justice For All, rock_6.jpeg,  https://i.scdn.co/image/db797c3e1ef01ecd96ea55787410bd56921cf8a3 
Metallica,  ...And Justice For All, rock_7.jpeg,  https://i.scdn.co/image/9b39d31f336ac340c84fa756cee19bb589020865 
Metallica,  Death Magnetic, rock_8.jpeg,  https://i.scdn.co/image/f9b6792d5fc79490072064f68200bce7c82d8b53 
Metallica,  Death Magnetic, rock_9.jpeg,  https://i.scdn.co/image/e777e126e8f49c599adfcc046e201d166a28c2a7 
Metallica,  Death Magnetic, rock_10.jpeg,  https://i.scdn.co/image/62aa2177e246019eb782cd03028e266bf2ca17d7 
Metallica,  Some Kind Of Monster, rock_11.jpeg,  https://i.scdn.co/image/844cf6dba35b7d64fa5b2ab31b948a01c9e286d9 
Metallica,  Some Kind Of Monster, rock_12.jpeg,  https://i.scdn.co/image/7ff3342f64550323a9216cc94c4f7920f2764385 
Metallica,  Some Kind Of Monster (Live), rock_13.jpeg,  https://i.scdn.co/image/bd28ddb2a6973aa554c5aa1e161b1041a4d93aaa 
Metallica,  St. Anger, rock_14.jpeg,  https://i.scdn.co/image/97274b39ee9f3a9e60719a690ff743ab31dd6f62 
Metallica,  St. Anger, rock_15.jpeg,  https://i.scdn.co/image/e7c527d29e99edbae0318be381c4077a9272a6ea 
Metallica,  St. Anger, rock_16.jpeg,  https://i.scdn.co/image/cee5a66fedfd0fb41ac41742f2c26f46b6f73a67 
Metallica,  S & M, rock_17.jpeg,  https://i.scdn.co/image/3723111645cb827a1ee4a29364c7e4587dfee7e3 
Metallica,  S & M, rock_18.jpeg,  https://i.scdn.co/image/fdfaf41a921c4c55527d1f88cec0014fc04a32f8 
Metallica,  S&M, rock_19.jpeg,  https://i.scdn.co/image/390d4603d8c25a1635863fafd129e86560b2b60d 
Metallica,  Garage Inc., rock_20.jpeg,  https://i.scdn.co/image/807d725709ab669fa4ae0a064532dfe4b06da476 
Metallica,  Garage Inc., rock_21.jpeg,  https://i.scdn.co/image/b9bd225d69141727e50bc769f63d43c17ea3cf95 
Metallica,  Reload, rock_22.jpeg,  https://i.scdn.co/image/a63453a8316030516bdff6ae4add9d72a869d87b 
Metallica,  Reload, rock_23.jpeg,  https://i.scdn.co/image/e38198e475f0375704a88d86c682838dea616cf1 
Metallica,  Reload, rock_24.jpeg,  https://i.scdn.co/image/f0d7210ed0036b9a5a0cfb6208655d1560a1dd25 
Metallica,  Load, rock_25.jpeg,  https://i.scdn.co/image/ede7ac0c0896e39c8f26c8f24737aa1f1af4ef6b 
Metallica,  Load, rock_26.jpeg,  https://i.scdn.co/image/6ac1a523e3fdb90987efbdb69544787af3b907c3 
Metallica,  Load, rock_27.jpeg,  https://i.scdn.co/image/d5ff91dc73c9c4acce0a4068aafddc2bc57c4830 
Metallica,  Live Sh*t: Binge & Purge (Live In Mexico City), rock_28.jpeg,  https://i.scdn.co/image/498d2bae053b8e498a642ccbccb6ce05ef47b49c 
Metallica,  Live Sh*t: Binge & Purge (Live In Mexico City), rock_29.jpeg,  https://i.scdn.co/image/2ec984b25aa96f25de8766a822531e7e77e2175d 
Metallica,  Live S**t: Binge & Purge, rock_30.jpeg,  https://i.scdn.co/image/829a38926b5fbf3967fa0d3cffa749534b4ab0b4 
Metallica,  Metallica, rock_31.jpeg,  https://i.scdn.co/image/0dd4cf1837e63e212b1c2632226fce0c269e7153 
Metallica,  Metallica, rock_32.jpeg,  https://i.scdn.co/image/1e886ca74a1dc17b9a226283b9cc4b765ee25cb8 
Metallica,  Metallica, rock_33.jpeg,  https://i.scdn.co/image/deb44798f4a2fff65c62bf4ca2c9b0ebb4a7f5f2 
