6, 6, 4, Apocalyptica,   Plays Metallica by Four Cellos (Remastered),   https://i.scdn.co/image/e96c29030aa468f0965d8dccad9bcbe528b84bdf
9, 12, 13, Bullet For My Valentine,   The Poison,   https://i.scdn.co/image/159d82a897744928f13be491d442169e1c524d67
10, 12, 15, Nightwish,   Wishmaster,   https://i.scdn.co/image/3b6957201c4acf250bd33197de94a5578f245add
15, 15, 15, Helloween,   The Time of the Oath,   https://i.scdn.co/image/103e824482530a05103a20538ee23bedeb8f48b2
15, 15, 15, Deftones,   Adrenaline,   https://i.scdn.co/image/ade375636c4ac2b39d35979e5a94469bbc8e5066
14, 14, 14, Deftones,   Around The Fur,   https://i.scdn.co/image/a236e1988e6625faf03cb81a2eed167eb72906d0
14, 14, 14, DevilDriver,   Trust No One,   https://i.scdn.co/image/f171fef93ae1cb226e54360887a9df02cbbfe29a
11, 11, 11, Anthrax,   Spreading The Disease,   https://i.scdn.co/image/511d782c2f94435748bf9d028d87cd73ade76092
15, 10, 7, System Of A Down,   Steal This Album!,   https://i.scdn.co/image/53220aed9aacb20f96470e6a875d7699e3c1b3d2
14, 16, 8, Dream Theater,   Chaos In Motion 2007/2008,   https://i.scdn.co/image/1365500a0b9f1bdac62e28cf9a77e54a3f4e72bf
22, 19, 2, Avenged Sevenfold,   City Of Evil (Non-PA Version),   https://i.scdn.co/image/a36e2063659983384a65c0e7c642dce13232322b
20, 19, 15, Opeth,   The Candlelight Years,   https://i.scdn.co/image/198a5a44319b4303bc30f5b9683ec87d3d62320b
17, 18, 12, Hammerfall,   Built to Last,   https://i.scdn.co/image/0eee4e20bace5046dbc235d3708514a2425f78e8
17, 18, 12, Hammerfall,   Built To Last,   https://i.scdn.co/image/91aa89bdb4819e6301cfafcd098d6dfd5cbf5fec
17, 18, 12, Hammerfall,   (r)Evolution,   https://i.scdn.co/image/0dbd337109d19f1efe30c6b94cddde6dba718f31
17, 18, 12, Hammerfall,   (r)Evolution,   https://i.scdn.co/image/f91e60999cd2af6696ec4bbf43173fca8adac61c
31, 27, 8, Morbid Angel,   Domination,   https://i.scdn.co/image/6ff53bdf5520ad09347ae137e70412b6875317e1
30, 22, 10, Hammerfall,   Glory to the Brave,   https://i.scdn.co/image/4bac68448b21b980740efbbd817e17e1c2f465f4
30, 22, 10, Hammerfall,   Glory To The Brave,   https://i.scdn.co/image/94c07c2807c94f159ea87565b4559c00d2467bcf
31, 17, 15, Anthrax,   Anthems,   https://i.scdn.co/image/c69275d5d962f48a37c7476bc6aa0336010e937c
29, 16, 14, Anthrax,   For All Kings,   https://i.scdn.co/image/383ce865eca2084ae986443aaa55c30ce4291ca2
31, 18, 9, Alestorm,   Black Sails At Midnight,   https://i.scdn.co/image/5704f864bb9df6d174c9c80f8b2434449e326d9b
28, 14, 7, Avenged Sevenfold,   City Of Evil (PA Version),   https://i.scdn.co/image/88e04419e6cad4f11d2d25c08d9c5d1e87aa1371
27, 8, 6, Slayer,   Diabolus In Musica,   https://i.scdn.co/image/356167faf6ff250ded59b0c862abce7e44581525
29, 6, 7, Nightwish,   Over The Hills And Far Away,   https://i.scdn.co/image/b429813f12a347f9a99a6dadc6f04e5bd539af8a
21, 6, 5, Disturbed,   Asylum,   https://i.scdn.co/image/14697511fc87c06e730e2ab3c3496619215420d0
21, 13, 8, Slipknot,   Slipknot,   https://i.scdn.co/image/5374aba5386ae541ab779c2f22097c8772567779
30, 8, 9, Disturbed,   Asylum (Deluxe),   https://i.scdn.co/image/68ade2f07821ee362786d16a3a9d70ce84c8f984
26, 14, 8, Slayer,   Repentless,   https://i.scdn.co/image/980c1498cfd89daa5379e523a68c45be2e898419
31, 13, 15, Nightwish,   From Wishes To Eternity,   https://i.scdn.co/image/21d05fa51f7f8227f4d84b536c059153a283216b
26, 18, 17, Morbid Angel,   Altars of Madness (Full Dynamic Range Edition),   https://i.scdn.co/image/b620ba13634b375c7fb9aa6d02ee0bc0a16d0959
27, 16, 16, Slayer,   Repentless,   https://i.scdn.co/image/980c1498cfd89daa5379e523a68c45be2e898419
31, 17, 16, Apocalyptica,   7th Symphony,   https://i.scdn.co/image/906739982b4c7aba7098014a07cff0250e73a9a5
29, 19, 18, Metallica,   Kill 'Em All (Remastered),   https://i.scdn.co/image/f968547e906c0a2b0916b78ac68f42edb3a2d71e
29, 19, 18, Slayer,   Repentless,   https://i.scdn.co/image/ec278aa4b347958c37bbdfb428e70484527b4847
29, 19, 18, Slayer,   Repentless,   https://i.scdn.co/image/dd5a5493a7828c4933c79942730bdb8b90b9d1a6
29, 19, 18, Slayer,   Repentless,   https://i.scdn.co/image/df2221b3a4a7b2f0e14138172caaa6319e37e6ee
30, 21, 18, Hammerfall,   Gates of Dalhalla (Live),   https://i.scdn.co/image/4551e234f3c4bdc60f90212ee7f96f6ebf894703
30, 21, 18, Hammerfall,   Gates Of Dalhalla,   https://i.scdn.co/image/160557b672fb155888fd44afac0a97ad0b1bfdbd
30, 21, 19, Hammerfall,   Gates Of Dalhalla,   https://i.scdn.co/image/074cfe00f15d4c69d12bc11622ec6eecfdc8ea94
29, 21, 18, Hammerfall,   Gates Of Dalhalla,   https://i.scdn.co/image/e5d1b0b753e61bc1088404b5256603932eefeab8
24, 20, 19, Metallica,   S & M,   https://i.scdn.co/image/fdfaf41a921c4c55527d1f88cec0014fc04a32f8
24, 20, 19, Metallica,   Garage Inc.,   https://i.scdn.co/image/807d725709ab669fa4ae0a064532dfe4b06da476
31, 23, 22, Metallica,   Kill 'Em All (Remastered),   https://i.scdn.co/image/3dec3d3474b257d0f07b57e017f72015e719f8b0
31, 24, 23, Iron Maiden,   Killers (1998 Remastered Edition),   https://i.scdn.co/image/59d051212f87084ebc41971d1e408ae9908810bb
30, 25, 22, Black Sabbath,   Technical Ecstasy (Remastered Edition),   https://i.scdn.co/image/b482f01fb4ca4ae31c65bd3ff92e45e93e3f889a
30, 25, 22, Black Sabbath,   We Sold Our Soul for Rock 'n' Roll,   https://i.scdn.co/image/0f941e67d8ddbc1158a915e94331a1b268c63fb1
27, 25, 23, Bullet For My Valentine,   The Poison (Deluxe Version),   https://i.scdn.co/image/7c6208595c51ea89f9322af9cbaefd0cb0dd89e3
27, 26, 21, Motörhead,   March Or Die,   https://i.scdn.co/image/8871e4d0c2d3d3ac5c884c89b070203502400f4c
27, 24, 19, Motörhead,   March Or Die,   https://i.scdn.co/image/c17b4bce6f3442e79e94f1e98e10123b62c283b2
27, 26, 18, Helloween,   Pink Bubbles Go Ape (Expanded Edition),   https://i.scdn.co/image/be2ef581cbb2743f5cc6fc15fddec6de4e8c198f
29, 28, 27, Dimmu Borgir,   Godless Savage Garden,   https://i.scdn.co/image/d276c68334ec78a4f6cc355bd0f23b4c1ab4778a
29, 28, 27, Dimmu Borgir,   Godless Savage Garden,   https://i.scdn.co/image/faa0de9ac86979ca93999720d1e0b6057c5945b5
31, 31, 30, Hammerfall,   Masterpieces,   https://i.scdn.co/image/093964ef1768d0cfb5a3244e41b7bc2cd389632b
29, 28, 31, Periphery,   Periphery III: Select Difficulty,   https://i.scdn.co/image/b4c20914ec773907bbf89f8aa81567b079703ff9
28, 29, 31, Black Sabbath,   The End (Live),   https://i.scdn.co/image/b7b9c00077718963de26fb99bdafdab9d048c16f
29, 29, 28, Dimmu Borgir,   Godless Savage Garden DELUXE,   https://i.scdn.co/image/655f3e951e54da9b8f16b40fb1b9678304e4aae7
28, 25, 29, Morbid Angel,   Illud Divinum Insanus,   https://i.scdn.co/image/7081d902a743386c9dcdfcdb5c02faf14b297e3b
31, 26, 26, Iron Maiden,   Piece of Mind (1998 Remastered Version),   https://i.scdn.co/image/d2c5918f11a5e26b7bea74f140d8cb83336df29a
28, 24, 26, Helloween,   Metal Jukebox,   https://i.scdn.co/image/ffb5e8cafb47cceeadbb7d37a4f00a1a5171d280
27, 25, 24, Dimmu Borgir,   Death Cult Armageddon,   https://i.scdn.co/image/ed0b7fba92dd2c32f002b061ac021985c811c717
24, 26, 24, Hammerfall,   Built To Last,   https://i.scdn.co/image/a56833a86f43f0624a0c0af1afb00f2f21158f62
25, 25, 25, Hatebreed,   Perseverance,   https://i.scdn.co/image/537e5518248e766452381a3b88db9d76556fecf5
24, 24, 24, Morbid Angel,   Gateways To Anihilation,   https://i.scdn.co/image/bcaa8fce247f38d8ddc5893388aed56f254629d5
24, 24, 24, Helloween,   Master of the Rings (Expanded Edition),   https://i.scdn.co/image/ba5f6f40762ed65e22e1ea60432dd50117c547a0
24, 30, 31, Meshuggah,   Destroy Erase Improve,   https://i.scdn.co/image/06614f8107fa8297ca94c785857e95820e22b7b4
24, 30, 30, Meshuggah,   Destroy Erase Improve,   https://i.scdn.co/image/2ce2c8d7b86adaf123f88a8472c5db76fd06b187
25, 31, 31, Meshuggah,   None (EP),   https://i.scdn.co/image/6800966418d25e443c38860616b5aee8e032d0d9
22, 26, 26, Sepultura,   Machine Messiah,   https://i.scdn.co/image/4d18203aa1133c4c9f264212779237c7b75982bb
23, 23, 23, Helloween,   Master of the Rings,   https://i.scdn.co/image/53489f7c9459fd3f90a8bfef469bf79e885dd701
22, 20, 20, Metallica,   S & M,   https://i.scdn.co/image/3723111645cb827a1ee4a29364c7e4587dfee7e3
22, 20, 20, Metallica,   S&M,   https://i.scdn.co/image/390d4603d8c25a1635863fafd129e86560b2b60d
21, 21, 21, Opeth,   Still Life (Remastered),   https://i.scdn.co/image/b2dca2feda6125cc785a1d04f4f9b46c1fd73f28
21, 21, 21, Alestorm,   Back Through Time,   https://i.scdn.co/image/20b882aeff88d63b4ee7ad70ac91d153e4f8a4f2
20, 20, 18, Metallica,   Hardwired…To Self-Destruct (Deluxe),   https://i.scdn.co/image/47da19a3aa94d5f95e32dd79ad7cc7257eea0533
22, 21, 17, Helloween,   The Time of the Oath,   https://i.scdn.co/image/6e2f9509ffe1f9e76c9dbb7045d5bb0dac37264f
19, 21, 18, Metallica,   Hardwired…To Self-Destruct (Deluxe),   https://i.scdn.co/image/cb1e3828a1e8b7156ef6cfc027c68cafff904323
19, 18, 18, Iron Maiden,   Maiden England '88 (2013 Remastered Edition),   https://i.scdn.co/image/46e64f6616c7047f3dc95fcc4d58ca0ae294720d
19, 18, 19, Nightwish,   The Sound Of Nightwish Reborn,   https://i.scdn.co/image/c2d1fa0b92ab6d8ad6514ed06102b7c0a9119594
16, 17, 16, Anthrax,   Attack Of The Killer B's,   https://i.scdn.co/image/124c23322ef7cd81d794462db10447129306b2a5
16, 17, 16, Anthrax,   Persistence Of Time,   https://i.scdn.co/image/ba19a1077ee1841856590f1b26b114935ec8e6e6
16, 17, 16, Anthrax,   Persistence Of Time,   https://i.scdn.co/image/7bdd942b41cbb0f3eb8c863aa6b26dee858802ef
16, 17, 16, Anthrax,   State Of Euphoria,   https://i.scdn.co/image/597f31f9af0375e6a9e2f1cf70f3dea0313d36b9
15, 16, 18, Megadeth,   Peace Sells...But Who's Buying?,   https://i.scdn.co/image/84d4ab28d06a595a59009629c38bb1c1769d592d
15, 16, 18, Megadeth,   Killing Is My Business...And Business Is Good!,   https://i.scdn.co/image/cf1a868c41fd2135143d9abbd35ec89278b3b552
15, 16, 18, Anthrax,   For All Kings (Deluxe),   https://i.scdn.co/image/c93c6daa5b5001527d5de525b3c10289a206549c
15, 16, 18, Anthrax,   For All Kings,   https://i.scdn.co/image/6390dc0838042dc07432971ffadc21700516beda
12, 19, 18, Bullet For My Valentine,   Scream Aim Fire,   https://i.scdn.co/image/b84281fce947d179b30f0e470afc70521eae18e5
27, 29, 48, Iron Maiden,   A Matter of Life and Death,   https://i.scdn.co/image/62b43a4eb389584ec0b5d1e359d7ff7223d7e496
17, 17, 52, Apocalyptica,   7th Symphony,   https://i.scdn.co/image/079835025ed0a329204f10ea5e689d94f3e54890
29, 30, 44, Apocalyptica,   Amplified - A Decade Of Reinventing The Cello,   https://i.scdn.co/image/a3c5c4e7079f38749a0204cf3495e2f7fd448ca9
27, 30, 35, Judas Priest,   Ram It Down,   https://i.scdn.co/image/683805583adada0d66480f9e4f0967d1824857cd
20, 26, 35, Nightwish,   Dark Passion Play (Deluxe Edition),   https://i.scdn.co/image/a76e135a039c8c814296d2262e49c05edc5a47bb
20, 26, 35, Nightwish,   Dark Passion Play,   https://i.scdn.co/image/c308a7cedffcd5e3191d6bc4545a7d345ec7586e
20, 26, 35, Nightwish,   Dark Passion Play (International Version),   https://i.scdn.co/image/7868a3f5dd59ee2a64a59a7f82f07f80f155bb23
23, 34, 33, Disturbed,   Indestructible (Japanese Version),   https://i.scdn.co/image/a1f13067ff9b1a65623e734ecf53890d48fb835f
22, 32, 33, Disturbed,   Ten Thousand Fists (Standard Edition),   https://i.scdn.co/image/e56552bbe33617bf4e68034f1e582d901c46e3a4
24, 44, 36, Opeth,   Sorceress,   https://i.scdn.co/image/3e3cbeff410adb4c3fc3b158a7cdcc5edaf12ae8
24, 44, 36, Opeth,   Sorceress,   https://i.scdn.co/image/ea51e142d62a7af5379181204dc7d02180a67c0c
24, 44, 37, Opeth,   Sorceress,   https://i.scdn.co/image/d562ba978c2806fcd4db0535aac6b692baf32da4
28, 46, 38, Hammerfall,   Threshold,   https://i.scdn.co/image/4348aa56f6b3b26e1fecc7c878d22e5476fba0b1
29, 35, 36, Meshuggah,   Destroy Erase Improve - RELOADED,   https://i.scdn.co/image/41fed769d82438df3ac73199ac07a9a4ec8d90e5
31, 36, 41, Judas Priest,   Painkiller,   https://i.scdn.co/image/d9b728446d892db1627ef5c1f1f6990d934e2517
30, 34, 46, Meshuggah,   Contradictions Collapse,   https://i.scdn.co/image/a06f29e7c16d086742f613dab8b5732ec7f5ae7d
29, 40, 47, Motörhead,   Ace of Spades,   https://i.scdn.co/image/9e12f8d9115a952a9acb6f1b312f21c460332f73
18, 39, 53, Motörhead,   Bomber (Bonus Track Edition),   https://i.scdn.co/image/8841ed7d4d1ab6f8159305b84f9e75f559a9af50
19, 39, 50, Motörhead,   Bomber (Deluxe Edition),   https://i.scdn.co/image/c74d4b2681ef6e317e08898cd40be75e1715f3ee
30, 37, 48, Anthrax,   Caught In A Mosh - BBC Live In Concert (BBC Version),   https://i.scdn.co/image/1257f87f1dc90cc9adabce54017e6e2ccb729b07
27, 55, 44, Opeth,   Sorceress,   https://i.scdn.co/image/15b9dbdd9d08fd15784f9787826a025e6145e05e
18, 40, 31, Sepultura,   Blood-Rooted,   https://i.scdn.co/image/4d2be645285ecdb6309720c6c9ae255931220eaa
30, 37, 24, Opeth,   Watershed,   https://i.scdn.co/image/c84d5e70b3abb1fc03bc86a0e51ae85d93fd4350
31, 34, 29, Opeth,   Watershed (Special Edition),   https://i.scdn.co/image/ede3f34bf02b8702730828d146be95455eec16d6
18, 37, 12, System Of A Down,   Steal This Album!,   https://i.scdn.co/image/53220aed9aacb20f96470e6a875d7699e3c1b3d2
23, 47, 12, Dream Theater,   Awake,   https://i.scdn.co/image/b9e0bba8d35d15b96f441cd8ed30fd3e057f3f62
42, 55, 8, System Of A Down,   Steal This Album!,   https://i.scdn.co/image/96d115089ea33db75c9c402c420823771f592620
37, 37, 7, Deftones,   Koi No Yokan,   https://i.scdn.co/image/1627852c32ca8f8f3247a94c5520d818eb711352
43, 46, 23, System Of A Down,   Toxicity,   https://i.scdn.co/image/3b74b1b2557ec74868bea0dd5c99ed081d32b6f4
43, 46, 22, System Of A Down,   Toxicity,   https://i.scdn.co/image/932e185b217606caa34b837dbe30d54028de9cfc
43, 46, 22, System Of A Down,   Toxicity,   https://i.scdn.co/image/b40e4a88ae50ba256837a98005ac90df0177e62e
46, 47, 31, Blind Guardian,   A Twist In The Myth,   https://i.scdn.co/image/f01f18b3e39ebd3747fb8d9383273fefa59d1a2f
47, 43, 26, Deftones,   B-Sides & Rarities,   https://i.scdn.co/image/273903eb0272c6f7167a19a662c2e28c4dbfaea1
45, 37, 27, Black Sabbath,   Reunion,   https://i.scdn.co/image/324c72f0f044fb394d997698a47301b9a05054f4
42, 38, 27, Alestorm,   No Grave But The Sea,   https://i.scdn.co/image/48b5334549f5b1dbfafaf5136e2c5f272792e34a
40, 39, 29, Rammstein,   PARIS (LIVE),   https://i.scdn.co/image/31625c41a10b0ae465d13257b748e2f5b509df3f
40, 37, 31, Sepultura,   The Mediator Between Head And Hands Must Be The Heart,   https://i.scdn.co/image/d53d786cc209743f4d37e3a624216c1b4b15aadd
47, 38, 30, Korn,   Issues,   https://i.scdn.co/image/2d43e8cad20fcdab479acca165bb97bd70d01246
40, 34, 27, Deftones,   B-Sides & Rarities,   https://i.scdn.co/image/ba325cd44779d3db110c91bd2e69d37af2687647
46, 33, 24, Blind Guardian,   Tales from the Twilight World (Remastered 2007),   https://i.scdn.co/image/d8b0eba92cad0617f2e7a50aab164093ce93f9aa
44, 33, 23, Helloween,   Walls of Jericho (Bonus Tracks Edition),   https://i.scdn.co/image/c9dfcb70eae7c78a07828bf5a7686472a6dfab3a
41, 36, 23, Motörhead,   Ace of Spades (Rarities Edition),   https://i.scdn.co/image/c244755842a6f0923123ceb9178c9a8e1285a415
42, 34, 23, Deftones,   B-Sides & Rarities,   https://i.scdn.co/image/ba325cd44779d3db110c91bd2e69d37af2687647
42, 34, 23, Deftones,   Deftones (U.S. Version-Enh'd),   https://i.scdn.co/image/65b135b9adea8eb3ee7e07c674c424176b76c593
42, 34, 23, Deftones,   White Pony (U.S. Version),   https://i.scdn.co/image/06fb60f4f4ad869f4c15b7e1e50769408fb15ca5
52, 33, 23, Arch Enemy,   As The Stages Burn! (Live at Wacken 2016),   https://i.scdn.co/image/9b518c8c7181eeaf353204ec5359c453ec1753eb
52, 32, 25, Blind Guardian,   At The Edge Of Time (Deluxe Bonus Version),   https://i.scdn.co/image/f305ef78dba5df66fb47744b2ace5091363a3ae8
53, 34, 24, Arch Enemy,   Will To Power,   https://i.scdn.co/image/f2ea949ac100e05855e0142f64dba43ee82b7faa
54, 33, 27, Trivium,   Shogun,   https://i.scdn.co/image/1abee4e4a6eef76a93681bcceed91fc068a2680b
54, 33, 27, Trivium,   Ascendancy (Special Edition Bonus Tracks),   https://i.scdn.co/image/dd2d7721cca224488729acc184573c0e517b3cdb
53, 33, 27, Trivium,   Shogun (Special Edition),   https://i.scdn.co/image/28c3df58917e50206db08ae954b19a75cd0370fe
53, 33, 27, Trivium,   The Crusade,   https://i.scdn.co/image/df5f9fc16cab58853b6a451e5f1aa10380933113
48, 35, 29, Meshuggah,   The Violent Sleep of Reason,   https://i.scdn.co/image/5ba2de5cedd3469175ae933ad68761d0e52b0d84
54, 36, 31, Trivium,   In Waves (Special Edition),   https://i.scdn.co/image/5194f3860bd53aa613edcfc5ef09a995b599f049
53, 42, 27, Iron Maiden,   The Number Of The Beast (1998 Remastered Edition),   https://i.scdn.co/image/4decacbbeac837df1adfd1f2d9e06c9eceb9ff44
49, 44, 28, DevilDriver,   Beast,   https://i.scdn.co/image/39004b21c4826dc2b438b1762657feeaaa88645e
52, 43, 23, Nightwish,   Endless Forms Most Beautiful,   https://i.scdn.co/image/cd3d9e02f1b7926665c4c639cfd378fbb3a9dee8
52, 43, 23, Nightwish,   Endless Forms Most Beautiful,   https://i.scdn.co/image/96b32d9d3f147527c33d80127fea66af429f8451
58, 43, 17, Avenged Sevenfold,   Waking The Fallen: Resurrected,   https://i.scdn.co/image/eb9fe262a05ea3db106a1e430b756a5624ca8a9c
61, 46, 31, Cradle Of Filth,   The Principle Of Evil Made Flesh,   https://i.scdn.co/image/15e0d3e086189d7288984e049475f07655dab415
58, 43, 31, Black Sabbath,   Reunion,   https://i.scdn.co/image/324c72f0f044fb394d997698a47301b9a05054f4
61, 37, 26, Killswitch Engage,   Disarm The Descent (Special Edition),   https://i.scdn.co/image/a4040e3a0be7893d9d98eb3c1e43b34d816b719f
58, 35, 20, Cradle Of Filth,   Midian,   https://i.scdn.co/image/0018771530011f219f70e59527b428bd595b29f7
49, 49, 30, System Of A Down,   Steal This Album!,   https://i.scdn.co/image/76f48e8e0c505a3b7fb544e71736a84f5c16dee1
63, 58, 31, Nightwish,   Imaginaerum (Deluxe Version),   https://i.scdn.co/image/ecdbf699c73ec4a3e279277d7126f4afd54be597
63, 58, 31, Nightwish,   Walking In The Air - The Greatest Ballads,   https://i.scdn.co/image/776539eeb063ae876e03aa1f536ef5fd0d7b11dd
63, 58, 31, Nightwish,   Walking in the Air - the Greatest Ballads,   https://i.scdn.co/image/1d1cf4bb50b15545b7022760085419e9e6a1f585
63, 58, 31, Nightwish,   Made in Hong Kong (And in Various Other Places),   https://i.scdn.co/image/6e53e93d9415d345d677a70b2d5f09a4a66d6e2c
60, 61, 43, Nightwish,   Endless Forms Most Beautiful (Deluxe Version),   https://i.scdn.co/image/cd3d9e02f1b7926665c4c639cfd378fbb3a9dee8
60, 52, 42, Blind Guardian,   Nightfall in Middle Earth (Remastered 2007),   https://i.scdn.co/image/c157b409157616a67d53fcae675296eb981a9318
59, 52, 43, Morbid Angel,   Altars Of Madness,   https://i.scdn.co/image/597be03de045bff6a8e3e322cb71bda168d9ef8c
56, 55, 46, Hammerfall,   Masterpieces,   https://i.scdn.co/image/48ab757b04430a3dccd1f20e36748d957ae3bf6b
63, 51, 46, Nightwish,   Endless Forms Most Beautiful,   https://i.scdn.co/image/61a5ea583e4d87e4e3ee646d8a9ae36452200f68
63, 51, 46, Nightwish,   Endless Forms Most Beautiful,   https://i.scdn.co/image/61a5ea583e4d87e4e3ee646d8a9ae36452200f68
63, 51, 46, Nightwish,   Endless Forms Most Beautiful,   https://i.scdn.co/image/ae38e3bab771133291f1486d8be2ac96de50d9c3
63, 51, 46, Nightwish,   Endless Forms Most Beautiful (Deluxe Version),   https://i.scdn.co/image/02db998b6d0040300ae7e6840256525c89af070e
56, 50, 42, Blind Guardian,   A Night at the Opera (Remastered 2017),   https://i.scdn.co/image/bfdff0a041b5333f6be4e27b298f6dd200085e41
56, 50, 41, Blind Guardian,   A Night at the Opera (Remastered 2017),   https://i.scdn.co/image/bebdaeb7e295907f5a10b4be515a155191d60786
56, 50, 41, Blind Guardian,   Nightfall in Middle Earth (Remastered 2007),   https://i.scdn.co/image/7246f87f83726034c46780af8694a2c2f023965e
59, 50, 40, Blind Guardian,   Nightfall In Middle Earth (remastered (2007)),   https://i.scdn.co/image/2c1c7f7ac5c5d6b7c923832cbb306bbcc715a2e7
58, 49, 41, Metallica,   Garage Inc.,   https://i.scdn.co/image/aeef48af9a77204f441b41107b9b6b2b8bad490d
58, 48, 41, Metallica,   Garage Inc.,   https://i.scdn.co/image/b9bd225d69141727e50bc769f63d43c17ea3cf95
61, 49, 32, Cradle Of Filth,   V empire Or Dark Faerytales In Phallustein,   https://i.scdn.co/image/0d48f33b65304628107e67f59ccb848f2a0d7bf2
62, 49, 32, Cradle Of Filth,   Dusk & Her Embrace,   https://i.scdn.co/image/4e00a2b4ac97c82a95b0b7f799bcc30da8943f2f
56, 52, 35, Alestorm,   No Grave But The Sea (Deluxe Edition),   https://i.scdn.co/image/ad926497f64d6de82cd6fba7161b5db39a7a9495
59, 50, 39, Blind Guardian,   A Night At The Opera (remastered (2017)),   https://i.scdn.co/image/3556f8ed917c918537e91811c1d3e5ad7c07394b
59, 50, 39, Blind Guardian,   Nightfall in Middle Earth (Remastered 2007),   https://i.scdn.co/image/23dc5fee522d868e36232975668838eb075d6899
59, 50, 39, Blind Guardian,   Nightfall in Middle Earth (Remastered 2007),   https://i.scdn.co/image/8d8929a55cc8b9a868d2446be815bcf281edb422
59, 50, 39, Blind Guardian,   The Forgotten Tales (Remastered 2007),   https://i.scdn.co/image/55e4be336f98c095036ff80f7d679773f98c0ac5
51, 52, 35, Blind Guardian,   The Forgotten Tales (Remastered 2007),   https://i.scdn.co/image/b428ac1a85bfbd8de617753211063045bc3086be
51, 52, 35, Blind Guardian,   The Forgotten Tales (remastered (2007)),   https://i.scdn.co/image/3995a72eac2c659a4308861d9181f85e335cbe28
55, 49, 41, Blind Guardian,   A Night at the Opera (Remastered 2017),   https://i.scdn.co/image/28a58f127ff93738f14f8d5924e03e86e497f9d6
55, 48, 43, Helloween,   Live on 3 Continents,   https://i.scdn.co/image/6c98946daed280e5e9890f381aab7d70bb9abeed
55, 48, 43, Alter Bridge,   Live from Amsterdam 2008,   https://i.scdn.co/image/a4d59e61940126a030cefa8740abd6dfb371aee8
54, 50, 47, Killswitch Engage,   Alive or Just Breathing [Topshelf Edition],   https://i.scdn.co/image/fc694dc22c0df62fe6ad5fe510d4f7cfcd018b6d
53, 51, 46, Blind Guardian,   A Twist in the Myth,   https://i.scdn.co/image/8e33e066ecb90a96333f559ceafd264663688d35
53, 49, 47, Killswitch Engage,   Alive or Just Breathing,   https://i.scdn.co/image/909aacf92d22a2cf53b2c9d3a5e303e25ddd6684
49, 50, 47, Judas Priest,   Demolition (Clean Version),   https://i.scdn.co/image/b93cffcf5d72023ff69bd881b04b3eafbee2d83a
48, 54, 45, Apocalyptica,   Worlds Collide,   https://i.scdn.co/image/5e6439da2fc19ee00707464e6704bfb7b4172e6f
55, 54, 47, Hammerfall,   Steel Meets Steel - 10 Years Of Glory,   https://i.scdn.co/image/45238c501db878a90191a7d42e23fe1c9d4bca06
55, 53, 41, Morbid Angel,   Altars Of Madness,   https://i.scdn.co/image/69a9b73a2d3f34713d16fbb218eec99fd9868392
51, 56, 47, Iron Maiden,   Killers (1998 Remastered Version),   https://i.scdn.co/image/0de843192a1793096294725b7f10c9e873fdeee0
45, 50, 38, Hammerfall,   Legacy Of Kings,   https://i.scdn.co/image/769ba1518b87437b5f11e5c8808a39acf6145e28
39, 52, 34, Opeth,   Watershed,   https://i.scdn.co/image/ede3f34bf02b8702730828d146be95455eec16d6
47, 55, 52, Morbid Angel,   Gateways to Annihilation,   https://i.scdn.co/image/700b64368ec0be5ca3f3efa542a02ea2f28b4717
45, 50, 50, Nightwish,   Vehicle Of Spirit: Wembley Arena (Live),   https://i.scdn.co/image/3c4b3cdb75bce5090ada703e43e316c2f79e09e3
41, 51, 55, Morbid Angel,   Formulas Fatal To The Flesh,   https://i.scdn.co/image/a3d9e52341349f4f224681ad41eb6b5ea0625b5d
33, 60, 49, At The Gates,   Slaughter Of The Soul,   https://i.scdn.co/image/b1c171e0e6d46b774c9fa5199dc5e6f866e42820
33, 60, 50, At The Gates,   Suicidal Final Acts,   https://i.scdn.co/image/ed38d4978eb950efe6a24d1e0be425189c8ffc08
33, 60, 50, System Of A Down,   Hypnotize,   https://i.scdn.co/image/31292ad6f826b3beaad5f7e327c491d715d4205e
53, 63, 56, Metallica,   Reload,   https://i.scdn.co/image/f0d7210ed0036b9a5a0cfb6208655d1560a1dd25
59, 58, 61, Bullet For My Valentine,   Scream Aim Fire,   https://i.scdn.co/image/30a51b9eaae2165558ad0a54a2a420eb0e805470
59, 58, 61, Bullet For My Valentine,   Scream Aim Fire,   https://i.scdn.co/image/f50d040d361c1aabc66725510bf21c7a27c139bb
59, 58, 61, Bullet For My Valentine,   Scream Aim Fire,   https://i.scdn.co/image/24021c80e44e0e726f06a06a27d2b9d180be15fe
58, 59, 61, Korn,   See You On the Other Side,   https://i.scdn.co/image/e7bc470f67b359bf1bb18d10efc1be419b3d9312
58, 59, 61, Korn,   Take A Look In The Mirror,   https://i.scdn.co/image/a314c8eb36fc015846bc336389c054fe65af0286
58, 59, 61, Korn,   Take A Look In The Mirror,   https://i.scdn.co/image/a314c8eb36fc015846bc336389c054fe65af0286
58, 59, 61, Korn,   Take A Look In The Mirror,   https://i.scdn.co/image/e29d09b98a7717fd5d62638fc4f141922fc87143
59, 59, 61, Korn,   Untouchables,   https://i.scdn.co/image/a19a6d653814f59c0b7a0bca19fe4a8c04bb3d16
60, 60, 60, Killswitch Engage,   Incarnate,   https://i.scdn.co/image/e10db295c1aafb8a1c9a71bc44bf4e7b2f6b5a9a
63, 60, 58, Metallica,   Master of Puppets (Remastered),   https://i.scdn.co/image/358a2fb145a535539c39a9f317541248bd173ac4
61, 63, 58, Mastodon,   Once More 'Round The Sun,   https://i.scdn.co/image/a538f3e764f2d8ca1840d6f884c94e2e395a35f6
61, 63, 58, Mastodon,   The Hunter,   https://i.scdn.co/image/f21fa9334017873e1c14cb35f4e2541b83e7f567
59, 59, 56, Blind Guardian,   Live Beyond the Spheres,   https://i.scdn.co/image/269c7e97767e5636db9542a5aada4f4f6638172c
56, 56, 56, Dream Theater,   Live At The Marquee,   https://i.scdn.co/image/516d9d17a0c793f6fa058bb0089fa07579eb737d
56, 56, 58, Motörhead,   Hammered,   https://i.scdn.co/image/ac61192832d5c55dde1e8a7ef0b34b702bc21602
60, 59, 52, Slipknot,   .5: The Gray Chapter,   https://i.scdn.co/image/00274ae9e9bf14253bd160213e77af341df597eb
60, 59, 52, Slipknot,   .5: The Gray Chapter (Special Edition),   https://i.scdn.co/image/00274ae9e9bf14253bd160213e77af341df597eb
60, 59, 52, Slipknot,   .5: The Gray Chapter (Special Edition),   https://i.scdn.co/image/00274ae9e9bf14253bd160213e77af341df597eb
60, 59, 52, Slipknot,   All Hope Is Gone,   https://i.scdn.co/image/acc17fd5f2cf49ca36c64a80cc7ff99bcc2e348e
61, 61, 55, Meshuggah,   The Ophidian Trek,   https://i.scdn.co/image/16676227940a33f5ec3cf74c3da11a3d136edad5
60, 59, 51, Slipknot,   Day Of The Gusano (Live),   https://i.scdn.co/image/80bd9bb26b8b512f73163937324c0c17d8c8ab05
